,date,tweet,past_tense,present_tense,future_tense,replies_count,retweets_count,likes_count,pos_score,neg_score,neutral_score,sentiment,Sentiment_Score,user
1203,2017-10-17 06:15:05,"🇳🇿 Kiwi not getting any love from hot CPI because won't change outlook for next rate hike, which isn't seen until at least Nov 2018. $NZDUSD",1,1,1,0,0,0,0.11623221,0.38242602,0.50134176,Neu,-0.2661938,joelkruger
1204,2017-10-17 06:06:05,$EURUSD under pressure. Where could we be headed next? Pay attention to this major confluence of support  ,1,0,1,0,2,0,0.06370028,0.02141033,0.9148894,Neu,0.04228995,joelkruger
1208,2017-10-16 13:08:02,$EURUSD 100-Day SMA wants to coincide with what could be big neckline support on an H&S top that yes...projects setbacks to 1.1200s.,0,1,1,0,2,4,0.6666522,0.18959963,0.14374821,Pos,0.47705257,joelkruger
1211,2017-10-16 09:32:02, .....and we know Axe Capital is a big player here so will be interesting 😎👍 ,0,1,1,0,0,0,0.29402068,0.010053277,0.6959261,Neu,0.2839674,joelkruger
1218,2017-10-15 22:51:02,"$EURUSD could continue with the 2017 uptrend, but while below 1.1910, there is risk for an H&S top that projects a drop into the 1.1200s.  ",0,1,1,2,7,20,0.020902107,0.9584455,0.020652354,Neg,-0.9375434,joelkruger
1219,2017-10-15 22:37:00,"Stocks have every excuse to rally post US CPI, retail sales. lowerFORever?   To quote the beloved Commodus:  ""You simply won't.....die!""  ",0,1,1,0,0,1,0.17199737,0.18226586,0.64573675,Neu,-0.0102684945,joelkruger
1222,2017-10-15 21:00:00,$EURUSD: Just because the Euro's in an uptrend doesn't mean you should jump in and but at current levels  ,0,1,1,0,1,1,0.17628059,0.25340092,0.5703185,Neu,-0.077120334,joelkruger
1225,2017-10-13 08:10:02,Here's some $EURUSD analysis for Friday that suggests the next big move could actually be lower  ,0,1,1,1,3,3,0.063755095,0.02411072,0.9121342,Neu,0.039644375,joelkruger
1248,2017-10-06 14:56:05,"  Doug may be suggesting skew from storm overtime hours, but I was actually taken with upward revision to August series, which wasn't skewed.👍",1,1,1,0,0,1,0.078516275,0.33791283,0.58357084,Neu,-0.25939655,joelkruger
1249,2017-10-06 13:53:01,What do you know! Hourly earnings shooting up!! Should turn heads over at the Fed. Not good for equity market valuations. stocks bitcoin,0,1,1,0,1,1,0.061863083,0.5247411,0.41339576,Neg,-0.46287802,joelkruger
1250,2017-10-06 09:55:01,Because analyst NFPs calls all over the place:   - We could see volatility  Because overall forecast is low   - Risks tilted in USD favor  ,1,1,1,0,0,2,0.28148282,0.081286356,0.6372308,Neu,0.20019646,joelkruger
1258,2017-10-03 06:05:05," research desk talks about $EURUSD, measured moves and what this tells us about where we could be headed next  ",1,1,1,0,1,1,0.07672299,0.015401216,0.9078758,Neu,0.061321773,joelkruger
1260,2017-10-02 21:30:05,Very sad. Huge loss. HUGE! Rest in peace Tom. You will be missed but also well remembered as your music lives on. You were one of a kind!  ,1,1,1,1,0,2,0.19970778,0.03536194,0.7649303,Neu,0.16434583,joelkruger
1263,2017-10-02 08:35:01,About the 5 MINUTE CHART EXPERIMENT and how it helps illustrate why the Euro could be headed lower still   $EURUSD,1,1,1,0,1,2,0.17301935,0.45631105,0.3706696,Neg,-0.2832917,joelkruger
1270,2017-09-28 10:35:02,Therapist: What do you see when you look at this?  Patient: Isn't it obvious? The PM is begging to exit his short but the Fed won't let him.  ,0,1,1,0,2,1,0.03773206,0.23762828,0.7246397,Neu,-0.19989622,joelkruger
1272,2017-09-28 08:52:03,Why the Yen will rally again (USDJPY lower😉)   yen $USDJPY fed yielddifferentials safehaven risk stocks,1,1,1,0,0,3,0.2397647,0.06656142,0.6936739,Neu,0.17320329,joelkruger
1275,2017-09-27 13:47:04,"$GBPUSD has been showing signs of longer term bottom in 2017, so dips should be bought. Initial support comes in at 1.3270 (prev Aug high).",1,1,1,0,2,3,0.07337819,0.8829807,0.04364109,Neg,-0.8096025,joelkruger
1276,2017-09-27 13:45:01,"$USDJPY break above 111.00 several sessions back has opened return to 2017 range high in 114.00s, but wouldn't rule out another big drop.",1,1,1,1,0,1,0.23813793,0.72118855,0.040673453,Neg,-0.4830506,joelkruger
1277,2017-09-27 13:43:00,$USDJPY ripping but given daily ATR should stall soon...for today. $EURUSD also stretched and should find support around 1.1700...for today  ,1,1,1,0,0,1,0.21836032,0.73809606,0.04354364,Neg,-0.51973575,joelkruger
1283,2017-09-26 11:39:04,"Right now $USDJPY going with the broad USD recovery story as equities hold up. But if stocks turn down today, could see USDJPY lower again.",0,1,1,0,1,2,0.020999294,0.95078576,0.02821497,Neg,-0.92978644,joelkruger
1284,2017-09-26 11:36:02,$EURUSD really extended intraday and projected daily low based on ATR comes in around 1.1770. Setbacks could be limited from here for today.  ,1,1,1,1,2,0,0.08848738,0.6514376,0.2600751,Neg,-0.5629502,joelkruger
1286,2017-09-26 09:03:04,The Euro just took out important support. Where could we be headed next?    ,1,0,1,0,3,5,0.091649905,0.033792686,0.87455744,Neu,0.05785722,joelkruger
1289,2017-09-26 05:53:01, Hey Vitalik...would love to send you a DM. Hope all well. Best - JK,0,0,1,0,0,0,0.2265611,0.010974128,0.7624648,Neu,0.21558698,joelkruger
1295,2017-09-25 16:24:02,A taste of the traditional with risk off translating into the flow one would expect to see. $EURCHF and $EURJPY hit hardest intraday.  ,1,1,1,0,0,1,0.73254716,0.2052588,0.062193938,Pos,0.5272884,joelkruger
1303,2017-09-24 10:18:02,"Looking forward to upping coverage of blockchain, crypto over coming months. There will be big bumps here..but the tech is here to stay.",0,1,1,0,1,0,0.5858583,0.016451415,0.3976904,Pos,0.56940687,joelkruger
1306,2017-09-20 15:54:03,Markets will shock and if you don't know what you're doing they have a way of always shocking the wrong way.,0,1,1,0,0,2,0.02271129,0.53590804,0.44138062,Neg,-0.51319677,joelkruger
1317,2017-09-19 05:38:02,$EURUSD and measured moves: At some point the Euro is going to break. Here's where it could be headed when it does  ,1,1,1,0,2,2,0.059796393,0.06413774,0.8760659,Neu,-0.004341349,joelkruger
1325,2017-09-17 21:26:00,$EURUSD: What will it take to rattle this intense uptrend in 2017?  research desk takes a closer look  ,0,1,1,0,5,5,0.05251962,0.050400373,0.89708006,Neu,0.0021192469,joelkruger
1327,2017-09-17 09:21:00, Hi Jurgen- can you send me a DM. Thanks. Look forward. 👍,0,0,1,0,0,0,0.103852265,0.01651303,0.8796347,Neu,0.08733924,joelkruger
1336,2017-09-14 15:59:01,Are you bullish or bearish this chart?   (Will let you know what chart it is soon) 👊😎  ,0,1,1,23,1,1,0.041445687,0.039590713,0.91896355,Neu,0.0018549748,joelkruger
1337,2017-09-14 14:25:03,OIL on the move....up up and away! But coming into some solid resistance so could stall out soon.,1,1,1,1,1,2,0.06979633,0.8986339,0.03156983,Neg,-0.8288376,joelkruger
1339,2017-09-14 14:17:00, Hey Sky...question for ya. Can you shoot me a DM. Cheers.,0,0,1,0,0,0,0.08815485,0.02403104,0.88781404,Neu,0.06412381,joelkruger
1341,2017-09-14 11:57:03,$EURUSD may be rolling over but no reason to be letting go just yet  ,0,1,1,0,3,1,0.12164353,0.09221335,0.7861431,Neu,0.02943018,joelkruger
1348,2017-09-13 09:52:04,Not sure the BOE will be super excited about leaning to the hawkish side with wage growth subdued. Offsets impact of Tuesday's CPI. $GBPUSD,1,1,1,0,1,2,0.11434447,0.39802942,0.48762608,Neu,-0.28368494,joelkruger
1350,2017-09-12 11:04:04,A correlation that won't hold up  ,0,0,1,0,2,0,0.3425834,0.07468716,0.5827294,Neu,0.26789623,joelkruger
1356,2017-09-08 06:37:02,$USDJPY just couldn't hold up that 108.00 level.....  ,0,0,1,0,2,12,0.041166067,0.7150381,0.24379575,Neg,-0.67387205,joelkruger
1358,2017-09-08 06:20:04,A fresh technical overview of major markets and where we could now be headed after some big breaks   $USDJPY $EURUSD,1,0,1,0,1,1,0.123261474,0.016797634,0.8599409,Neu,0.10646384,joelkruger
1366,2017-09-06 15:58:05,I'm sure everything will be ok without Fischer.  ,1,1,1,0,2,0,0.16568752,0.15950021,0.6748123,Neu,0.006187305,joelkruger
1371,2017-09-06 15:16:05, Shocked they did that. Wasn't necessary. They are being way too aggressive IMO. Could be dangerous.,1,1,1,0,0,1,0.015646778,0.86790085,0.11645241,Neg,-0.8522541,joelkruger
1378,2017-09-04 09:47:04,"Central bank policy incentives have made markets more immune to geopolitical risk. But now that policy normalizing, will this immunity fade?",1,1,1,0,0,2,0.12844491,0.048896343,0.8226587,Neu,0.07954857,joelkruger
1382,2017-09-01 14:12:05,Yes...US jobs disappointing. But would also be dangerous for the BoC to hike again in 2017 with Fed odds scaling back further. 🇨🇦 $USDCAD,0,1,1,0,0,1,0.051654235,0.8123973,0.13594854,Neg,-0.7607431,joelkruger
1383,2017-09-01 13:57:01,Hourly earnings continue to be a big FAIL. This is the part of the data that artificial central bank support apparently can't fix! 🙈,0,1,1,0,0,3,0.010066456,0.9559581,0.033975393,Neg,-0.9458917,joelkruger
1387,2017-08-31 09:07:05, Cheers👍 Proprietary dashboard for JKonFX clients so can quickly scan and know what's moving and where to be looking    ,0,1,1,1,0,1,0.060199652,0.011874958,0.9279254,Neu,0.048324693,joelkruger
1389,2017-08-31 07:44:01,Watch out for $USDJPY 111.00. The major pair may look like it wants to head back to 115.00...but only if can close above 111.00 first. yen  ,0,1,1,0,1,5,0.28777,0.05877717,0.6534528,Neu,0.22899283,joelkruger
1394,2017-08-30 14:39:04,"  I think it can be explained, but I don't think that correlation has gone away. If things intensify, I believe it will return. 👍",1,1,1,1,0,0,0.11110109,0.040799208,0.84809977,Neu,0.07030188,joelkruger
1396,2017-08-30 07:28:01,"While risk off has been tied to USD weakness of late, would be hard to justify sustained USD departure from traditional safe haven status.",1,1,1,4,0,4,0.06807536,0.84385085,0.0880738,Neg,-0.7757755,joelkruger
1399,2017-08-29 18:54:04,Would be nice to see $GBPCAD get back above 1.6255 on a daily close basis. Could set up possibility for bigger recovery. Long 1.6070.,0,0,1,1,0,4,0.70446306,0.039325718,0.25621125,Pos,0.66513735,joelkruger
1404,2017-08-29 09:13:04, Would expect to see downside pressure given reduction of risk appetite. Could suggest SNB activity.,1,0,1,0,0,0,0.13216525,0.40398976,0.46384495,Neu,-0.2718245,joelkruger
1406,2017-08-29 09:08:00,$EURUSD  1) Hourly RSI &gt; 80 2) Daily ATR is 90 points 3) Daily low is 1.1955 4) Daily low + ATR = 1.2045  Should we expect reversal here?,1,1,1,3,2,7,0.020159503,0.8098343,0.17000617,Neg,-0.7896748,joelkruger
1407,2017-08-29 09:01:04,Still not into this whole risk off USD off thing. Don't expect this correlation to hold up if risk keeps coming off. USD should rally. VIX,0,1,1,0,0,4,0.7985039,0.0763871,0.12510905,Pos,0.72211677,joelkruger
1411,2017-08-29 08:57:00, Indeed. $EURUSD 1.2045 and $EURGBP 0.9300 are projected highs for today using ATR. So will be hard for much of an overshoot beyond these.,1,1,1,0,1,1,0.060468744,0.61258745,0.32694384,Neg,-0.5521187,joelkruger
1412,2017-08-29 08:22:03,$EURUSD hourly RSI above 80. Daily ATR around 90 pts. 90 pts off daily low is 1.2145. Suggests will be hard to get much above 1.2145 today.  ,0,1,1,1,2,3,0.08359985,0.6243679,0.29203224,Neg,-0.540768,joelkruger
1413,2017-08-29 08:07:05,"While $EURUSD run could extend through 1.2100, I believe it will stall ahead of 1.2200 for reversal back to 1.1500s. Weekly very overbought.",0,1,1,1,2,6,0.016586987,0.94875866,0.034654308,Neg,-0.9321717,joelkruger
1416,2017-08-28 18:16:00,Bought some $GBPCAD last week 1.6070. Nice to see follow through here. A daily close above 1.6200 could get the trade on its way.,0,0,1,2,0,4,0.7182041,0.017662333,0.26413354,Pos,0.70054173,joelkruger
1417,2017-08-28 09:08:02,"$EURUSD could extend to 1.2155 (see chart), but upside should be limited to there for now with weekly overbought and larger correction due.  ",1,0,1,0,5,4,0.122508496,0.7370198,0.14047173,Neg,-0.61451125,joelkruger
1426,2017-08-23 11:53:04,$EURGBP break of 2016 high at 0.9264 pushes rate to highest level since Oct 2009. But would expect decent bearish reversal around 0.9300.,0,0,1,1,0,5,0.6336647,0.32802102,0.038314313,Pos,0.3056437,joelkruger
1430,2017-08-22 06:35:03,Here we go! Would like to see a daily close below $3800 but good to see the follow through. Was never able to establish above $4300.👍$BTCUSD,0,1,1,0,0,1,0.16896759,0.05665075,0.7743816,Neu,0.11231684,joelkruger
1431,2017-08-21 23:18:03,$EURUSD breaks up but may stall out yet again. Here's a look at the  technicals for Tuesday  ,0,1,1,0,1,1,0.03372273,0.0985085,0.86776876,Neu,-0.06478577,joelkruger
1434,2017-08-17 21:03:05,Difficult to talk safe haven digital currencies when there has been so much speculative flow in this market. Lower stocks could shed light.,1,1,1,2,0,1,0.028899243,0.9321787,0.038922057,Neg,-0.9032794,joelkruger
1435,2017-08-17 18:21:02,"Would love to have a chat about bitcoin, blockchain, ICOs, bubbles and investing. DM me if you know the space and want to talk. 👍",0,1,1,1,0,0,0.042861726,0.01837604,0.9387622,Neu,0.024485687,joelkruger
1449,2017-08-15 13:34:04,🙈 Took a shot and sold $BTCUSD just over $4000. Looking for sizable corrective decline in days ahead. Will only exit on a close above $4300.,1,1,1,3,0,6,0.020718737,0.9488367,0.030444639,Neg,-0.92811793,joelkruger
1451,2017-08-15 12:57:04,Obviously US data will be awful as there's no more room for Cable to drop today! Woa! Lots of support 1.2775 previous range high. $GBPUSD,0,1,1,0,0,3,0.055242952,0.9072887,0.037468325,Neg,-0.8520457,joelkruger
1452,2017-08-15 12:38:03,$GBPUSD getting walloped intraday. Looks due for bounce but could also easily retest previous range high now turned support at 1.2775.,1,1,1,0,0,0,0.75503254,0.16661374,0.078353696,Pos,0.5884188,joelkruger
1454,2017-08-14 16:28:04,"  Lower case 'p' by design? If by design, suggests you think the person making those decisions won't be the same as the one making them now.  ",0,1,1,0,0,1,0.033280108,0.080299966,0.8864199,Neu,-0.047019858,joelkruger
1457,2017-08-13 15:52:03,$EURUSD could retest and even break to fresh high but still room for bigger correction to 1.1500 per  research  ,0,0,1,1,1,1,0.86224264,0.10163368,0.036123704,Pos,0.760609,joelkruger
1459,2017-08-11 19:16:02," Perhaps...Not convinced. Hard to discount the fact that anything that moves so quickly one way, can't do the same the other way. Let's see.",1,1,1,1,0,1,0.053464122,0.049313407,0.8972224,Neu,0.0041507147,joelkruger
1471,2017-08-09 23:58:04, technicals desk shows why GOLD could be getting ready for a big push through 1300   $XAUUSD $EURUSD $NZDUSD,0,1,1,0,0,2,0.54009235,0.01694832,0.44295934,Pos,0.523144,joelkruger
1475,2017-08-08 18:40:00,Fed must get back to June message which finally recognized greater danger in continuing to err on the side of policy accommodation. stocks,1,1,1,0,0,1,0.5123397,0.2604893,0.22717099,Pos,0.2518504,joelkruger
1486,2017-08-07 13:43:05,Spoiler Alert: Fed Kashkari will be on the wires later. He won't be impressed with Friday's jobs data and he won't be hawkish.,1,0,1,0,0,1,0.071491025,0.098831944,0.82967705,Neu,-0.027340919,joelkruger
1490,2017-08-04 16:07:00,"  At same time, is it not worth considering low inflation as transitory and worrying when it does start moving it will really shoot up fast?",0,1,1,0,0,1,0.1457798,0.4286396,0.42558062,Neg,-0.2828598,joelkruger
1493,2017-08-04 15:20:03, Really enjoyed👍  Suppose we could say when someone does jump to other side it's a super strong indicator 😃,0,1,1,0,0,0,0.12358031,0.021658882,0.8547608,Neu,0.101921424,joelkruger
1503,2017-08-04 04:37:03,Will the US Dollar rise again? Tune in to the Friday technicals from the  research desk  ,0,0,1,0,1,2,0.09826437,0.022679996,0.8790556,Neu,0.07558437,joelkruger
1506,2017-08-03 20:39:02,Who would've guessed bears have longer life spans! Oh the irony of it all! 😃  stocks bulls bears  ,1,1,1,0,2,9,0.03486519,0.045684453,0.91945034,Neu,-0.010819264,joelkruger
1510,2017-08-02 21:10:04,"Since Yellen 180 in July testimony, the ECB was more cautious, the RBA did the same and my guess is the BOE will also follow this line.",1,1,1,1,0,0,0.12302637,0.051752675,0.82522094,Neu,0.0712737,joelkruger
1512,2017-08-02 19:57:00,Watching stocks is like watching an awful movie you want to turn off but can't for some inexplicable reason..but doing it 💯 times in a row!,0,1,1,0,0,1,0.021350862,0.5634591,0.41519,Neg,-0.54210824,joelkruger
1515,2017-08-02 17:01:00,Not bad for a ten minute voting window. Question now is if 65% of you would like to reconsider?,0,1,1,0,0,0,0.03850901,0.064362705,0.8971283,Neu,-0.025853693,joelkruger
1518,2017-08-02 15:52:02,"Can we all just make a rule we won't talk about weakness, or heaven forbid, a top in stocks, until we at least see market CLOSE down&gt;1.5%?🍻👍",0,1,1,0,1,4,0.02457105,0.80464596,0.17078295,Neg,-0.7800749,joelkruger
1519,2017-08-02 12:41:01,"$EURCHF stalled ahead of 1.1500 but would like to see the barrier taken out before the anticipated, overdue correction plays out.",1,1,1,2,0,1,0.19816113,0.38777554,0.4140633,Neu,-0.18961442,joelkruger
1528,2017-07-31 21:26:00,"Well...if you're into climbing walls, you may want to try $EURCHF. This is some move!  ",0,1,1,0,0,2,0.056774534,0.031851158,0.9113743,Neu,0.024923377,joelkruger
1531,2017-07-31 18:38:03,"Most extended market on Monday is $EURZAR, up about 2.2% and showing hourly RSI at about 85! But wouldn't be looking to sell. Just an FYI.",0,1,1,0,0,0,0.28268534,0.029472558,0.68784213,Neu,0.25321278,joelkruger
1537,2017-07-28 05:59:01, Great insight (as always)  ....and yes....Doug is a must follow.  ,0,1,1,0,0,1,0.5819383,0.00959654,0.4084651,Pos,0.5723418,joelkruger
1539,2017-07-28 04:30:00,17 hours to go and you can vote 115.00 at a huge discount! Will be interesting to see which is hit first. What do you all think. Vote below.  ,1,1,1,0,0,0,0.040621724,0.023296712,0.9360816,Neu,0.017325012,joelkruger
1540,2017-07-28 04:26:03,"If you sold 1.1355, move your stop to cost now. Could see a quick drop to 1.1280. If not, it was fun.",1,0,1,0,0,1,0.06009383,0.7576098,0.18229637,Neg,-0.69751596,joelkruger
1547,2017-07-28 02:54:03, Def agree. I'm more entertaining a what if we get a macro risk off event? I know it will never happen. But what happens to $EURCHF then?,0,1,1,2,0,0,0.02967577,0.22856754,0.7417567,Neu,-0.19889177,joelkruger
1553,2017-07-27 13:57:02,Selling $GBPCHF compelling as a short term rest of the day play. But the monthly chart will scare you away from expectations beyond hours.,0,1,1,1,0,0,0.04887075,0.63372207,0.31740722,Neg,-0.5848513,joelkruger
1555,2017-07-27 13:14:05,$EURCHF back above 1.1200 for the first time since that month in 2015 that shall not be named!,1,0,1,3,2,2,0.60110456,0.06707703,0.3318183,Pos,0.5340275,joelkruger
1560,2017-07-26 20:26:05,$EURUSD clears 1.1715 $AUDUSD breaks 0.8000 $NZDUSD takes out 0.7500 $USDCAD sinks below 1.2460  So now we can say all stops out of the way.,0,1,1,4,3,20,0.032585107,0.7079547,0.2594602,Neg,-0.6753696,joelkruger
1561,2017-07-26 20:00:05, I wish it was there but don't see it yet....i did take a shot short NZDUSD 0.7480 stop 0.7511 and will be out in 2 minutes :(,1,1,1,1,0,0,0.052105974,0.062073827,0.88582015,Neu,-0.009967852,joelkruger
1572,2017-07-26 17:24:03,"USD bullish, stocks bearish? Here's what you're up against:  1) Fed probably leans dovish 2) Even if it doesn't, market will see it that way",0,1,1,1,2,5,0.09537305,0.04688473,0.8577423,Neu,0.04848832,joelkruger
1577,2017-07-26 16:04:00," my names r CBs & machines  ya, so cute😊  I'm sure PPT was the last thing the creator thought this would be used for..sorry bout that..my bad",1,1,1,0,0,1,0.03191232,0.5199401,0.44814765,Neg,-0.48802775,joelkruger
1580,2017-07-26 14:43:04,and finally.....  Why FOMC may not be as dovish as you think:  Because will ignore all of this and come out more dovish than you think!! 😜🙈,0,1,1,0,0,1,0.03235664,0.12615116,0.84149224,Neu,-0.093794525,joelkruger
1581,2017-07-26 14:41:03,Why FOMC may not be as dovish as you think:  Financial stability risk is now &gt; subdued inflation risk.,1,1,1,0,0,0,0.075578615,0.068196446,0.85622495,Neu,0.0073821694,joelkruger
1582,2017-07-26 14:36:05,Why FOMC may not be as dovish as you think:  Inflation subdued but can also shoot up real fast. Well articulated by RBA Lowe earlier today  ,1,1,1,2,4,2,0.14756082,0.04374891,0.80869025,Neu,0.103811905,joelkruger
1590,2017-07-26 03:52:04,  Lowe and Debelle both MIT PHDs...same pedigree. Would expect Lowe to back up Debelle's dovishness from last Friday...even more so after CPI.,0,0,1,0,0,1,0.6807694,0.07617311,0.24305749,Pos,0.60459626,joelkruger
1602,2017-07-24 22:40:03,"There could be greater risk for USD downside over the medium term but short term, expect a US Dollar recovery   ",0,1,1,0,4,4,0.32849038,0.5599705,0.11153918,Neg,-0.23148012,joelkruger
1604,2017-07-24 20:08:03,Will be adding $ETHUSD coverage going forward. Important area more for understanding than trading right now but important to keep up.,0,1,1,0,1,1,0.43654993,0.011536516,0.55191356,Neu,0.42501342,joelkruger
1605,2017-07-24 19:43:00, Hi Tim. Hope all well. I have a question for you. How can I reach out? Thanks much. 👍,0,1,1,0,0,0,0.1479587,0.013310461,0.8387309,Neu,0.13464823,joelkruger
1609,2017-07-21 16:14:03,"📉 BIG LEVELS:  $EURUSD 1.1715, $USDCAD 1.2460 could break soon. But not sustainable s-term. Next 3-4 figure move for both should favor USD.",0,0,1,1,1,8,0.59136164,0.13568808,0.2729503,Pos,0.45567358,joelkruger
1613,2017-07-21 06:45:02,Sold $AUDUSD 0.7980 post Thursday Aussie jobs. Booked profit post Debelletdown at 0.7889. Daily close &lt; 0.7900 would be short-term bearish.,1,0,1,0,0,1,0.024022862,0.9084289,0.06754819,Neg,-0.88440603,joelkruger
1620,2017-07-21 05:13:01, Ya I see it. Not fun. In consideration of my slump...I'll hold off for a moment so you have a chance. 😀👍  Is your profile photo John Snow?,0,1,1,2,0,0,0.03187635,0.07165198,0.8964717,Neu,-0.03977563,joelkruger
1627,2017-07-21 04:09:05,"If you've been looking for an opportunity to buy an $AUDNZD dip, now might be a good time. 👍 justsayin   *Timestamp: AUDNZD 1.0635",1,1,1,3,0,1,0.060761347,0.06066519,0.8785735,Neu,9.615719e-05,joelkruger
1628,2017-07-21 04:06:03, Thinking on this one..back shortly.  Also constantly casting actors in my head for screenplay I'll never write. Yes. Bale always in there!  ,0,1,1,0,0,1,0.049163606,0.115810014,0.8350264,Neu,-0.06664641,joelkruger
1630,2017-07-21 03:53:05, I suppose I should be more honest and say it's a list of movies I want to buy the rights to that would never be as good but would pay out! 🤑,0,1,1,0,0,1,0.18350054,0.017976131,0.7985233,Neu,0.16552441,joelkruger
1632,2017-07-21 03:45:00,🇦🇺 Finally a central banker who knows what to say post Yellen testimony.👏  Didn't think it would be Debelle but that's cool.   $AUDUSD RBA  ,0,1,1,1,1,0,0.14378244,0.016968725,0.8392489,Neu,0.12681371,joelkruger
1645,2017-07-20 13:58:02,Today's $EURUSD low is now the level to watch below. A break below there could trigger decent corrective decline off multi-month range high.,0,1,1,1,2,2,0.022708222,0.9591089,0.018182874,Neg,-0.93640065,joelkruger
1649,2017-07-20 03:09:05,"Bottom line - If the trades works great. If not, will be out at cost and will consider selling &gt;0.8000 on the extended technicals.",0,1,1,0,0,1,0.14246722,0.013310891,0.8442219,Neu,0.12915632,joelkruger
1650,2017-07-20 03:08:03,"As far as the jobs data went, though the headline was softer, full time component was impressive and could be what gets this thru 0.8000.",1,1,1,1,0,0,0.59069353,0.029080201,0.38022634,Pos,0.5616133,joelkruger
1652,2017-07-20 02:48:00,"  Unfortunately, Youtube removed the functionality. But look in the video description and you'll see links there. Let me know if that works? 👍  ",1,1,1,0,0,1,0.041445035,0.11230931,0.84624565,Neu,-0.070864275,joelkruger
1654,2017-07-19 19:48:00, Look at you! Remember to tell your boy Avi to listen to Reckoning. I'll be waiting for his thank you. 😃👍  Good seeing you brotha.,0,1,1,1,0,0,0.7999424,0.020174198,0.17988339,Pos,0.77976817,joelkruger
1656,2017-07-19 18:22:00,Will equity portfolio managers head for the exit with double digit returns in 2017?...OR who wants double when triple is an option!! 🐂🐻🐷  ,0,1,1,0,0,0,0.051265217,0.08885291,0.8598818,Neu,-0.037587695,joelkruger
1662,2017-07-19 04:14:02,Bearish outside day for $GBPUSD on Tuesday. Will we see downside follow through on Wednesday?  ,0,1,1,0,0,2,0.051126286,0.72408044,0.22479327,Neg,-0.67295414,joelkruger
1687,2017-07-14 15:43:04, Lots of chop but looking constructive off longer-term lows....and though it ain't what you'd see in a textbook under 'Inverse H&S'....maybe😊  ,0,1,1,1,0,0,0.087852895,0.3176078,0.5945393,Neu,-0.2297549,joelkruger
1710,2017-07-12 17:21:02,All I'm thinking is what it would look like if this rate hike wasn't 90% priced in!! $USDCAD 🤒,1,1,1,1,2,8,0.048993297,0.0255873,0.92541945,Neu,0.023405997,joelkruger
1719,2017-07-12 14:29:02,Last chance to vote. Get em in while you can!  ,0,0,1,0,0,0,0.10062679,0.028754054,0.8706192,Neu,0.07187273,joelkruger
1726,2017-07-11 23:36:01,Another 2017 high for $EURUSD! How much higher can we go? Here's a look at the Wednesday  technicals  ,0,1,1,1,2,3,0.057460196,0.026271237,0.9162685,Neu,0.03118896,joelkruger
1728,2017-07-11 21:54:05,"🇨🇦🍁Why  should HOLD:  CAD +6% since May inflation subdued OIL depressed Shaky global backdrop ECB, BOE yet to act  $USDCAD",1,0,1,0,0,1,0.6245027,0.17589092,0.19960628,Pos,0.4486118,joelkruger
1733,2017-07-11 15:17:02,"As far as daily charts go, $EURJPY is the most extended, with $EURCHF right behind. One more $EURJPY jump intraday and might look to sell.  ",0,1,1,2,0,0,0.26877463,0.11197337,0.619252,Neu,0.15680125,joelkruger
