,date,tweet,past_tense,present_tense,future_tense,replies_count,retweets_count,likes_count,pos_score,neg_score,neutral_score,sentiment,Sentiment_Score,user
2386,2017-04-04 17:45:04,"UK PM  calls for investigation into suspected chemical attack in Idlib, Syria      ",0,1,0,242,989,1443,0.08675188,0.45762986,0.4556182,Neg,-0.37087798,bbcbreaking
2387,2017-04-04 13:59:00,"Russia identifies St Petersburg bomber as Akbarzhon Jalilov, says he was responsible unexploded bomb, too  ",1,1,0,31,330,308,0.030428074,0.15764272,0.81192917,Neu,-0.12721464,bbcbreaking
2388,2017-04-04 12:01:02,"Air strike hits Syrian hospital treating victims of suspected chemical attack, doctor tells BBC Arabic  ",0,1,0,165,1479,668,0.02405503,0.9020551,0.07388988,Neg,-0.8780001,bbcbreaking
2391,2017-04-04 11:05:01,South Africa's trades union federation Cosatu calls for President Jacob Zuma to step down  ,0,1,0,37,287,314,0.021203734,0.72471625,0.25407994,Neg,-0.7035125,bbcbreaking
2392,2017-04-04 11:01:01,"At least 58 people killed in suspected chemical attack on rebel-held Syrian town, activists and monitoring group say  ",1,1,0,55,626,274,0.017943984,0.85522974,0.1268263,Neg,-0.83728576,bbcbreaking
2394,2017-04-04 09:24:03,"Death toll from St Petersburg metro bomb rises to 14, Russian health minister says  ",0,1,0,27,261,260,0.22317986,0.598575,0.1782451,Neg,-0.37539512,bbcbreaking
2395,2017-04-04 08:34:01,"UK PM says Cadbury & the National Trust's decision to omit the word Easter from egg hunt is ""absolutely ridiculous""  ",0,1,0,421,639,1209,0.020151341,0.7122398,0.26760885,Neg,-0.6920885,bbcbreaking
2396,2017-04-04 08:17:01,"At least 18 people killed in suspected chemical attack on rebel-held Syrian town, activists and monitoring group say  ",1,1,0,87,1028,589,0.019004349,0.849765,0.13123065,Neg,-0.83076066,bbcbreaking
2398,2017-04-04 06:58:04,"St Petersburg metro suspect is a Kyrgyz national with Russian citizenship, Kyrgyz security service says  ",0,1,0,32,347,336,0.026917055,0.21741195,0.755671,Neu,-0.1904949,bbcbreaking
2400,2017-04-03 16:56:03,"Investigators are treating the St Petersburg metro explosion that killed up to 10 people as a ""terrorist attack""  ",1,1,0,126,751,533,0.019353524,0.87741745,0.10322905,Neg,-0.85806394,bbcbreaking
2402,2017-04-03 15:35:05,Officials say explosive device found and made safe at different St Petersburg metro station to site of earlier blast  ,1,1,0,38,439,369,0.04718683,0.35758522,0.59522796,Neu,-0.3103984,bbcbreaking
2403,2017-04-03 15:13:02,"Russian official says there was one blast on St Petersburg metro, not two, with up to 10 people killed    ",1,1,0,85,1043,655,0.013813905,0.85493034,0.13125575,Neg,-0.8411164,bbcbreaking
2405,2017-04-03 14:41:02,"Members of Aslef union reject deal aimed at ending dispute over driver-only trains on Southern Railway, company says  ",1,1,0,28,94,118,0.046763908,0.8580001,0.095235884,Neg,-0.8112362,bbcbreaking
2408,2017-04-03 13:28:04,"At least 10 killed in St Petersburg metro explosion, Russian media say, citing first reports  ",1,1,0,47,1425,499,0.013877312,0.8886364,0.09748629,Neg,-0.8747591,bbcbreaking
2410,2017-04-03 10:26:02,"Five people charged over attack on teenage asylum seeker at a bus stop in Croydon, south London, police say  ",1,1,0,103,358,587,0.024786545,0.8874215,0.087791935,Neg,-0.86263496,bbcbreaking
2411,2017-04-02 16:20:02,"Civil rights activist Darcus Howe dies aged 74, his biographer tells BBC     ",1,1,0,67,674,791,0.031202525,0.21903747,0.74976,Neu,-0.18783495,bbcbreaking
2412,2017-04-02 13:12:02,"University Boat Races will go ahead, London police confirm after World War Two shell removed from Thames  ",1,1,1,61,350,703,0.06681663,0.120027386,0.81315595,Neu,-0.053210758,bbcbreaking
2413,2017-04-01 20:15:01,Death toll from landslides in Colombia rises to at least 154 with many people still missing  ,0,1,0,51,616,414,0.03485087,0.9288165,0.036332566,Neg,-0.8939656,bbcbreaking
2414,2017-04-01 16:57:02,"At least 92 dead and many more injured in landslides caused by heavy rain in Colombia, Red Cross says  ",1,1,0,43,610,467,0.016612915,0.9133301,0.07005695,Neg,-0.8967172,bbcbreaking
2415,2017-04-01 14:24:03,Venezuelan supreme court rows back on move to strip congress of powers  ,0,1,0,41,297,359,0.045084827,0.8585035,0.09641163,Neg,-0.8134187,bbcbreaking
2417,2017-03-31 13:25:02,Letter from Nicola Sturgeon requesting power to hold second Scottish independence referendum delivered to UK PM  ,1,1,0,197,448,743,0.13847828,0.025897084,0.8356246,Neu,0.11258119,bbcbreaking
2418,2017-03-31 08:53:01,"EU sets out Brexit strategy suggesting UK trade talks could begin once ""sufficient progress"" made on separation deal  ",1,1,1,85,326,402,0.22825079,0.013719715,0.7580295,Neu,0.21453106,bbcbreaking
2419,2017-03-30 23:36:00,South African President Jacob Zuma says he has dismissed Finance Minister Pravin Gordhan  ,1,1,0,29,158,155,0.014912739,0.8931173,0.091969885,Neg,-0.8782046,bbcbreaking
2420,2017-03-30 19:27:01,South Korean court approves an arrest warrant for ousted President Park Geun-hye on corruption charges  ,0,1,0,35,596,498,0.042071495,0.883011,0.07491751,Neg,-0.84093946,bbcbreaking
2421,2017-03-30 19:14:02,Scotland's first minister Nicola Sturgeon makes formal request to hold a second Scottish independence referendum  ,0,1,0,366,1599,2211,0.08827995,0.055060662,0.8566594,Neu,0.033219285,bbcbreaking
2422,2017-03-30 16:22:00,"Russia tried to hijack the US democratic process, says a senator investigating alleged interference in US election  ",1,1,0,183,582,806,0.027858684,0.8371516,0.13498971,Neg,-0.8092929,bbcbreaking
2423,2017-03-30 13:23:00,"Malaysia approves release of Kim Jong-nam's body for return to North Korea, Malaysian PM says  ",0,1,0,45,249,299,0.1690114,0.054334857,0.77665377,Neu,0.11467654,bbcbreaking
2424,2017-03-30 12:21:05,"Five people die after missing helicopter crashes in Snowdonia, North Wales police say  ",0,1,0,34,284,246,0.017403733,0.90196776,0.080628395,Neg,-0.88456404,bbcbreaking
2425,2017-03-30 12:15:04,"Mother and her son die after being stabbed in their Stourbridge home, say West Midlands Police  ",1,1,0,26,180,198,0.019771397,0.85151076,0.1287178,Neg,-0.83173937,bbcbreaking
2427,2017-03-29 20:55:04,Helicopter with five people on board goes missing over north Wales after setting off from Milton Keynes  ,0,1,0,40,471,387,0.016416999,0.86423814,0.11934493,Neg,-0.8478211,bbcbreaking
2428,2017-03-29 16:40:01,"George Michael's funeral has taken place attended by family and close friends in a private ceremony, publicist says  ",1,1,0,88,424,1035,0.043481935,0.02225574,0.93426234,Neu,0.021226196,bbcbreaking
2429,2017-03-29 14:44:03,People link hands and fall silent on Westminster Bridge to mark a week since the London attack     ,0,1,0,90,817,2136,0.036148224,0.3856942,0.5781576,Neu,-0.349546,bbcbreaking
2430,2017-03-29 13:12:02,"""We already miss you. Thank you & goodbye"" -  reacts to Article 50 being triggered by UK on BrexitDay    ",1,1,0,223,1872,2380,0.039782196,0.49630684,0.46391094,Neg,-0.45652464,bbcbreaking
2431,2017-03-29 13:03:00,This is the letter from the UK to the EU that triggers Article 50 and begins the Brexit countdown    BrexitDay  ,0,1,0,135,1185,992,0.020159405,0.04421329,0.9356273,Neu,-0.024053887,bbcbreaking
2432,2017-03-29 12:58:02,"Direction PM is threatening to take UK is ""both reckless and damaging"" -  leader Jeremy Corbyn    BrexitDay  ",0,1,0,127,388,656,0.02942664,0.6790526,0.2915208,Neg,-0.64962596,bbcbreaking
2433,2017-03-29 12:42:04,"""An historic moment from which there can be no turning back"" - UK PM May on having triggered Article 50    BrexitDay  ",1,1,1,299,2430,2457,0.18486007,0.3191552,0.49598476,Neu,-0.13429512,bbcbreaking
2434,2017-03-29 12:34:03,Picture shows letter triggering Article 50 delivered to   The Brexit countdown begins     BrexitDay  ,1,1,0,59,604,648,0.033014093,0.041482687,0.92550325,Neu,-0.008468594,bbcbreaking
2435,2017-03-29 12:32:00,UK formally begins two year process of leaving EU with letter triggering Article 50 of the Lisbon treaty    BrexitDay  ,0,1,0,105,1633,1463,0.07582265,0.036812242,0.88736504,Neu,0.03901041,bbcbreaking
2436,2017-03-29 12:27:04,The EU has received the letter from UK that will trigger Article 50 & formally begin the Brexit process    BrexitDay,1,1,1,119,998,755,0.049634848,0.022142835,0.92822236,Neu,0.027492013,bbcbreaking
2437,2017-03-29 11:43:04,Bob Dylan to receive his Nobel Prize this weekend after snubbing ceremony in December - Nobel academy  ,0,1,0,57,464,731,0.07860843,0.040824737,0.88056684,Neu,0.037783694,bbcbreaking
2438,2017-03-29 10:22:02,EU regulators block London Stock Exchange Group's £21bn merger with German stock exchange Deutsche Boerse   ,0,1,0,60,463,459,0.012510399,0.9127818,0.07470777,Neg,-0.90027136,bbcbreaking
2439,2017-03-29 10:11:00,"Family of Mark Duggan, shot by police in London sparking riots, lose challenge against lawful killing finding  ",0,1,0,54,357,349,0.079805925,0.6851053,0.23508863,Neg,-0.6052994,bbcbreaking
2442,2017-03-28 19:38:02,"""It's about making America wealthy again"" -  on overturning key parts of Obama's plan to tackle global warming    ",0,1,0,658,520,661,0.33625335,0.037151538,0.62659514,Neu,0.2991018,bbcbreaking
2443,2017-03-28 19:28:02,President Donald Trump signs executive order rolling back Obama-era rules aimed at tackling global warming  ,1,1,0,309,572,572,0.7394127,0.18194678,0.07864048,Pos,0.5574659,bbcbreaking
2446,2017-03-28 07:43:02,"Wife of London attacker Khalid Masood says she is ""saddened and shocked"" and condemns his actions  ",0,1,0,84,227,412,0.026759684,0.84847313,0.1247672,Neg,-0.82171345,bbcbreaking
2447,2017-03-28 07:19:03,UK supermarket  agrees to pay £129m fine for overstating its profits in 2014 but says it won't be prosecuted   ,1,1,1,47,183,249,0.020599624,0.9471075,0.032292806,Neg,-0.9265079,bbcbreaking
2448,2017-03-27 17:07:03,"Mother of Westminster attacker Khalid Masood says she is ""shocked, saddened, and numbed"" by his actions  ",1,1,0,106,220,422,0.0445927,0.78047967,0.1749276,Neg,-0.735887,bbcbreaking
2449,2017-03-27 16:22:02,"No evidence of link between London attacker Khalid Masood and so-called IS or al-Qaeda, Metropolitan Police says   ",0,1,0,191,716,579,0.026715562,0.37508416,0.59820026,Neu,-0.3483686,bbcbreaking
2450,2017-03-27 13:57:02,"Khalid Masood was driving at up to 76mph on Westminster Bridge, where he killed three pedestrians, BBC London learns  ",1,1,0,77,203,216,0.03020924,0.4087078,0.56108296,Neu,-0.37849855,bbcbreaking
2451,2017-03-27 13:22:00,Russian opposition leader Alexei Navalny gets 15-day jail sentence for resisting police orders during protest  ,0,1,0,76,469,445,0.04100354,0.8211422,0.13785432,Neg,-0.7801387,bbcbreaking
2453,2017-03-27 04:33:01,"Avalanche hits Japan ski resort, leaving many school children injured or feared dead.   ",1,1,0,136,1104,616,0.015006915,0.90355897,0.08143409,Neg,-0.88855207,bbcbreaking
2455,2017-03-26 17:47:02,"Man, 30, arrested in Birmingham by officers investigating Westminster attack. A 58-year-old man is still in custody  ",1,1,0,51,437,575,0.019554224,0.7709387,0.2095071,Neg,-0.7513845,bbcbreaking
2456,2017-03-26 17:42:00,"Party of German Chancellor Angela Merkel on course for clear win in Saarland state election, exit polls suggest  ",0,1,0,78,415,1085,0.11223482,0.18952514,0.69824,Neu,-0.07729032,bbcbreaking
2458,2017-03-26 12:44:01,"Russian opposition leader Alexei Navalny arrested in Moscow at anti-corruption protest he organised, witnesses say  ",1,1,0,239,2610,1987,0.020569362,0.8586075,0.12082311,Neg,-0.8380381,bbcbreaking
2460,2017-03-25 22:45:03,"There is no intelligence to suggest further actions are planned following the London attack, Metropolitan police say  ",1,1,0,115,366,522,0.0256369,0.46668214,0.507681,Neu,-0.44104522,bbcbreaking
2461,2017-03-25 22:32:00,Merseyside Fire and Rescue says it is responding to a suspected gas leak in the New Ferry area  ,1,1,0,15,273,268,0.03113631,0.923689,0.04517467,Neg,-0.8925527,bbcbreaking
2462,2017-03-25 17:44:05,"One man remains in custody over Westminster attack after two people released without charge, say police  ",1,1,0,34,273,399,0.018108131,0.8636876,0.118204266,Neg,-0.84557945,bbcbreaking
2463,2017-03-25 14:44:05,"Two 17-year-old boys found dead at cliffs at Saltburn in north-east England, say Cleveland police  ",1,1,0,44,215,326,0.017472075,0.8896006,0.09292735,Neg,-0.8721285,bbcbreaking
2464,2017-03-25 13:27:02,"Douglas Carswell tells BBC he is quitting UKIP because the party has done its job and ""we've won""     ",1,1,0,180,216,380,0.040512685,0.5997245,0.35976273,Neg,-0.5592118,bbcbreaking
2465,2017-03-25 11:49:01,"UKIP's Douglas Carswell is quitting party to become an independent MP for Clacton and says he is doing so ""amicably""  ",0,1,0,186,578,615,0.048943836,0.31398368,0.6370725,Neu,-0.26503983,bbcbreaking
2466,2017-03-24 20:50:05,"""Obamacare is exploding, with no Democrat support we couldn't get there"":  Trump on healthcare vote withdrawal    ",0,1,1,473,497,814,0.05984934,0.5221834,0.4179673,Neg,-0.46233407,bbcbreaking
2467,2017-03-24 20:06:04,Six people arrested as part of investigation into Westminster terror attack have been released without charge    ,1,1,0,66,322,331,0.044950232,0.44040817,0.51464164,Neu,-0.39545792,bbcbreaking
2469,2017-03-24 19:39:04,US media reports that the vote on the Republican healthcare bill has been pulled    ,1,1,0,190,1834,3094,0.05337822,0.6042187,0.34240305,Neg,-0.5508405,bbcbreaking
2471,2017-03-24 14:38:00,Picture of London attacker Khalid Masood released by UK police as they appeal for information from the public     ,1,1,0,79,297,205,0.05363845,0.20099002,0.7453715,Neu,-0.14735156,bbcbreaking
2472,2017-03-24 12:06:02,US President Donald Trump's administration approves Keystone XL pipeline    ,0,1,0,119,475,443,0.47553405,0.015155878,0.50931,Neu,0.46037817,bbcbreaking
2473,2017-03-24 12:02:05,Picture emerges of London attacker Khalid Masood during his school days     ,0,1,0,285,236,293,0.04604162,0.23425525,0.71970314,Neu,-0.18821363,bbcbreaking
2474,2017-03-24 11:52:01,Belgian prosecutors bring attempted terrorism charge against man who drove at crowd in Antwerp  ,1,1,0,33,137,242,0.039210714,0.81267565,0.14811362,Neg,-0.7734649,bbcbreaking
2475,2017-03-24 11:29:03,Belgian prosecutors bring attempted terrorism charge against man who drove at crowd in Antwerp   ,1,1,0,25,213,311,0.039210714,0.81267565,0.14811362,Neg,-0.7734649,bbcbreaking
2476,2017-03-24 10:41:02,Germanwings crash anniversary: victims' families criticise efforts of pilot's father to clear his son of blame   ,0,1,0,16,140,189,0.015761346,0.9213436,0.06289504,Neg,-0.9055823,bbcbreaking
2477,2017-03-24 10:09:05,"Hosni Mubarak, Egypt's ex-president, freed after he was cleared of murdering protesters in 2011 Arab Spring protests    ",1,1,0,56,554,399,0.11211942,0.6488563,0.23902433,Neg,-0.53673685,bbcbreaking
2479,2017-03-24 08:00:04,. says Britain won’t be punished for Brexit but must honour commitments during negotiating process     ,1,1,1,69,180,291,0.60287136,0.03904483,0.35808387,Pos,0.5638265,bbcbreaking
2480,2017-03-24 07:55:02,"Brexit is ""a tragedy and a failure"" -  exclusive BBC interview as UK prepares to trigger EU exit process    ",0,1,0,295,1310,1622,0.031166622,0.5690467,0.3997867,Neg,-0.53788006,bbcbreaking
2481,2017-03-23 21:18:02,"A 75-year-old man has become the fifth person to die following the attacks in Westminster, Metropolitan Police say  ",1,1,0,181,1102,835,0.024711289,0.7307187,0.24457005,Neg,-0.70600736,bbcbreaking
2482,2017-03-23 20:10:03,More than 200 migrants feared dead in Mediterranean as bodies are recovered from sea - Spanish aid group  ,1,1,0,188,1698,767,0.017127126,0.88871145,0.094161436,Neg,-0.8715843,bbcbreaking
2485,2017-03-23 18:20:01,"""Londoners will never be cowed by terrorism"" says London Mayor  at vigil for Westminster attack victims    ",1,1,1,135,744,1777,0.1700118,0.2698334,0.56015486,Neu,-0.09982158,bbcbreaking
2486,2017-03-23 18:15:04,"""The terrorists will not defeat us"" says UK home secretary at Trafalgar Square vigil for London attack victims    ",0,1,1,151,727,1532,0.13746117,0.31837213,0.5441667,Neu,-0.18091096,bbcbreaking
2487,2017-03-23 18:02:01,Police say five women and three men arrested on suspicion of preparation of terrorist acts after London attack  ,1,1,0,36,530,661,0.020477476,0.88240045,0.09712199,Neg,-0.861923,bbcbreaking
2488,2017-03-23 18:01:04,This is the Brandenburg Gate as Germany stands in solidarity with the UK  ,0,1,0,467,11909,33888,0.14766735,0.01377476,0.8385579,Neu,0.1338926,bbcbreaking
2490,2017-03-23 16:19:00,"UK Prime Minister Theresa May has visited victims of the Westminster terror attack in hospital, Downing Street says  ",1,1,0,29,140,348,0.09416616,0.0876597,0.81817406,Neu,0.006506458,bbcbreaking
2491,2017-03-23 15:32:04,"Scotland Yard formally identify London terror attacker as 52-year-old Khalid Masood, who was known to police    ",1,1,0,138,1102,642,0.042457078,0.136988,0.820555,Neu,-0.094530925,bbcbreaking
2492,2017-03-23 15:28:01,"US President Donald Trump pays tribute to ""great American"" Kurt Cochran, who was killed in the London terror attack    ",1,1,0,41,125,248,0.15305579,0.0680475,0.7788967,Neu,0.085008286,bbcbreaking
2493,2017-03-23 14:28:01,"""Our family is heartbroken"" - tributes paid to American Kurt Cochran, named as third victim of Westminster attack    ",1,1,0,91,484,838,0.084334806,0.14206047,0.7736047,Neu,-0.057725668,bbcbreaking
2494,2017-03-23 14:09:03,"Kurt Cochran from Utah killed in terror attack in Westminster, wife Melissa seriously injured, family spokesman says  ",1,1,0,66,683,770,0.030720426,0.7389173,0.23036224,Neg,-0.7081969,bbcbreaking
2495,2017-03-23 13:53:03,Thousands of mourners gather for the funeral of Northern Ireland's former deputy first minister Martin McGuinness    ,0,1,0,108,167,432,0.04556211,0.20124139,0.7531965,Neu,-0.15567929,bbcbreaking
2496,2017-03-23 13:32:03,"Man arrested in Belgian city of Antwerp on suspicion of driving at a crowd, media reports say  ",1,1,0,113,1407,852,0.020176088,0.8857281,0.094095774,Neg,-0.865552,bbcbreaking
2497,2017-03-23 12:48:02,Israeli police arrest Israeli-US teenager on suspicion of making bomb threats against Jewish community centres in US  ,1,1,0,58,553,565,0.024324782,0.85444754,0.1212276,Neg,-0.83012277,bbcbreaking
2498,2017-03-23 12:22:05,"So-called Islamic State says it was behind attack in Westminster, according to a statement from the group  ",1,1,0,307,950,536,0.030378018,0.17696045,0.7926615,Neu,-0.14658244,bbcbreaking
2499,2017-03-23 11:37:01,"The Queen says her ""thoughts, prayers, and deepest sympathy"" are with all those affected by Westminster attack     ",1,1,0,31,345,783,0.052374255,0.10019502,0.8474307,Neu,-0.047820766,bbcbreaking
2501,2017-03-23 10:38:03,"""We are not afraid""- PM Theresa May addresses UK Parliament after yesterday's Westminster attack     ",0,1,0,104,678,1176,0.07703496,0.06152703,0.86143804,Neu,0.015507929,bbcbreaking
2502,2017-03-23 10:23:03,An eighth person has been arrested by UK police as part of the investigation into the Westminster terror attack     ,1,1,0,32,361,416,0.017436616,0.7666747,0.21588865,Neg,-0.7492381,bbcbreaking
2504,2017-03-23 09:41:01,A minute's silence has been observed at Scotland Yard and the UK Houses of Parliament after the Westminster attacks    ,1,1,0,64,1259,2947,0.03068267,0.226848,0.7424694,Neu,-0.19616534,bbcbreaking
2505,2017-03-23 09:31:02,A minute's silence is about to begin at the UK Houses of Parliament following yesterday's Westminster attack     ,0,1,0,18,338,730,0.02442309,0.076154664,0.8994222,Neu,-0.05173157,bbcbreaking
2506,2017-03-23 08:23:05,UK Defence Secretary Michael Fallon says working assumption is Westminster attack is linked to Islamic terrorism     ,1,1,0,112,351,367,0.03642675,0.3587016,0.60487163,Neu,-0.32227483,bbcbreaking
2508,2017-03-23 07:51:03,"Westminster latest: • 7 arrests following raids • 5 dead, including attacker • 7 still in critical condition     ",1,1,0,144,2562,2687,0.014946447,0.9028818,0.0821718,Neg,-0.88793534,bbcbreaking
2509,2017-03-23 07:38:00,"Explosions at massive arms depot in eastern Ukraine described as ""sabotage"" as up to 20,000 evacuated - media say  ",1,1,0,26,493,358,0.012671602,0.9089189,0.078409486,Neg,-0.8962473,bbcbreaking
2510,2017-03-23 07:12:05,UK police have made arrests in Birmingham during a raid understood to be linked to Westminster attack     ,1,1,0,50,753,780,0.022325477,0.84569144,0.131983,Neg,-0.823366,bbcbreaking
2511,2017-03-22 23:28:05,Eiffel Tower in Paris turns off its lights in mark of respect to Westminster terror attack    ,0,1,0,341,9609,24657,0.01881573,0.6829818,0.29820246,Neg,-0.66416603,bbcbreaking
2513,2017-03-22 22:33:00,"Westminster attack latest:  • 5 dead, including attacker • Attacker known to police • At least 40 injured  Latest:  ",1,1,0,174,3594,2176,0.012004329,0.9309243,0.057071384,Neg,-0.91892,bbcbreaking
2514,2017-03-22 22:21:04,Video shows woman falling into River Thames in Westminster terror attack; she is being treated for serious injuries    ,1,1,0,384,2220,2009,0.02240483,0.8227674,0.15482776,Neg,-0.8003625,bbcbreaking
2516,2017-03-22 21:04:00,"UK PM  describes Westminster terror attack at ""heart of our capital city"" as ""sick and depraved""    ",1,1,0,231,2550,3639,0.0133346,0.90954113,0.07712424,Neg,-0.89620656,bbcbreaking
2518,2017-03-22 20:36:01,Emergency government Cobra meeting ends following Westminster terror attack  What we know so far:    ,0,1,0,77,909,786,0.017233225,0.51481164,0.46795517,Neg,-0.4975784,bbcbreaking
2519,2017-03-22 20:06:02,". offers UK PM condolences after Westminster attack & praises ""effective response"" of security forces    ",0,1,0,61,436,956,0.7653113,0.019412614,0.21527605,Pos,0.74589866,bbcbreaking
2521,2017-03-22 18:54:00,Public security is top priority says UK Home Secretary  after 4 killed in Westminster terror attack    ,1,1,0,102,531,738,0.16001971,0.17156602,0.6684143,Neu,-0.011546314,bbcbreaking
2522,2017-03-22 18:52:03,"Thoughts of PM with those killed, injured and their families in ""appalling"" Westminster terror attack, says No 10  ",1,1,0,114,931,1230,0.022470558,0.83175296,0.1457764,Neg,-0.8092824,bbcbreaking
2523,2017-03-22 18:11:02,"Westminster attack latest: • 4 dead, including attacker • at least 20 injured • police believe only one attacker     ",0,1,0,317,6601,3367,0.019896675,0.8772125,0.10289077,Neg,-0.85731584,bbcbreaking
2524,2017-03-22 17:37:01,"French teenagers on a school visit to London among those injured in the attack, French PM says     ",1,1,0,51,982,562,0.021210277,0.84967065,0.12911905,Neg,-0.8284604,bbcbreaking
2525,2017-03-22 17:31:00,"Police officer stabbed in UK Parliament attack died at scene, says minister who gave mouth-to-mouth resuscitation     ",1,1,0,194,2951,1522,0.048334874,0.4957931,0.45587203,Neg,-0.44745824,bbcbreaking
2527,2017-03-22 16:18:01,"Woman dies & a number are hurt, some with ""catastrophic"" injuries after Westminster Bridge incident, hospital says    ",1,1,0,124,2923,1005,0.011228767,0.9520393,0.036731914,Neg,-0.94081056,bbcbreaking
2528,2017-03-22 16:04:01,Scottish Parliament suspends debate on second independence referendum following attack outside UK Parliament  ,0,1,0,85,849,787,0.012720544,0.87595356,0.111325815,Neg,-0.86323303,bbcbreaking
2529,2017-03-22 15:49:00,"Crowds being moved out of Parliament Square, policeman tells BBC, suspect vehicle outside UK Parliament.   Latest:    ",1,1,0,73,2496,996,0.023273136,0.5881169,0.38861004,Neg,-0.5648438,bbcbreaking
2530,2017-03-22 15:39:03,"Police say attack at UK Parliament being treated as ""terrorist incident until we know otherwise""     ",1,1,0,259,6109,3674,0.016978782,0.80994636,0.17307484,Neg,-0.79296756,bbcbreaking
2531,2017-03-22 15:34:00,"Westminster latest: -Police officer stabbed at parliament, suspect shot -Car drives into people on bridge -PM safe    ",1,1,0,122,3006,1169,0.020583082,0.8146887,0.1647283,Neg,-0.7941056,bbcbreaking
2532,2017-03-22 15:26:04,First pictures emerge of scene after eyewitnesses reports of car striking and injuring pedestrians at Westminster     ,0,1,0,103,3378,1572,0.027292544,0.84131676,0.13139068,Neg,-0.8140242,bbcbreaking
2533,2017-03-22 15:16:02,"A ""police officer has been stabbed"" and the ""alleged assailant was shot by armed police"", Commons Leader tells MPs  ",1,1,0,48,1783,1003,0.021375364,0.8876948,0.09092985,Neg,-0.8663194,bbcbreaking
2535,2017-03-22 15:11:01,Deputy speaker announces UK Houses of Parliament suspended after incident on Westminster Bridge    ,1,1,0,76,2587,2299,0.0140377255,0.89334244,0.09261984,Neg,-0.8793047,bbcbreaking
2536,2017-03-22 15:00:03,Scotland Yard says it was called to firearms incident on Westminster Bridge amid reports of several people injured    ,1,1,0,112,4641,1626,0.020400783,0.8929466,0.08665261,Neg,-0.87254584,bbcbreaking
2538,2017-03-22 14:33:00,"Man who killed his ex-girlfriend at her Brighton home after she jilted him, is found guilty of murder  ",1,1,0,46,141,314,0.045442827,0.6419032,0.31265396,Neg,-0.5964604,bbcbreaking
2539,2017-03-22 13:55:04,"UK's cabin baggage ban on laptops and tablets must be implemented by Saturday, the Department for Transport has said  ",1,1,1,56,283,249,0.018317554,0.7163197,0.26536277,Neg,-0.6980021,bbcbreaking
2541,2017-03-22 11:40:01,Thames Water fined record £20m for polluting River Thames with nearly 1.5 billion litres of sewage in 2013 and 2014  ,1,1,0,110,514,585,0.018342156,0.94653404,0.03512385,Neg,-0.9281919,bbcbreaking
2542,2017-03-22 10:25:03,Former football coach Barry Bennell pleads not guilty to 20 sexual offence charges against boys  ,0,1,0,26,105,130,0.04058132,0.7492257,0.21019304,Neg,-0.70864433,bbcbreaking
2543,2017-03-22 03:02:00,"A North Korean missile launch has failed, sources tell South Korean and Japanese media  ",1,1,0,101,813,1008,0.020292819,0.9027495,0.07695774,Neg,-0.88245666,bbcbreaking
