,date,tweet,past_tense,present_tense,future_tense,replies_count,retweets_count,likes_count,pos_score,neg_score,neutral_score,sentiment,Sentiment_Score,user
1473,2017-07-20 01:14:00,"Veteran US Republican Senator John McCain is recovering after surgery for brain cancer, his office says  ",0,1,0,95,414,573,0.16223107,0.12869446,0.7090745,Neu,0.033536613,bbcbreaking
1474,2017-07-19 14:05:04,"UK state pension age increase from 67 to 68 to be brought forward by seven years to 2037, government says  ",1,1,0,510,822,531,0.6410809,0.018039005,0.34088007,Pos,0.6230419,bbcbreaking
1475,2017-07-19 12:32:01,"""We're making big strides... but we have a lot to do"" - BBC director general Tony Hall on bbcpay gender disparity    ",0,1,0,194,207,344,0.08996076,0.16439308,0.74564624,Neu,-0.07443232,bbcbreaking
1476,2017-07-19 11:16:01,10 highest-paid BBC stars and journalists   bbcpay  ,0,1,0,547,739,697,0.118806295,0.018285125,0.8629086,Neu,0.10052117,bbcbreaking
1477,2017-07-19 11:01:01,"BBC names 96 stars and journalists paid by licence fee, who have earned more than £150,000 in last year bbcpay  ",1,1,0,530,509,635,0.11739175,0.011067246,0.87154096,Neu,0.1063245,bbcbreaking
1481,2017-07-18 09:33:05,"Inflation rate drops unexpectedly to 2.6% in June, from 2.9% in May, official figures show  ",0,1,0,106,293,411,0.015860807,0.97234905,0.011790078,Neg,-0.95648825,bbcbreaking
1482,2017-07-17 11:35:05,"UK PM to remind ministers to keep discussions private following a series of leaks, Downing Street says    ",0,1,0,122,222,309,0.031871133,0.5053083,0.4628206,Neg,-0.47343713,bbcbreaking
1483,2017-07-17 10:45:03,Military court in Jordan sentences soldier to life in prison for killing three US trainers at air base last year  ,0,1,0,32,228,377,0.052568898,0.8034316,0.14399958,Neg,-0.75086266,bbcbreaking
1484,2017-07-17 07:23:04,Easyjet chief executive Carolyn McCall is leaving the airline and will join broadcaster ITV as chief executive    ,0,1,1,55,144,244,0.018178653,0.30828896,0.67353237,Neu,-0.29011032,bbcbreaking
1485,2017-07-16 22:58:03,"George A Romero, who directed Night of the Living Dead, defining the zombie movie genre, dies at 77, US media report  ",1,1,0,122,1219,1319,0.02527729,0.20473608,0.76998657,Neu,-0.1794588,bbcbreaking
1487,2017-07-15 22:24:03,"At least eight dead after wall collapsed at Demba Dior football stadium in Senegal capital, Dakar, local media say  ",1,1,0,35,384,302,0.015295383,0.91782016,0.066884525,Neg,-0.90252477,bbcbreaking
1488,2017-07-15 21:32:05,"Sixteen-year-old boy arrested over five acid attacks in London on Thursday charged with 15 offences, police say  ",1,1,0,276,1078,1259,0.022242146,0.8798534,0.09790443,Neg,-0.8576113,bbcbreaking
1489,2017-07-15 11:20:01,"15-year-old girl dies after suffering adverse reaction from suspected ""legal high,"" police in Devon say  ",1,1,0,101,325,385,0.015007244,0.9354351,0.049557656,Neg,-0.92042786,bbcbreaking
1490,2017-07-14 15:46:05,"2 Ukrainian tourists killed, 4 others wounded in stabbing at Red Sea resort of Hurghada – Egyptian medical sources   ",1,1,0,40,328,222,0.03590937,0.81962126,0.14446938,Neg,-0.7837119,bbcbreaking
1491,2017-07-14 15:13:05,"Man arrested after six tourists injured in stabbing at hotel in Red Sea resort of Hurghada, Egyptian officials say  ",1,1,0,83,711,477,0.029990152,0.9148897,0.055120144,Neg,-0.88489956,bbcbreaking
1492,2017-07-14 14:59:02,"Second teenager arrested over five acid attacks in less than 90 minutes in London, say police   ",1,1,0,81,274,328,0.012006975,0.9164974,0.07149558,Neg,-0.9044904,bbcbreaking
1493,2017-07-14 12:58:00,Yachting firm boss guilty of failing to ensure safety of Cheeki Rafiki after four sailors died when it capsized  ,1,1,0,17,94,147,0.024439244,0.92159635,0.05396442,Neg,-0.89715713,bbcbreaking
1494,2017-07-14 10:19:00,"Two Israeli police officers have died after they were shot in an attack near a Jerusalem holy site, police say  ",1,1,0,131,305,332,0.020525115,0.8697292,0.109745644,Neg,-0.8492041,bbcbreaking
1496,2017-07-14 03:37:00,Police investigating four linked attacks in east London on Thursday night where a corrosive substance was thrown  ,1,1,0,47,246,234,0.02883683,0.86884546,0.10231782,Neg,-0.8400086,bbcbreaking
1497,2017-07-13 16:00:05,"Rhodri Philipps, 4th Viscount St Davids, jailed for 12 weeks for offering cash on Facebook for someone to kill Brexit campaigner Gina Miller  ",1,1,0,377,915,1504,0.043431725,0.78992426,0.16664399,Neg,-0.74649256,bbcbreaking
1498,2017-07-13 14:37:05,"""The man China couldn't erase"" - a look back at the life of Nobel laureate and human rights advocate Liu Xiaobo      ",0,1,1,130,2290,2379,0.09444313,0.02996383,0.87559295,Neu,0.0644793,bbcbreaking
1499,2017-07-13 14:27:01,"Chinese Nobel laureate Liu Xiaobo, jailed for his pro-democracy work, dies in hospital aged 61, officials say    ",1,1,0,191,2811,2053,0.04370263,0.5372031,0.41909426,Neg,-0.49350044,bbcbreaking
1501,2017-07-13 10:00:05,"PM Theresa May tells the BBC she ""shed a tear"" when she saw the 2017 UK general election exit poll  ",1,1,0,504,333,764,0.077512786,0.4040001,0.5184871,Neu,-0.3264873,bbcbreaking
1502,2017-07-13 09:28:02,"After being made honorary Manchester citizen following her response to terror attack  says her ""heart is very much still there""  ",1,1,0,107,584,2685,0.20726939,0.018541886,0.7741887,Neu,0.1887275,bbcbreaking
1504,2017-07-12 11:17:00,"Trillion-tonne iceberg breaks off Antarctica, say scientists who have monitored the growing crack for months  ",1,1,0,367,5039,3451,0.08852941,0.046199236,0.8652714,Neu,0.042330172,bbcbreaking
1505,2017-07-12 09:33:03,"Unemployment fell by 64,000 to 1.49 million in the three months to May, official figures show  ",1,1,0,155,343,619,0.015463331,0.9719524,0.012584316,Neg,-0.956489,bbcbreaking
1506,2017-07-11 17:29:04,Aristocrat found guilty of two charges of posting menacing Facebook comments about Brexit campaigner Gina Miller  ,1,1,0,154,454,665,0.029189806,0.8628565,0.107953764,Neg,-0.8336667,bbcbreaking
1507,2017-07-11 16:21:05,"Donald Trump Jr releases emails showing he was offered ""sensitive"" information on Clinton by a Russian national  ",1,1,0,181,880,971,0.037852753,0.6664662,0.2956811,Neg,-0.6286134,bbcbreaking
1508,2017-07-11 14:44:01,"Briton Luke Rutter, 24, from Birkenhead, killed fighting so-called Islamic State in Syria, say Kurdish fighters  ",1,1,0,63,190,285,0.028061992,0.7821107,0.18982731,Neg,-0.7540487,bbcbreaking
1509,2017-07-11 12:21:03,"UK Foreign Secretary Boris Johnson tells parliament EU can ""go whistle"" over ""extortionate"" Brexit bill proposals     ",0,1,1,287,448,814,0.039925683,0.8551076,0.10496677,Neg,-0.8151819,bbcbreaking
1510,2017-07-11 12:18:02,"Inquiry to be held into contaminated blood scandal that left at least 2,400 people dead, the prime minister says  ",1,1,0,57,400,394,0.014797448,0.88675916,0.09844332,Neg,-0.8719617,bbcbreaking
1511,2017-07-11 08:19:04,"US President Trump likely to come to UK next year, BBC understands, after denials he wanted to delay a state visit  ",1,1,0,393,420,677,0.10327783,0.28343827,0.6132839,Neu,-0.18016043,bbcbreaking
1513,2017-07-10 17:55:04,Conservative MP Anne Marie Morris has whip suspended over racist remark made during public Brexit discussion    ,1,1,0,234,446,623,0.019023443,0.9015494,0.07942715,Neg,-0.882526,bbcbreaking
1514,2017-07-10 17:00:04,IRA member Michael Hayes says he was part of group responsible for 1974 Birmingham bombs; apologises for 21 deaths    ,1,1,0,259,410,447,0.021414103,0.7064578,0.27212805,Neg,-0.6850437,bbcbreaking
1515,2017-07-10 10:51:04,"UK government arms sales to Saudi Arabia are lawful, the High Court rules, after seeing secret evidence  ",0,1,0,359,689,735,0.046557292,0.32309076,0.6303519,Neu,-0.27653348,bbcbreaking
1516,2017-07-09 14:36:04,"""He deserves a chance"" - Charlie Gard's parents deliver petition to  in London    ",0,1,0,218,642,1375,0.10290714,0.04269964,0.85439324,Neu,0.060207505,bbcbreaking
1518,2017-07-08 15:00:04,G20 recognises US decision to pull out of Paris climate deal but other 19 strongly committed to it - final statement  ,1,1,0,119,686,996,0.108268514,0.04140355,0.85032797,Neu,0.06686497,bbcbreaking
1519,2017-07-08 12:52:05,"A woman and three children have died after a house fire in Bolton, say Greater Manchester Police  ",1,1,0,64,223,321,0.012306994,0.9223026,0.065390304,Neg,-0.9099956,bbcbreaking
1520,2017-07-08 08:30:05,"Donald Trump says trade deal with UK will be agreed ""very very quickly"" as he meets Theresa May at the G20 summit.  ",1,1,1,451,646,1412,0.78937376,0.01896913,0.19165714,Pos,0.77040464,bbcbreaking
1521,2017-07-07 21:50:03,G20 protesters reported to be looting premises in Hamburg amid continuing clashes with police    ,1,1,0,307,469,445,0.014463423,0.94339997,0.04213661,Neg,-0.92893654,bbcbreaking
1522,2017-07-07 18:50:04,"Donald Trump had ""robust"" exchange with Vladimir Putin on alleged Russian meddling in US election, US officials say  ",1,1,0,212,229,482,0.62664217,0.2430432,0.1303146,Pos,0.38359898,bbcbreaking
1523,2017-07-07 17:54:01," We believe, in common with Charlie Gard's parents, ""it is right to explore this evidence"" -    ",0,1,0,42,129,420,0.13488069,0.013857525,0.8512618,Neu,0.12102316,bbcbreaking
1526,2017-07-07 15:22:00,"Speaking through translator, Putin tells Trump he hopes their meeting at the G20 summit ""yields positive results""    ",0,1,0,141,303,592,0.93873006,0.012494438,0.048775516,Pos,0.9262356,bbcbreaking
1527,2017-07-07 15:16:05,"""It's an honour to be with you"" - US President Donald Trump speaks after meeting with Russian leader Vladimir Putin    ",0,1,0,228,620,1006,0.7568948,0.017880717,0.22522442,Pos,0.7390141,bbcbreaking
1528,2017-07-07 13:00:02,"Face to face for the first time, Donald Trump meets Vladimir Putin   G20HH2017  ",0,1,0,139,357,575,0.080717936,0.015426115,0.903856,Neu,0.06529182,bbcbreaking
1530,2017-07-06 12:45:00,"""There are dire threats... to our way of life"" - Donald Trump says West will prevail over radical Islamic terrorism    ",0,1,1,313,560,1230,0.11419054,0.2011326,0.6846769,Neu,-0.086942054,bbcbreaking
1531,2017-07-06 11:25:01,"European Union and Japan conclude landmark free trade deal in Brussels, EU officials announce  ",0,1,0,199,889,1266,0.25067216,0.080215365,0.66911244,Neu,0.1704568,bbcbreaking
1532,2017-07-06 09:30:05,"Donald Trump to say in Poland speech ""fundamental question of our time is whether the West has the will to survive""  ",0,1,1,240,348,592,0.20658442,0.02318703,0.7702285,Neu,0.1833974,bbcbreaking
1533,2017-07-06 05:01:01,"Tony Blair was ""not straight'` with the UK before the Iraq War, Sir John Chilcot tells BBC a year on from his report  ",1,1,0,363,863,955,0.0790584,0.34762654,0.573315,Neu,-0.26856813,bbcbreaking
1534,2017-07-05 17:02:02,"Restrictions on Qatar will continue after it rejects ultimatum made by its Middle East neighbours, Saudi Arabia says  ",1,1,1,99,458,399,0.019194802,0.8595666,0.121238574,Neg,-0.84037185,bbcbreaking
1535,2017-07-05 13:26:00,"A number of jobcentres are to merge or close, affecting up to 750 jobs, Department for Work and Pensions says     ",0,1,0,189,314,307,0.007511182,0.96025664,0.032232217,Neg,-0.95274544,bbcbreaking
1537,2017-07-04 14:54:03,Grenfell Tower fire: Buildings at three NHS hospital trusts fail fire safety checks  ,0,1,0,99,552,450,0.011623898,0.9488461,0.03953006,Neg,-0.9372222,bbcbreaking
1538,2017-07-04 14:22:01,"Russia and China say North Korea missile test ""unacceptable"", demand moratorium on its nuclear and missile tests  ",0,1,0,197,970,1257,0.018294888,0.8426217,0.1390835,Neg,-0.8243268,bbcbreaking
1539,2017-07-04 10:55:05,"Human rights of boy, 16, breached by his being kept in cell at Feltham Young Offenders' Institution for long periods  ",1,1,0,142,293,362,0.02042737,0.9182395,0.061333183,Neg,-0.8978121,bbcbreaking
1540,2017-07-04 07:36:01,"North Korea announces a successful test of a long-range ""intercontinental"" missile  ",0,1,0,229,1142,795,0.7186287,0.0224401,0.25893122,Pos,0.6961886,bbcbreaking
1541,2017-07-03 20:34:00,10 injured after taxi hits crowd of people at Boston's Logan Airport; police say no suggestion crash intentional   ,0,1,0,82,351,281,0.020026632,0.93958455,0.040388767,Neg,-0.9195579,bbcbreaking
1543,2017-07-03 16:34:01,"Stormont power-sharing deal ""remains achievable"" - NI Secretary James Brokenshire tells Commons    ",0,1,0,79,105,186,0.7755812,0.011859298,0.21255946,Pos,0.7637219,bbcbreaking
1544,2017-07-03 15:03:03,Report into abuse of youngsters at Jersey children's home says it should be demolished  ,1,1,1,89,239,388,0.036664378,0.61442137,0.34891427,Neg,-0.577757,bbcbreaking
1546,2017-07-02 19:35:01,A drone flying close to Gatwick airport closes the runway and causes at least one flight to be diverted  ,1,1,0,193,773,675,0.010283604,0.94554496,0.044171527,Neg,-0.93526137,bbcbreaking
1547,2017-07-02 12:03:04,"Tennis star Andy Murray and his wife, Kim Sears, are expecting their second child     ",0,1,0,372,364,2840,0.04420676,0.05102962,0.9047636,Neu,-0.006822858,bbcbreaking
1548,2017-07-01 12:05:01,"Film critic Barry Norman has died aged 83, his family says  ",1,1,0,406,2002,2246,0.026056811,0.32388073,0.65006244,Neu,-0.2978239,bbcbreaking
1549,2017-06-30 22:58:04,"1 doctor killed & several ""fighting for lives"" after former employee opens fire at New York hospital, mayor says    ",1,1,0,172,653,427,0.03020129,0.82424915,0.14554952,Neg,-0.79404783,bbcbreaking
1550,2017-06-30 21:06:02,Gunman who opened fire on a number of people at a hospital in New York is dead – New York police official   ,1,1,0,110,650,530,0.038275566,0.68788254,0.27384183,Neg,-0.649607,bbcbreaking
1551,2017-06-30 20:24:03,Several casualties reported after gunman opens fire inside hospital in New York's Bronx district  ,1,1,0,271,2206,1118,0.017788665,0.9405606,0.04165074,Neg,-0.92277193,bbcbreaking
1554,2017-06-30 16:39:00,Parents of terminally-ill baby Charlie Gard are being allowed to spend more time with son —  hospital  ,1,1,0,391,273,879,0.104871295,0.0225144,0.8726143,Neu,0.0823569,bbcbreaking
1556,2017-06-30 15:05:04,"Drowning deaths of 7 men at Camber Sands, East Sussex, last summer caused by misadventure, coroner concludes  ",1,1,0,39,74,147,0.014551075,0.823663,0.16178589,Neg,-0.8091119,bbcbreaking
1558,2017-06-30 01:49:02,President Trump's controversial curbs on travellers from six mainly Muslim countries have come into effect  ,1,1,0,219,395,632,0.0927172,0.49406087,0.41322187,Neg,-0.40134367,bbcbreaking
1559,2017-06-29 18:54:00,3  shadow ministers sacked for backing Queen's Speech amendment calling for UK to stay in the single market  ,1,1,0,125,246,376,0.014540792,0.924836,0.060623296,Neg,-0.9102952,bbcbreaking
1560,2017-06-29 17:48:02,UK government wins Queen's Speech vote to approve its legislative programme    ,0,1,0,144,400,633,0.73774004,0.04382667,0.21843332,Pos,0.69391334,bbcbreaking
1562,2017-06-29 14:09:05,Russian court finds main suspect Zaur Dadayev guilty of murdering opposition leader Boris Nemtsov in 2015  ,0,1,0,52,163,243,0.061048046,0.7852316,0.15372033,Neg,-0.72418356,bbcbreaking
1563,2017-06-29 14:01:04,"Government intends to fund abortions in England for women arriving from Northern Ireland, UK chancellor says  ",0,1,0,164,489,1014,0.37506583,0.030614465,0.5943197,Neu,0.34445137,bbcbreaking
1564,2017-06-29 13:51:03,"Sir Martin Moore-Bick ""well aware"" GrenfellTower residents & local people want much ""broader investigation""    ",0,1,0,76,136,215,0.10522543,0.011228945,0.8835456,Neu,0.09399648,bbcbreaking
1565,2017-06-29 13:40:00,"GrenfellTower fire public inquiry judge ""doubtful"" the process will be as wide-ranging as some residents hope  ",0,1,1,68,142,165,0.098681256,0.05881038,0.8425084,Neu,0.039870877,bbcbreaking
1566,2017-06-29 12:14:02,"Culture secretary is ""minded to"" refer Rupert Murdoch's 21st Century Fox takeover of Sky to competition authority  ",1,1,0,91,226,382,0.023376431,0.049443584,0.92718,Neu,-0.026067153,bbcbreaking
1567,2017-06-29 07:41:01,"Australian Cardinal George Pell, accused of sex offences, says he will take leave from Vatican to clear his name  ",1,1,1,141,295,329,0.016659308,0.7872132,0.19612747,Neg,-0.7705539,bbcbreaking
1568,2017-06-29 02:32:01,A car reportedly rams the gate of the Brazilian president's palace as pressure grows on Michel Temer to resign  ,1,1,0,62,394,381,0.014314645,0.9378772,0.04780814,Neg,-0.9235625,bbcbreaking
1569,2017-06-29 01:11:04,"Australia's most senior Catholic, Cardinal George Pell, is charged with historical sex offences  ",1,1,0,233,829,849,0.027387902,0.70535296,0.2672592,Neg,-0.67796504,bbcbreaking
1571,2017-06-28 16:38:00,"Ex-chief constable Sir Norman Bettison says he'll ""vigorously defend"" his innocence over Hillsborough charges   ",0,1,1,90,95,208,0.23870823,0.23883517,0.52245665,Neu,-0.00012694299,bbcbreaking
1572,2017-06-28 14:57:03,"Final death toll from Grenfell Tower will not be known for many months, with 80 currently presumed dead, police say  ",1,1,1,146,550,422,0.011342469,0.8846575,0.10400004,Neg,-0.87331504,bbcbreaking
1573,2017-06-28 13:45:05,"""Now is a time for accountability"" - Lawyer for Hillsborough families reacts to charges being brought    ",1,1,0,70,529,824,0.063322745,0.63391703,0.3027603,Neg,-0.5705943,bbcbreaking
1574,2017-06-28 13:00:04,"Michael Bond, creator of Paddington Bear, has died aged 91 after a short illness  ",1,1,0,146,1497,1572,0.029601032,0.19024967,0.7801493,Neu,-0.16064863,bbcbreaking
1575,2017-06-28 12:11:00,PM: Cladding from 120 tower blocks in 37 local authority areas fails fire safety tests GrenfellTower   PMQs  ,0,1,0,71,303,340,0.090318255,0.24271467,0.6669671,Neu,-0.15239641,bbcbreaking
1576,2017-06-28 11:45:04,"Reports: Tesco is to axe 1,200 jobs at its head office    ",0,1,0,42,169,176,0.0097287595,0.97012985,0.020141317,Neg,-0.96040106,bbcbreaking
1579,2017-06-28 01:57:03,"Venezuela's president speaks of a ""terrorist attack"" after a helicopter apparently tries to bomb the Supreme Court  ",0,1,0,120,983,506,0.029042851,0.85764706,0.113310054,Neg,-0.8286042,bbcbreaking
1580,2017-06-27 18:57:01,"US Senate Republicans delay a vote on their healthcare bill, dealing a blow to their promise to replace Obamacare  ",0,1,0,105,486,848,0.013298673,0.94447744,0.042223915,Neg,-0.93117875,bbcbreaking
1581,2017-06-27 17:14:03,Judges at European Court reject plea from parents of terminally-ill Charlie Gard to intervene in his case  ,0,1,0,135,300,339,0.051111408,0.8749441,0.073944494,Neg,-0.8238327,bbcbreaking
1582,2017-06-27 15:55:05,Firms around the globe are reporting a major cyber-attack      ,0,1,0,163,2485,1105,0.012716596,0.9196068,0.067676604,Neg,-0.9068902,bbcbreaking
1584,2017-06-27 14:39:01,"Scotland's First Minister Nicola Sturgeon says plan for independence referendum will be ""reset"" until after Brexit  ",0,1,1,121,255,356,0.02304132,0.4512909,0.5256678,Neu,-0.4282496,bbcbreaking
1585,2017-06-27 12:38:01,"PM tells cabinet there needs to be ""a major national investigation"" into use of cladding GrenfellTower fire    ",0,1,0,55,153,242,0.03214093,0.5267724,0.4410867,Neg,-0.49463144,bbcbreaking
1586,2017-06-27 12:26:03,Cladding from 95 buildings in 32 local authorities in England have failed safety tests after Grenfell Tower fire  ,1,1,0,99,611,554,0.025260434,0.9289724,0.045767177,Neg,-0.903712,bbcbreaking
1587,2017-06-27 11:19:01,"Google ""respectfully"" disagrees with EU's decision & considers appeal against record fine    ",0,1,0,76,276,414,0.028246155,0.87088835,0.10086549,Neg,-0.8426422,bbcbreaking
1588,2017-06-27 10:52:02,Google fined record 2.42bn euros ($2.72bn) by European Commission for illegally favouring its own shopping service  ,1,1,0,188,1170,1185,0.017503798,0.9541897,0.02830644,Neg,-0.9366859,bbcbreaking
1589,2017-06-27 03:01:05,"US warns Syria of ""heavy price"" over ""potential preparations for another chemical weapons attack""  ",0,1,0,219,521,541,0.024661541,0.9108001,0.06453831,Neg,-0.88613856,bbcbreaking
1590,2017-06-27 00:22:04,Brazil's president Michel Temer charged with accepting bribes by chief prosecutor  ,1,1,0,77,546,515,0.059081674,0.79659337,0.14432491,Neg,-0.7375117,bbcbreaking
1591,2017-06-26 21:34:02,"Some 22 million Americans could lose insurance under Senate bill to replace Obamacare, congressional report says  ",0,1,1,274,1324,860,0.010212615,0.9419763,0.047811013,Neg,-0.9317637,bbcbreaking
1592,2017-06-26 17:28:02,"President Trump says Supreme Court ruling on travel ban is ""clear victory"" for US national security  ",0,1,0,225,455,795,0.7961419,0.08414044,0.11971765,Pos,0.7120015,bbcbreaking
1593,2017-06-26 17:22:00,75 tower blocks have failed fire safety tests - Communities Secretary Sajid Javid says   GrenfellTower  ,1,1,0,110,490,416,0.03775084,0.85034007,0.11190911,Neg,-0.8125892,bbcbreaking
1595,2017-06-26 15:56:04,Firm which supplied cladding thought to have been on London's Grenfell Tower ends global sales for high-rise blocks  ,1,1,0,91,333,382,0.62627023,0.33132297,0.04240677,Pos,0.29494727,bbcbreaking
1596,2017-06-26 15:43:05,US Supreme Court allows part of Trump travel ban to go into effect and will hear full case in October  ,0,1,1,167,924,807,0.08355922,0.1299793,0.78646153,Neu,-0.046420075,bbcbreaking
1597,2017-06-26 14:59:02,"EU citizens living in UK after Brexit under ""settled status"" to have same rights as Britons to bring family to UK    ",0,1,0,173,507,644,0.054202616,0.015799368,0.929998,Neu,0.03840325,bbcbreaking
1598,2017-06-26 14:32:02,"Hostage Johan Gustafsson, held by al-Qaeda in Mali since 2011, has been freed - Swedish government  ",1,1,0,64,424,907,0.033945825,0.68918496,0.27686915,Neg,-0.65523916,bbcbreaking
1599,2017-06-26 13:36:01,Ex-Archbishop of Canterbury Lord Carey quits honorary church role after criticism of his handling of child abuse  ,0,1,0,102,217,330,0.012766309,0.90535456,0.0818791,Neg,-0.89258826,bbcbreaking
1602,2017-06-26 12:07:04,UK observes minute's silence following last week's terror attack at Finsbury Park      ,0,1,0,86,382,990,0.038062602,0.54372156,0.41821578,Neg,-0.505659,bbcbreaking
1604,2017-06-26 11:44:02,"DUP agreement with Conservatives provides ""stable government"" in UK's ""national interest"" -  Arlene Foster    ",0,1,0,338,370,467,0.42451438,0.012329077,0.5631565,Neu,0.4121853,bbcbreaking
1605,2017-06-26 11:15:04,Conservatives reach agreement with DUP to support minority government      ,0,1,0,356,825,820,0.9188266,0.023836438,0.05733705,Pos,0.89499015,bbcbreaking
1606,2017-06-26 08:53:01,China's Nobel laureate Liu Xiaobo granted medical parole after being diagnosed with terminal liver cancer  ,1,1,0,43,339,389,0.35051543,0.3484489,0.3010356,Pos,0.0020665228,bbcbreaking
1607,2017-06-25 22:06:02,"Boat with 150 tourists on board sinks on reservoir in north-western Colombia, officials say  ",0,1,0,72,599,395,0.007637121,0.9581066,0.03425629,Neg,-0.95046943,bbcbreaking
1608,2017-06-25 17:28:02,"Cladding on 60 high-rise buildings across 25 council areas fails fire safety tests, UK government says  ",0,1,0,176,795,651,0.06260264,0.8561907,0.081206635,Neg,-0.79358804,bbcbreaking
1611,2017-06-25 08:25:03,"Pakistan oil tanker fire latest: More than 120 people killed, officials say, as footage emerges from the scene     ",1,1,0,181,1551,1151,0.02409437,0.82870764,0.14719798,Neg,-0.8046133,bbcbreaking
1612,2017-06-25 05:12:01,"Oil lorry catches fire in the Pakistani city of Bahawalpur, with a number of deaths reported  ",1,1,0,63,301,300,0.010858601,0.9495595,0.039581943,Neg,-0.9387009,bbcbreaking
1613,2017-06-24 15:59:04,"UK Parliament has been hit by cyber-attack, says Liberal Democrat peer Lord Rennard  ",1,1,0,230,1398,936,0.010834774,0.95298743,0.036177807,Neg,-0.9421527,bbcbreaking
1614,2017-06-24 10:36:05,"Cladding on 27 high-rise blocks of flats in 15 council areas fail fire safety tests, UK government says  ",0,1,0,127,566,553,0.093057714,0.84946525,0.05747698,Neg,-0.75640756,bbcbreaking
1615,2017-06-24 03:08:03,"100 people missing after a landslide destroyed about 40 homes in China's Sichuan province, state media report  ",0,1,0,71,540,373,0.024537155,0.885721,0.08974184,Neg,-0.8611839,bbcbreaking
1616,2017-06-23 20:44:01,Camden Council leader says 5 tower blocks with 800 homes will be evacuated over cladding fears    ,1,1,1,295,1298,1181,0.010901229,0.9156071,0.073491685,Neg,-0.9047059,bbcbreaking
1618,2017-06-23 17:17:04,"Five people, including three children, die of electrocution at water park in north-west Turkey, Turkish media say  ",0,1,0,74,384,306,0.013392544,0.88580334,0.100804165,Neg,-0.8724108,bbcbreaking
1619,2017-06-23 13:53:03,"UK offer for EU citizens ""below expectations"" & ""risks worsening the situation"" - EU Council President Donald Tusk    ",0,1,0,245,721,692,0.07842876,0.84188086,0.079690345,Neg,-0.7634521,bbcbreaking
1621,2017-06-23 11:10:00,"Manslaughter charges will be considered over Grenfell Tower fire in London, Metropolitan Police say   ",1,1,1,106,1086,1187,0.019229995,0.7285255,0.25224444,Neg,-0.7092955,bbcbreaking
1622,2017-06-23 11:04:00,"Ex-loyalist paramilitary turned ""supergrass"" admits in NI 200 charges, including five murders and terror offences  ",1,1,0,38,241,196,0.046601973,0.747984,0.20541409,Neg,-0.70138204,bbcbreaking
1623,2017-06-23 11:02:03,"Grenfell fire began in Hotpoint fridge freezer model FF175BP that was not subject to recall, police say    ",1,1,0,196,871,697,0.02024206,0.77314645,0.20661141,Neg,-0.7529044,bbcbreaking
1624,2017-06-23 10:55:01,Grenfell fire update: •9 confirmed & 79 assumed dead •600+ emergency calls on night •insulation & tiles failed tests    ,1,1,0,53,421,378,0.013820835,0.92317545,0.063003674,Neg,-0.9093546,bbcbreaking
1625,2017-06-23 10:43:05,"Grenfell Tower blaze in London started with fridge fire and outside cladding failed safety test, police say  ",1,1,0,105,611,448,0.012664313,0.935908,0.051427737,Neg,-0.9232437,bbcbreaking
