,date,tweet,past_tense,present_tense,future_tense,replies_count,retweets_count,likes_count,pos_score,neg_score,neutral_score,sentiment,Sentiment_Score,user
718,2017-11-16 14:45:04,"Police investigating 19-year-old Gaia Pope's disappearance have discovered ""items of women's clothing"" in field near Swanage,  say    ",1,1,0,69,122,226,0.014549235,0.87651247,0.1089383,Neg,-0.8619632,bbcbreaking
720,2017-11-16 10:44:05,Former entertainer Rolf Harris has one of 12 indecent assault convictions overturned by Court of Appeal  ,1,1,0,96,103,193,0.10771591,0.68784565,0.20443848,Neg,-0.58012974,bbcbreaking
721,2017-11-16 10:24:03,"Cambodia's Supreme Court dissolves main opposition party, leaving no serious challenge to leadership of Hun Sen  ",0,1,0,50,175,196,0.015136564,0.8451754,0.13968804,Neg,-0.83003885,bbcbreaking
722,2017-11-16 09:38:05,Final death toll from Grenfell Tower fire stands at 71 as  believe all victims of the blaze have now been identified    ,1,1,0,145,555,745,0.04449168,0.5076474,0.44786093,Neg,-0.46315572,bbcbreaking
723,2017-11-16 08:58:01,Missing UK explorer Benedict Allen seen 'alive and well' near airstrip in Papua New Guinea and has requested rescue  ,1,1,0,119,336,1388,0.12777701,0.3727199,0.49950317,Neu,-0.2449429,bbcbreaking
724,2017-11-16 01:02:01,'Leonardo da Vinci artwork' sells for a record-breaking $450m at an auction in New York  ,0,1,0,212,931,1739,0.48350337,0.013391987,0.5031046,Neu,0.47011137,bbcbreaking
725,2017-11-15 11:49:02,"South Africa's President Jacob Zuma: Envoy being sent to Zimbabwe, hoping for return of ""peace and stability""    ",1,1,0,234,579,654,0.6169936,0.02210443,0.36090198,Pos,0.59488916,bbcbreaking
726,2017-11-15 11:25:00,"UK actor Keith Barron, who starred in Duty Free, has died aged 83 after a short illness  ",1,1,0,104,245,405,0.030414661,0.30023965,0.6693457,Neu,-0.26982498,bbcbreaking
727,2017-11-15 10:36:01," Zimbabwe's Robert Mugabe is confined to his home but fine, says South African president after speaking to him  ",1,1,0,71,249,248,0.19874856,0.34098518,0.46026623,Neu,-0.14223662,bbcbreaking
728,2017-11-15 10:09:04,Scotland set to be first country to set minimum alcohol prices after UK Supreme Court dismisses appeal against plan  ,1,1,0,166,409,696,0.12301596,0.042384483,0.8345996,Neu,0.08063148,bbcbreaking
729,2017-11-15 10:01:03,"Zimbabwe latest:  -  Jacob Zuma says ""great concern"" about situation - Army takes control of state TV, says Mugabe ""safe"" - Embassies tell citizens to stay indoors - Armoured vehicles patrol Harare  Live updates:    ",0,1,0,162,1051,830,0.04691804,0.07306622,0.8800158,Neu,-0.026148181,bbcbreaking
730,2017-11-15 09:34:01,"UK unemployment fell by 59,000 between July and September to 1.42 million, official figures show.  ",1,1,0,232,360,749,0.012162699,0.972013,0.015824303,Neg,-0.9598503,bbcbreaking
731,2017-11-15 02:46:01,"Zimbabwe army says it wants to ""target criminals"" not President Mugabe, denying a ""military takeover of government""  ",0,1,0,126,822,553,0.046758465,0.32433966,0.6289019,Neu,-0.2775812,bbcbreaking
732,2017-11-15 00:10:02,"Zimbabwe troops take over national broadcaster ZBC as blasts are heard on streets of capital Harare, Reuters report  ",1,1,0,136,1838,1031,0.047256332,0.41844243,0.5343012,Neu,-0.3711861,bbcbreaking
733,2017-11-14 23:05:01,Australians vote 61.6% in favour of legalising same-sex marriage in non-binding poll with 79.5% participation  ,0,1,0,303,4969,14681,0.30932817,0.082781814,0.60789007,Neu,0.22654635,bbcbreaking
734,2017-11-14 18:54:05,"Zimbabwe's governing party accuses army chief of ""treasonable conduct"" over comments challenging President Mugabe  ",0,1,0,75,290,328,0.019575221,0.8961393,0.084285475,Neg,-0.8765641,bbcbreaking
735,2017-11-14 09:34:05,"UK's key measure of inflation, the Consumer Prices Index, remains at five-year high of 3% in October, ONS says  ",0,1,0,68,222,299,0.10109188,0.8537123,0.04519589,Neg,-0.75262046,bbcbreaking
736,2017-11-13 17:32:00,BBC Exclusive: Secret details of deal that let hundreds of IS fighters escape from Raqqa in Syria  ,1,1,0,175,1059,852,0.046728577,0.08219105,0.87108034,Neu,-0.035462473,bbcbreaking
737,2017-11-13 16:57:00,"More than 400 killed and 7,000 injured in the Iran-Iraq border earthquake — making it the deadliest in the world this year   ",1,1,0,73,1005,573,0.0259468,0.8864843,0.08756887,Neg,-0.8605375,bbcbreaking
738,2017-11-13 16:34:02,"UK Parliament will get vote on final Brexit deal before the country leaves EU, minister David Davis tells MPs  ",0,1,1,311,1292,1867,0.09868357,0.02557517,0.87574124,Neu,0.073108405,bbcbreaking
740,2017-11-13 09:02:01,"Death toll in Iran-Iraq border earthquake rises to 335, officials say, with thousands more injured   ",0,1,0,74,767,594,0.052290305,0.9220106,0.02569913,Neg,-0.8697203,bbcbreaking
744,2017-11-12 20:42:01,"Six people killed in Iran and four in Iraq after strong earthquake in border area, officials say  ",1,1,0,74,585,447,0.017067123,0.9391553,0.04377756,Neg,-0.92208815,bbcbreaking
745,2017-11-12 19:16:00,"Magnitude-7.2 earthquake hits Iran-Iraq border region, the US Geological Survey says  ",0,1,0,124,1320,944,0.023501765,0.8899828,0.086515404,Neg,-0.86648107,bbcbreaking
746,2017-11-12 18:48:02,"Lebanon's PM Saad Hariri says he is free in Saudi Arabia, resigned to protect himself and will return home ""in days""  ",1,1,1,51,247,316,0.17847255,0.10922484,0.71230257,Neu,0.06924771,bbcbreaking
747,2017-11-12 11:56:03,"Spanish PM Rajoy says ""we must pull Catalonia back from havoc of separatism"", during visit to Barcelona  ",0,1,1,113,127,250,0.24872437,0.14402625,0.60724944,Neu,0.10469812,bbcbreaking
748,2017-11-12 11:12:01,Prince Charles lays a wreath on behalf of the Queen at RemembranceSunday commemorations in London    ,0,1,0,173,1272,4622,0.06124654,0.021642637,0.9171108,Neu,0.039603904,bbcbreaking
750,2017-11-11 11:24:04,Putin denounces 'absurd' claims of meddling in US election after President Trump says Russian leader felt insulted  ,1,1,0,292,229,487,0.033590235,0.84062815,0.1257817,Neg,-0.8070379,bbcbreaking
751,2017-11-11 11:17:02,Millions of people have fallen silent to mark ArmisticeDay      ,1,1,0,134,2067,6444,0.093849264,0.30318826,0.6029625,Neu,-0.209339,bbcbreaking
752,2017-11-11 10:46:04,"Millions of people will fall silent at 11:00GMT to remember war dead, as ArmisticeDay is marked in UK and Commonwealth countries  ",1,1,1,86,1055,3346,0.026435928,0.14168179,0.8318823,Neu,-0.115245864,bbcbreaking
753,2017-11-10 18:39:03,"Comedian Louis C.K. issues frank statement admitting sexual misconduct, saying: ""I wielded power irresponsibly""  ",1,1,0,218,394,634,0.06894119,0.75492495,0.17613383,Neg,-0.6859838,bbcbreaking
754,2017-11-10 16:24:04,"Two Chinese students seriously hurt by car deliberately driven at them outside Toulouse college, French media say  ",1,1,0,90,597,466,0.015373696,0.9392318,0.04539452,Neg,-0.9238581,bbcbreaking
755,2017-11-10 11:13:03,Taxi firm  loses appeal against ruling that its drivers should be classed as workers rather than self-employed      ,1,1,1,91,537,720,0.037711963,0.88101166,0.08127637,Neg,-0.8432997,bbcbreaking
756,2017-11-09 14:48:02,Penny Mordaunt named as UK international development secretary after Priti Patel resigns over Israel meetings row  ,1,1,0,83,132,201,0.019359792,0.6680199,0.31262037,Neg,-0.6486601,bbcbreaking
757,2017-11-09 14:31:04,Penny Mordaunt set to become international development secretary after Priti Patel resigns over Israel meetings row  ,1,1,0,96,191,331,0.024146805,0.3625193,0.6133339,Neu,-0.3383725,bbcbreaking
758,2017-11-08 19:38:01,"Ex-UK minister Priti Patel releases statement: Israeli meetings ""fell below the high standards expected""    ",1,1,0,110,157,216,0.017796658,0.96117866,0.021024607,Neg,-0.943382,bbcbreaking
759,2017-11-08 19:16:05,Priti Patel resigns as UK international development secretary after row over meeting Israeli politicians    ,0,1,0,424,1090,1710,0.011950549,0.9258275,0.06222191,Neg,-0.91387695,bbcbreaking
760,2017-11-08 15:39:01,"Celebrity chef and restaurateur Antonio Carluccio has died at the age of 80, his agent confirms  ",1,1,0,318,978,1834,0.0226143,0.22794457,0.74944115,Neu,-0.20533027,bbcbreaking
762,2017-11-07 18:00:05,"Prince Charles lobbied on climate policy change after $113,000 shares buy, leaked ParadisePapers suggest  ",1,1,0,293,939,915,0.056578163,0.07893375,0.864488,Neu,-0.02235559,bbcbreaking
763,2017-11-07 14:38:05,Matthew Scully-Hicks jailed for life & must serve minimum of 18 years for murdering adopted baby daughter in Cardiff  ,1,1,1,481,346,1068,0.051779225,0.63185436,0.31636637,Neg,-0.58007514,bbcbreaking
765,2017-11-07 06:56:00,"Gunmen storm local TV station in Afghan capital Kabul, killing some staff, eyewitnesses say  ",0,1,0,79,467,345,0.015439379,0.9013061,0.08325454,Neg,-0.8858667,bbcbreaking
766,2017-11-06 18:03:01,". secretly set up a new structure to continue avoiding billions of dollars in tax, ParadisePapers reveal   ",1,1,0,231,1874,1703,0.10293596,0.016117422,0.88094664,Neu,0.08681854,bbcbreaking
768,2017-11-06 16:33:01,"Texas gunman had three guns and had been involved a domestic row with his mother-in-law, officials say  ",1,1,0,152,334,397,0.017361406,0.8725236,0.11011492,Neg,-0.8551622,bbcbreaking
769,2017-11-06 15:01:01,"Zimbabwe's President Mugabe sacks ""disloyal"" vice-president, boosting Grace Mugabe's hopes of succeeding her husband  ",0,1,0,95,461,354,0.33380368,0.5426308,0.12356549,Neg,-0.20882711,bbcbreaking
770,2017-11-06 13:25:01,"One British hostage killed after kidnapping in Nigeria, three others freed, UK Foreign Office confirms  ",1,1,0,42,322,211,0.033362404,0.70677453,0.25986305,Neg,-0.67341214,bbcbreaking
772,2017-11-06 12:21:04,"Matthew Scully-Hicks, 31, convicted by jury in Cardiff of murdering 18-month-old adopted daughter Elsie  ",1,1,0,112,200,274,0.0329449,0.8187127,0.14834234,Neg,-0.7857678,bbcbreaking
773,2017-11-05 23:49:02," 26 people killed in shooting in Sutherland Springs, the worst in modern Texas history, governor Greg Abbott confirms  ",1,1,0,101,296,223,0.015512638,0.92273736,0.06175011,Neg,-0.9072247,bbcbreaking
774,2017-11-05 20:56:00, Sutherland Springs shooting  • Reports say 27 people dead  • At least 20 injured • Gunman killed  Follow latest:    ,1,1,0,139,1028,607,0.014741409,0.85727185,0.12798682,Neg,-0.8425304,bbcbreaking
776,2017-11-05 20:28:04,"The Queen’s private estate has invested about £10m offshore, ParadisePapers reveal    ",1,1,0,265,1180,1027,0.10936092,0.012939041,0.8777001,Neu,0.096421875,bbcbreaking
777,2017-11-05 20:26:00,"At least 27 dead in Texas church shooting,  provides updates on events in Sutherland Springs    ",0,1,0,501,4476,2487,0.029642599,0.19318001,0.7771774,Neu,-0.16353741,bbcbreaking
778,2017-11-05 19:59:04,"At least 27 people killed in Texas church shooting, police commissioner in Sutherland Springs tells US media  ",1,1,0,367,5909,2556,0.02093109,0.8244316,0.15463737,Neg,-0.80350053,bbcbreaking
780,2017-11-05 19:18:05,"Mass shooting reported at church in Texas, with local media saying there are multiple victims  ",1,1,0,480,3147,1816,0.026636552,0.865485,0.107878424,Neg,-0.8388485,bbcbreaking
783,2017-11-05 18:17:04,Top member of  administration has business links with Russian allies of Putin   ParadisePapers,0,1,0,338,2550,2867,0.0676692,0.018798668,0.9135321,Neu,0.04887053,bbcbreaking
784,2017-11-05 18:06:03,"Queen’s private estate put cash in Cayman Islands & Bermuda funds in 2004-2005, leaked paradisepapers show    ",1,1,0,264,1247,974,0.05568916,0.017115336,0.9271954,Neu,0.038573824,bbcbreaking
785,2017-11-05 18:00:04,"Huge new leak reveals how wealthy & powerful, including Queen's private estate, invest offshore   ParadisePapers  ",0,1,0,172,2379,1883,0.04140105,0.02428827,0.93431073,Neu,0.01711278,bbcbreaking
786,2017-11-05 12:56:05,Ex-Catalan leader Carles Puigdemont and several former advisors turn themselves in to Belgian police  ,0,1,0,199,1137,948,0.035079505,0.32026774,0.64465284,Neu,-0.28518823,bbcbreaking
787,2017-11-04 22:15:05,"In Saudi Arabia, 10 princes and dozens of ministers are detained by new anti-corruption body, state media report  ",1,1,0,218,1969,1898,0.011077646,0.9051954,0.083726905,Neg,-0.8941178,bbcbreaking
788,2017-11-04 18:52:03,"MSP Mark McDonald quits as Scottish government minister over actions ""considered to be inappropriate""  ",1,1,0,105,238,249,0.008312994,0.94664836,0.045038633,Neg,-0.93833536,bbcbreaking
789,2017-11-04 18:16:01,"Loud explosion heard near Riyadh's airport, unconfirmed reports say Saudis intercepted missile from Yemen  ",1,1,0,137,1620,997,0.062172517,0.641106,0.29672143,Neg,-0.5789335,bbcbreaking
790,2017-11-03 21:52:04,"Dover MP Charlie Elphicke denies ""any wrongdoing"" after being suspended by Tories following ""serious allegations""    ",1,1,0,47,81,155,0.014696042,0.9350157,0.050288316,Neg,-0.9203196,bbcbreaking
791,2017-11-03 21:17:03,"Tory MP Charlie Elphicke suspended by party after ""serious allegations"" referred to the police, Conservatives say  ",1,1,0,108,469,469,0.0148660205,0.9182614,0.0668726,Neg,-0.9033954,bbcbreaking
793,2017-11-03 18:48:00,"Suspended Labour MP Kelvin Hopkins ""absolutely and categorically"" denies sexual harassment claim by party activist  ",1,1,0,66,101,156,0.023332544,0.8610199,0.11564749,Neg,-0.8376874,bbcbreaking
794,2017-11-03 16:36:05,"Iraqi forces take key town of al-Qaim from so-called Islamic State, hours after the fall of Deir al-Zour in Syria  ",0,1,0,60,250,542,0.052880704,0.68379384,0.26332548,Neg,-0.63091314,bbcbreaking
795,2017-11-03 15:55:02,"US soldier Bowe Bergdahl spared prison time after deserting his Afghan outpost in 2009, judge rules   ",1,1,0,106,133,351,0.1994958,0.33059087,0.46991327,Neu,-0.13109507,bbcbreaking
796,2017-11-03 07:40:00,"The Syrian army has retaken Deir al-Zour, the last major stronghold of so-called Islamic State in Syria - state TV  ",1,1,0,64,331,858,0.03647129,0.6386061,0.32492268,Neg,-0.60213476,bbcbreaking
797,2017-11-02 20:38:00,Labour suspends Luton North MP Kelvin Hopkins and launches investigation after allegations made  ,1,1,0,76,284,289,0.011816808,0.9315005,0.05668273,Neg,-0.9196837,bbcbreaking
798,2017-11-02 19:15:02,President Trump confirms Jerome Powell as his nominee for chair of US Federal Reserve  ,0,1,0,60,101,154,0.06071426,0.022613132,0.9166725,Neu,0.03810113,bbcbreaking
801,2017-11-02 14:42:01,Spanish prosecutor calls on court to issue European arrest warrant for sacked Catalan leader Carles Puigdemont  ,0,1,0,140,566,371,0.028516842,0.8894028,0.08208035,Neg,-0.860886,bbcbreaking
802,2017-11-02 12:07:05,Mysteries of the pyramids deepen with discovery of what appears to be a large void within the Great Pyramid of Giza    ,0,1,0,346,3564,7208,0.06933683,0.0239706,0.90669256,Neu,0.04536623,bbcbreaking
803,2017-11-02 12:01:04,"UK interest rates rise for first time in 10 years from 0.25% to 0.5%, Bank of England announces  ",0,1,0,129,884,800,0.90411824,0.042571794,0.053310048,Pos,0.86154646,bbcbreaking
804,2017-11-02 10:35:03,"Gavin Williamson is announced as UK defence secretary, replacing Sir Michael Fallon who resigned on Wednesday  ",1,1,0,90,242,207,0.036643095,0.1398003,0.82355654,Neu,-0.1031572,bbcbreaking
805,2017-11-02 07:31:00,Two charged with negligence over deaths of three soldiers who died on SAS training course in Brecon Beacons in 2013  ,1,1,0,55,156,330,0.018919272,0.9124344,0.06864632,Neg,-0.8935151,bbcbreaking
806,2017-11-02 03:37:00,Myanmar leader Aung San Suu Kyi makes first visit to troubled Rakhine state since mass exodus of Rohingya Muslims  ,0,1,0,81,225,296,0.10778507,0.23276216,0.65945274,Neu,-0.12497709,bbcbreaking
808,2017-11-01 21:11:02,US prosecutors file terror charges against suspect in New York truck attack  ,0,1,0,42,130,274,0.043946892,0.74927324,0.2067799,Neg,-0.7053263,bbcbreaking
809,2017-11-01 20:29:02,"Ex-UK Defence Secretary Sir Michael Fallon says his behaviour may have ""fallen below"" armed forces' high standards     ",1,1,1,209,355,437,0.011633954,0.94549924,0.042866886,Neg,-0.9338653,bbcbreaking
810,2017-11-01 19:31:05,Defence Secretary Sir Michael Fallon resigns following allegations of past behaviour  ,0,1,0,268,1142,1285,0.012122875,0.9223961,0.065481015,Neg,-0.91027325,bbcbreaking
811,2017-11-01 16:56:01,President Trump calls for green card lottery to be scrapped after New York truck attack    ,1,1,0,365,549,863,0.039047718,0.46132663,0.49962565,Neu,-0.4222789,bbcbreaking
812,2017-11-01 11:16:05,Ex-UKIP donor and Leave.EU chairman Arron Banks faces probe over whether he broke donation rules during referendum  ,1,1,0,97,321,486,0.012756426,0.92725533,0.059988175,Neg,-0.9144989,bbcbreaking
813,2017-11-01 05:14:03,Australia's Senate president says he will resign after confirming he is a UK dual citizen  ,0,1,1,80,275,419,0.0152667295,0.8595664,0.12516682,Neg,-0.8442997,bbcbreaking
814,2017-10-31 22:49:01,"New York truck attack  - At least 8 dead, 11 injured - Attacker named by media as Sayfullo Saipov  Latest updates:    ",1,1,0,83,524,380,0.020144233,0.6710477,0.30880815,Neg,-0.65090346,bbcbreaking
815,2017-10-31 21:44:00,"Donald Trump describes New York terror attack suspect as ""very sick and deranged person""  ",1,1,0,143,233,346,0.017151333,0.8055237,0.17732489,Neg,-0.78837234,bbcbreaking
816,2017-10-31 21:34:00,"""This was an act of terror"" - New York mayor says at least 8 people killed, more than 12 others hurt in attack    ",1,1,0,145,1386,1158,0.012044836,0.93376637,0.054188818,Neg,-0.9217215,bbcbreaking
818,2017-10-31 19:41:02,"One person is in custody after apparent shooting incident in Lower Manhattan, say New York Police Department  ",0,1,0,49,546,350,0.016484322,0.8445525,0.13896325,Neg,-0.8280682,bbcbreaking
820,2017-10-31 14:42:01,"Five children & their father believed to have been killed in farmhouse fire in Llangammarch Wells, Powys, police say    ",1,1,0,48,135,188,0.017463276,0.8394016,0.14313512,Neg,-0.82193834,bbcbreaking
821,2017-10-31 12:20:02,Catalonia's sacked President Carles Puigdemont says he has not travelled to Belgium to seek asylum  ,1,1,0,119,410,514,0.04462057,0.35318998,0.6021895,Neu,-0.3085694,bbcbreaking
822,2017-10-31 12:10:00,"Explosion in Afghan capital causes many casualties in diplomatic zone, reports say  ",0,1,0,57,331,261,0.012620921,0.9246758,0.062703274,Neg,-0.9120549,bbcbreaking
823,2017-10-31 07:11:02,Government to consider cutting maximum stake for fixed-odds betting terminals to as little as £2  ,0,1,0,95,134,406,0.07807423,0.26925784,0.6526679,Neu,-0.19118361,bbcbreaking
824,2017-10-30 14:41:00,"Donald Trump insists there was ""no collusion"", after ex-aide Paul Manafort charged in Russia inquiry  ",1,1,0,146,193,361,0.04349701,0.6644633,0.29203966,Neg,-0.62096626,bbcbreaking
825,2017-10-30 14:37:01,"Uhuru Kenyatta declared winner of Kenya's disputed presidential poll, despite four opposition areas not having voted  ",1,1,0,89,319,342,0.40001342,0.119638965,0.4803476,Neu,0.28037447,bbcbreaking
826,2017-10-30 14:13:05,"Aid for 40,000 people finally reaches starving civilians in Eastern Ghouta, last rebel-held enclave near Damascus  ",0,1,0,37,178,480,0.19002047,0.46002278,0.34995675,Neg,-0.2700023,bbcbreaking
827,2017-10-30 13:04:04,"Peter Madsen admits dismembering body of Swedish journalist Kim Wall aboard his submarine, but denies killing her    ",0,1,0,156,369,374,0.034902588,0.5965558,0.3685416,Neg,-0.56165326,bbcbreaking
828,2017-10-30 12:08:02,"President Trump's ex-campaign manager Paul Manafort to face charges in Russia inquiry, reports say  ",0,1,0,213,1202,2150,0.0196881,0.827139,0.15317294,Neg,-0.8074509,bbcbreaking
830,2017-10-30 11:43:01,Spanish prosecutor announces charges including rebellion against Catalan leaders behind declaration of independence.  ,0,1,0,126,839,517,0.03348409,0.74361527,0.22290063,Neg,-0.71013117,bbcbreaking
831,2017-10-30 11:30:02,Review calls for sweeping changes in way deaths and serious incidents in custody are handled in England and Wales  ,1,1,0,34,97,165,0.055065967,0.035841428,0.90909255,Neu,0.01922454,bbcbreaking
832,2017-10-30 10:00:04,"CO2 in the Earth's atmosphere jumped to a record high in 2016, says the World Meteorological Organization.  ",1,1,0,154,1348,943,0.7356852,0.04209898,0.22221583,Pos,0.69358623,bbcbreaking
834,2017-10-28 13:46:01,Sacked Catalan leader Carles Puigdemont calls for democratic opposition to direct rule from the Spain's government  ,0,1,0,189,581,734,0.06321803,0.11352345,0.8232586,Neu,-0.050305426,bbcbreaking
835,2017-10-28 08:24:00,Spain's deputy PM is put in charge of Catalonia as government officially takes charge of rebellious region  ,1,1,0,259,685,803,0.03365747,0.029558707,0.93678385,Neu,0.004098762,bbcbreaking
836,2017-10-27 19:33:01,"Spain's PM Mariano Rajoy dissolves Catalan parliament and calls snap election to ""recover normality"" in the region    ",0,1,0,220,1136,921,0.02788079,0.83364624,0.1384729,Neg,-0.80576545,bbcbreaking
837,2017-10-27 19:31:01,"Spain's PM Mariano Rajoy dissolves Catalan parliament and calls snap election to ""recover normality"" in the region  ",0,1,0,133,695,638,0.02788079,0.83364624,0.1384729,Neg,-0.80576545,bbcbreaking
838,2017-10-27 17:35:03,"The UK will not recognise the Catalan parliament's decision to declare independence from Spain, Downing Street says  ",0,1,1,872,2049,2117,0.0503792,0.5147038,0.43491694,Neg,-0.4643246,bbcbreaking
839,2017-10-27 15:13:00,"Spanish Senate approves direct rule of Catalonia by Madrid, marking major escalation in constitutional crisis  ",0,1,0,151,1607,1167,0.043110594,0.9194037,0.037485685,Neg,-0.87629306,bbcbreaking
841,2017-10-27 14:26:05,"Catalan parliament votes to declare independence from Spain, just as Madrid looks set to impose direct rule  ",1,1,0,224,4954,4659,0.17666806,0.05773265,0.76559925,Neu,0.11893541,bbcbreaking
843,2017-10-26 23:11:01,"President Trump orders release of nearly 3,000 files on John F Kennedy assassination, but blocks release of others  ",0,1,0,296,805,1092,0.023694847,0.57588583,0.40041924,Neg,-0.55219096,bbcbreaking
845,2017-10-26 19:38:05,President Trump declares the US painkiller-addiction crisis a national public health emergency  ,0,1,0,173,269,572,0.031619783,0.7861353,0.18224484,Neg,-0.7545155,bbcbreaking
846,2017-10-26 16:10:05,Catalan leader rules out snap regional election and asks parliament to decide next step in secession crisis  ,0,1,0,123,1125,1173,0.029322471,0.47786155,0.49281597,Neu,-0.44853908,bbcbreaking
847,2017-10-26 12:10:04,"Police arrest 11 in UK after overnight raids, as part of Europe-wide investigation into suspected people smuggling  ",0,1,0,47,277,559,0.018252395,0.8788845,0.10286309,Neg,-0.8606321,bbcbreaking
848,2017-10-26 12:01:03,Southend Hospital says no plans to accommodate NHS patients in Airbnb style pilot 'at this time'  ,0,1,0,52,129,220,0.07494316,0.013625189,0.9114316,Neu,0.061317973,bbcbreaking
849,2017-10-26 09:28:00,"At least 23 people killed in an explosion at a fireworks factory near the Indonesian capital, Jakarta, reports say  ",1,1,0,87,534,473,0.0153701,0.90784496,0.0767849,Neg,-0.8924749,bbcbreaking
850,2017-10-25 15:40:01,"Fats Domino, one of most influential rock and roll performers of the 1950s and 60s, has died aged 89  ",1,1,0,215,1708,2301,0.034289055,0.23175,0.7339609,Neu,-0.19746095,bbcbreaking
851,2017-10-25 11:36:00,Labour Party suspends MP Jared O'Mara after he posted misogynistic and homophobic comments online  ,1,1,0,168,440,903,0.011658989,0.9354415,0.052899554,Neg,-0.9237825,bbcbreaking
852,2017-10-25 09:32:00,"UK economy grows 0.4% between July and September, latest figures show, adding to chances of a rate rise next week  ",0,1,0,68,202,353,0.94353306,0.031821154,0.024645815,Pos,0.91171193,bbcbreaking
854,2017-10-25 00:09:01,"Iraqi Kurds freeze results of recent disputed independence referendum, offering ceasefire and dialogue with Baghdad  ",1,1,0,58,312,409,0.29950726,0.38050446,0.31998828,Neg,-0.0809972,bbcbreaking
855,2017-10-24 20:24:05,"US Republican Jeff Flake announces he is quitting Senate, in strongly worded attack on Trump era  ",1,1,0,206,631,1728,0.019220246,0.8377462,0.14303358,Neg,-0.81852597,bbcbreaking
856,2017-10-24 15:05:01,"Top senator from Donald Trump's Republican party launches bitter attack on president, saying he has 'debased' the US  ",1,1,0,225,738,1933,0.022413997,0.8743449,0.10324112,Neg,-0.8519309,bbcbreaking
857,2017-10-24 09:52:02,Austria's new conservative leader Sebastian Kurz invites far-right Freedom Party to hold talks on coalition  ,0,1,0,111,263,338,0.1626061,0.04024896,0.79714495,Neu,0.122357145,bbcbreaking
860,2017-10-23 13:10:00,Widow of fallen US soldier says President Trump couldn't remember her husband's name in controversial phone call  ,1,1,1,338,969,1765,0.0319076,0.41135633,0.55673605,Neu,-0.37944874,bbcbreaking
861,2017-10-23 11:03:03,Scottish man sentenced to three months for touching man's hip in Dubai has case against him dismissed  ,1,1,0,175,425,1382,0.061108742,0.790154,0.14873731,Neg,-0.7290452,bbcbreaking
862,2017-10-22 19:01:02,"Police storm Nuneaton bowling alley, gunman held and no casualties reported, MFA Bowl boss says  ",1,1,0,106,555,965,0.021332655,0.880404,0.09826338,Neg,-0.8590713,bbcbreaking
863,2017-10-22 17:42:01,Gunman has taken two members of staff hostage at bowling alley in Nuneaton - complex chief executive   ,1,1,0,62,419,283,0.023286106,0.7728184,0.20389545,Neg,-0.7495323,bbcbreaking
864,2017-10-22 17:21:03,"Warwickshire Police say ongoing incident in Nuneaton is ""unconnected to any terrorist activity""",0,1,0,74,292,344,0.019708352,0.75031924,0.2299725,Neg,-0.7306109,bbcbreaking
865,2017-10-22 16:02:00,Warwickshire police urge people to avoid a retail park in Nuneaton due to 'ongoing incident'  ,0,1,0,104,938,698,0.011879654,0.9386648,0.049455605,Neg,-0.9267851,bbcbreaking
