,date,tweet,past_tense,present_tense,future_tense,replies_count,retweets_count,likes_count,pos_score,neg_score,neutral_score,sentiment,Sentiment_Score,user
1029,2017-08-27 19:45:01,Activist investors tend to ignore a winning investment strategy — women  ,0,1,0,0,0,2,0.040986687,0.2744691,0.68454427,Neu,-0.23348242,activiststocks
1030,2017-08-27 16:45:01,United Technologies: Activist At The Gate  ,0,0,0,0,0,0,0.079922676,0.03783997,0.8822373,Neu,0.042082705,activiststocks
1031,2017-08-27 15:30:02,CEO targets of activist investors are not created equal  ,1,1,0,0,0,0,0.021613799,0.058198888,0.9201873,Neu,-0.03658509,activiststocks
1032,2017-08-27 14:00:03,Why Pershing Square's ADP Thesis Should Be Taken Seriously  ,0,0,0,0,1,1,0.05186538,0.02344115,0.9246934,Neu,0.02842423,activiststocks
1033,2017-08-27 07:36:04,Things you don't see at the top  ,0,1,0,0,0,3,0.027938344,0.06289905,0.90916264,Neu,-0.03496071,activiststocks
1034,2017-08-26 22:00:03,Blue Apron: Activist At The Gates?  ,0,0,0,0,0,0,0.049030393,0.15570341,0.7952662,Neu,-0.10667302,activiststocks
1035,2017-08-26 20:05:01,Big in Venezuela: Bitcoin Mining  ,0,0,0,0,0,0,0.07558732,0.013725973,0.9106867,Neu,0.061861344,activiststocks
1036,2017-08-26 18:15:01,"""Buyout Funds Have Money to Burn, and That’s a Problem - Wall Street Journal""  ",1,1,0,0,1,2,0.047938276,0.1657862,0.78627557,Neu,-0.117847934,activiststocks
1037,2017-08-26 17:15:01,Wells Fargo: No End In Sight   $WFC $JPM $C $BAC,0,0,0,0,0,0,0.14276195,0.024554515,0.83268356,Neu,0.11820743,activiststocks
1038,2017-08-26 16:39:01,Blue Apron: Activist At The Gates?     $APRN $AMZN $WFM,0,0,0,0,0,1,0.05991488,0.033775225,0.9063099,Neu,0.026139654,activiststocks
1039,2017-08-26 16:19:02,"This right here, ""Eventually, illiquidity will be a competitive disadvantage in fundraising that only top VC firms will be able to justify""",0,1,1,1,1,0,0.05263769,0.4929974,0.4543649,Neg,-0.4403597,activiststocks
1041,2017-08-25 22:15:01,"""Billionaire Carl Icahn Has Lost More Money This Year Than Almost Anyone in the World - Time""  ",1,1,0,0,2,4,0.03153431,0.44859812,0.51986766,Neu,-0.4170638,activiststocks
1043,2017-08-25 20:55:00,Did the CEO Actually Get Fired? There’s a Decoder for That  ,0,1,0,0,0,2,0.02083917,0.5942635,0.38489732,Neg,-0.57342434,activiststocks
1044,2017-08-25 20:05:01,Blue Apron: Activist At The Gates?   $APRN $AMZN $WMT $SFM $KR,0,0,0,0,0,0,0.09930257,0.0243778,0.8763196,Neu,0.07492477,activiststocks
1045,2017-08-25 18:35:01,Panera CEO knocks Wall Street culture that celebrates activists  ,0,1,0,0,0,1,0.13552712,0.023412563,0.84106034,Neu,0.112114556,activiststocks
1046,2017-08-25 17:01:02,Is the Enthusiasm for Charter Communications Getting Overdone? – The Peridot Capitalist   $CHTR,0,1,0,0,0,0,0.07720095,0.22019172,0.70260733,Neu,-0.14299077,activiststocks
1047,2017-08-25 16:20:01,The Hot New Hedge Fund Flavor Is 'Quantamental'  ,0,0,0,0,1,0,0.13945593,0.01202614,0.84851795,Neu,0.12742978,activiststocks
1048,2017-08-25 16:00:04,Emerging-Markets Activist Investor Creates Own Niche in Hunt for Big Gains  ,0,0,0,0,0,2,0.10497297,0.016215324,0.87881166,Neu,0.08875765,activiststocks
1049,2017-08-25 15:40:01,"Activist Investors Leave Company Boards More White, More Male  ",0,1,0,0,1,1,0.03237546,0.7408901,0.22673446,Neg,-0.70851463,activiststocks
1050,2017-08-25 15:25:01,Activist investors tend to ignore a winning investment strategy — women  ,0,1,0,0,0,1,0.040986687,0.2744691,0.68454427,Neu,-0.23348242,activiststocks
1051,2017-08-25 15:17:04,"Amazon says Whole Foods deal will close Monday, with discounts to begin then  ",0,1,1,0,0,0,0.04763159,0.029787084,0.9225814,Neu,0.017844507,activiststocks
1052,2017-08-25 14:05:02,The Most Dangerous Trap For Stock Pickers (And 9 Ways Top Investors Avoid It) -    ,0,0,0,0,0,0,0.036918085,0.20752734,0.75555456,Neu,-0.17060925,activiststocks
1054,2017-08-25 00:12:00,"""Most Americans live paycheck to paycheck - CNBC""  ",0,1,0,0,0,0,0.038500406,0.026082585,0.935417,Neu,0.012417821,activiststocks
1056,2017-08-24 20:55:01,Vanguard Group is America's new landlord  ,0,1,0,0,0,1,0.07553164,0.01006425,0.9144041,Neu,0.06546739,activiststocks
1057,2017-08-24 20:25:04,"""The Most Dangerous Trap For Stock Pickers (And 9 Ways Top Investors Avoid It) -    ",0,0,0,0,0,2,0.060670488,0.07378574,0.8655438,Neu,-0.01311525,activiststocks
1058,2017-08-24 20:25:00,"""S&P 500 Earnings: The Shining -    ",0,0,0,0,0,0,0.08369887,0.08049796,0.8358032,Neu,0.003200911,activiststocks
1059,2017-08-24 20:15:03,A Vision of the Amazon/Whole Foods Future (AMZN)  ,0,0,0,0,0,0,0.12895471,0.0088695455,0.86217576,Neu,0.120085165,activiststocks
1060,2017-08-24 19:55:02,The Next Crypto Giant   $BTC.X $NEO.X Bitcoin Cryptocurrency,0,0,0,0,0,0,0.03428629,0.019075979,0.9466378,Neu,0.015210312,activiststocks
1061,2017-08-24 19:30:05,"Finding Hope In Retail   $TGT $XRT $FL $DKS $M $KSS $BBY   I mean...you know, all we do is win",0,1,0,0,0,0,0.057643257,0.030634148,0.91172254,Neu,0.027009109,activiststocks
1062,2017-08-24 19:12:01,"""The Market Is Behaving Much Like It Did in the Past - Bloomberg""  ",0,1,0,0,0,0,0.08932255,0.77666825,0.13400917,Neg,-0.6873457,activiststocks
1063,2017-08-24 19:10:01,Perrigo: Finally A Turning Point?   $PRGO $TEVA,0,1,0,0,0,0,0.17092927,0.019406546,0.80966425,Neu,0.15152273,activiststocks
1064,2017-08-24 18:50:01,The New Off-Court Play for NBA Stars Is Startup Equity  ,0,1,0,0,0,0,0.07004292,0.015140246,0.91481686,Neu,0.054902676,activiststocks
1065,2017-08-24 17:10:02,Exclusive: Inside Uber's financials  ,0,0,0,0,1,1,0.032898206,0.03262775,0.93447405,Neu,0.00027045608,activiststocks
1066,2017-08-24 15:50:01,Hedge Fund Interventions Cause Companies To Supress Negative News  ,0,0,0,0,0,0,0.051522847,0.30563956,0.6428375,Neu,-0.2541167,activiststocks
1068,2017-08-23 20:05:01,Ackman Should Learn From Rejection  ,0,0,1,0,0,0,0.12833127,0.01589627,0.8557724,Neu,0.112435006,activiststocks
1069,2017-08-23 16:50:01,What the CEO of Panera hates about Wall Street   $PNRA,0,1,0,0,3,2,0.022118289,0.07869003,0.89919174,Neu,-0.05657174,activiststocks
1070,2017-08-23 14:09:01,Herbalife Short Squeeze - Ackman And Others Shorts About To Feel Pain?  ,0,1,0,0,0,0,0.04440378,0.15300126,0.8025949,Neu,-0.10859749,activiststocks
1071,2017-08-23 03:26:04,"""Apple Scales Back Its Ambitions for a Self-Driving Car - New York Times""  ",0,0,0,0,0,0,0.18368271,0.022437625,0.7938796,Neu,0.16124508,activiststocks
1072,2017-08-23 03:25:04,"""Mutual Funds Mark Down Uber Investments by Up to 15% - Wall Street Journal""  ",0,0,0,0,0,3,0.12039939,0.4288048,0.4507959,Neu,-0.30840543,activiststocks
1073,2017-08-23 01:12:02,"""Millennial Americans Are Moving to the ’Burbs, Buying Big SUVs - Bloomberg""  ",0,1,0,0,0,0,0.18097413,0.014469771,0.80455613,Neu,0.16650435,activiststocks
1074,2017-08-22 20:55:00,CSX: High Priced CEO Comes Up Short - csx | Seeking Alpha   $CSX,0,1,0,0,0,0,0.13336314,0.1781403,0.68849653,Neu,-0.044777155,activiststocks
1075,2017-08-22 19:50:01,Yaaaaassss ... Early Uber investor says the troubled company should merge with Tesla   $TSLA,0,1,1,0,0,0,0.045079537,0.052811228,0.9021092,Neu,-0.007731691,activiststocks
1076,2017-08-22 18:35:00,ADP CEO describes phone call with activist investor Bill Ackman  ,0,1,0,0,0,1,0.0341243,0.0688469,0.8970288,Neu,-0.034722596,activiststocks
1077,2017-08-22 17:05:02,Unilever's Anti-Kraft Work   $UL $KHC,0,0,0,0,0,0,0.18992211,0.014674567,0.7954033,Neu,0.17524755,activiststocks
1078,2017-08-22 16:30:02,I’m an equity researcher. Someone asked me to work for free - efinancialcareers  ,1,1,0,0,0,1,0.06107892,0.021579003,0.91734207,Neu,0.039499916,activiststocks
1079,2017-08-22 15:40:01,Perrigo: Finally A Turning Point? - prgo | Seeking Alpha  ,0,1,0,0,1,0,0.24036925,0.016302552,0.7433283,Neu,0.22406669,activiststocks
1080,2017-08-22 15:37:05,"""Ignoring Fees Doesn’t Beat the Market - CFA Institute""  ",0,1,0,0,0,0,0.23420183,0.23786813,0.52793,Neu,-0.0036662966,activiststocks
1081,2017-08-22 15:37:01,"""The Institutional Risk Analyst -    ",0,0,0,0,0,0,0.068977006,0.020221196,0.91080177,Neu,0.04875581,activiststocks
1082,2017-08-22 15:37:00,"""Could Puerto Rico Be the Next Hot Tax Haven? - Bloomberg""  ",0,0,1,0,0,0,0.3550295,0.017069874,0.6279006,Neu,0.33795962,activiststocks
1083,2017-08-22 15:34:03,"""Identity Thieves Hijack Cellphone Accounts to Go After Virtual Currency - New York Times""  ",0,1,0,0,0,0,0.026189731,0.21011986,0.7636905,Neu,-0.18393013,activiststocks
1084,2017-08-22 14:15:02,"Herbalife held talks to go private, and its stock is jumping   $HLF",1,1,0,0,0,1,0.1946165,0.038628697,0.7667548,Neu,0.1559878,activiststocks
1085,2017-08-21 21:45:01,Macy's: Worst Yet To Come   $M $DDS $SHLD,0,0,0,0,0,0,0.022965621,0.7943365,0.1826979,Neg,-0.7713709,activiststocks
1086,2017-08-21 20:55:01,Teva: On The Activist Radar   $TEVA $AGN $PRGO,0,0,0,0,0,1,0.090619355,0.014963175,0.89441746,Neu,0.07565618,activiststocks
1087,2017-08-21 20:05:01,Costco: In Need Of An Activist Investor?   $COST $AMZN $WMT,0,0,0,0,1,3,0.05425889,0.024263622,0.9214775,Neu,0.029995268,activiststocks
1088,2017-08-21 19:07:03,"Kraft Heinz (NASDAQ: KHC) Unlikely To Buy Danone, Analyst Says  ",0,0,0,0,0,0,0.06126945,0.024062453,0.91466814,Neu,0.037207,activiststocks
1089,2017-08-21 18:30:03,Procter & Gamble: Things Heat Up   $PG,0,0,0,0,0,0,0.071428515,0.038648207,0.8899233,Neu,0.03278031,activiststocks
1090,2017-08-21 17:00:04,Bitcoin: No Longer A Moonshot    cryptocurrency $BTC.X,0,0,0,0,1,0,0.025169732,0.044543598,0.9302867,Neu,-0.019373866,activiststocks
1091,2017-08-21 16:01:01,CSX: High Priced CEO Comes Up Short $csx  ,0,0,0,0,0,0,0.14667381,0.604242,0.24908416,Neg,-0.45756823,activiststocks
1092,2017-08-21 15:35:01,Danone: The Activist Dance   $danoy $khc $pep,0,0,0,0,0,0,0.116198234,0.018007912,0.8657938,Neu,0.09819032,activiststocks
1093,2017-08-21 15:15:02,Gilead: Road To $100   $GILD $AGN $BAX,0,0,0,0,0,0,0.14735813,0.014169065,0.8384728,Neu,0.13318907,activiststocks
1094,2017-08-21 14:35:01,Bitcoin: This Is Not 2013    crypotcurrency $BTC.X,0,1,0,0,0,1,0.020018453,0.08537151,0.89461005,Neu,-0.06535306,activiststocks
1095,2017-08-21 14:15:02,Citi: Capital Returns Story   $C $JPM $BAC $WFC,0,0,0,0,0,0,0.14965907,0.02582901,0.8245119,Neu,0.12383006,activiststocks
1096,2017-08-20 21:50:00,Investors Pull Back From Gundlach’s Biggest Fund at DoubleLine  ,0,1,0,0,2,1,0.015432445,0.94620067,0.03836691,Neg,-0.93076825,activiststocks
1098,2017-08-20 18:46:02,Elliott lawyer says third bidder may top Buffett's Oncor bid  ,0,1,1,0,0,2,0.4582418,0.014058993,0.52769923,Neu,0.44418278,activiststocks
1099,2017-08-20 01:45:01,Presidential? perhaps. therock's video  ,0,0,0,0,0,0,0.044196803,0.02629765,0.9295055,Neu,0.017899154,activiststocks
1100,2017-08-19 21:45:00, ,0,0,0,0,0,3,0.35916328,0.21665184,0.4241849,Neu,0.14251144,activiststocks
1101,2017-08-19 21:10:01, ,0,0,0,0,0,2,0.35916328,0.21665184,0.4241849,Neu,0.14251144,activiststocks
1102,2017-08-19 20:05:01,Gilead: Road To $100   $GILD $ABBV $AGN $BAX $VRTX $INCY,0,0,0,0,0,0,0.2314946,0.011083432,0.757422,Neu,0.22041118,activiststocks
1103,2017-08-19 16:55:01,"Please, God, Save Gary Cohn from Himself  ",0,0,0,0,1,0,0.05342382,0.18018728,0.7663889,Neu,-0.12676346,activiststocks
1104,2017-08-19 16:15:01,Scoop: NBC's daily Snapchat show posts monster numbers  ,0,1,0,0,1,0,0.071206294,0.06331575,0.865478,Neu,0.007890545,activiststocks
1107,2017-08-19 04:30:01,"""Billionaire Carl Icahn is reportedly in ’legal jeopardy’ for trying to influence Trump policy - Business Insider""  ",0,1,0,0,4,1,0.0367461,0.80568814,0.15756585,Neg,-0.76894206,activiststocks
1108,2017-08-18 21:50:01,Ackman's Neverending ADP Presentation  ,0,0,0,0,0,0,0.05697228,0.023972115,0.9190556,Neu,0.033000164,activiststocks
1109,2017-08-18 21:25:00,BILLIONAIRE BARRAGE: Lee Cooperman is stepping up his attack against Bill Ackman  ,0,1,0,0,0,0,0.23710325,0.0608752,0.70202154,Neu,0.17622805,activiststocks
1110,2017-08-18 20:55:00,Charter M&A Chatter Doesn’t Make Sense  ,0,1,0,0,0,0,0.024058793,0.4314523,0.5444889,Neu,-0.40739352,activiststocks
1111,2017-08-18 20:35:01,Paul Singer may trump Warren Buffett in energy company gambit  ,0,0,1,0,0,1,0.034361474,0.037473384,0.92816514,Neu,-0.00311191,activiststocks
1112,2017-08-18 19:55:01,Hedge Funds Pick Winners and Losers in Quarterly Beauty Contest  ,0,0,0,0,0,0,0.038594395,0.038652916,0.9227527,Neu,-5.8520585e-05,activiststocks
1113,2017-08-18 18:25:01,This Activist Investor Just Tried to Stick It to Billionaire Warren Buffett  ,0,0,0,0,0,2,0.04069628,0.04610115,0.91320264,Neu,-0.005404871,activiststocks
1114,2017-08-18 18:18:05,"""Where was KPMG, Wells Fargo’s auditor, while the funny business was going on? - MarketWatch""  ",1,1,0,0,0,0,0.027396277,0.068197034,0.90440667,Neu,-0.040800758,activiststocks
1115,2017-08-18 17:05:02,Icahn and Starboard's Auto-Parts Retailer Bets Are Taking a Hit Thanks to Amazon  ,0,1,0,0,1,1,0.78492546,0.022954999,0.19211957,Pos,0.76197046,activiststocks
1116,2017-08-18 16:25:03,"""Short-seller Robert Chapman battles Bill Ackman again; bets against ADP - CNBC""  ",0,1,0,0,1,1,0.08287596,0.020750903,0.89637315,Neu,0.062125057,activiststocks
1117,2017-08-18 16:25:00,"""The walls are closing in on tech giants - Axios""  ",0,1,0,0,0,2,0.08048279,0.3135305,0.6059868,Neu,-0.23304772,activiststocks
1118,2017-08-18 15:15:02,BILL ACKMAN: ADP's stock could double in five years  ,0,0,1,0,1,2,0.7227379,0.01675624,0.26050577,Pos,0.7059817,activiststocks
1119,2017-08-18 14:01:04,"Bill Ackman is getting worried about geopolitical risk, buys protection against market drop  ",1,1,0,0,0,2,0.06847408,0.12872118,0.80280477,Neu,-0.0602471,activiststocks
1120,2017-08-18 00:32:05,"""Mylan, U.S. finalize $465 million EpiPen settlement - Reuters""  ",0,1,0,0,1,1,0.08570342,0.014763093,0.8995335,Neu,0.07094032,activiststocks
1121,2017-08-18 00:32:00,This 19-Year-Old Is Trump’s Latest Market Whisperer - Bloomberg  ,0,1,0,0,0,0,0.047411863,0.0320158,0.92057234,Neu,0.015396062,activiststocks
1122,2017-08-17 23:57:00,"""A 2:15 Alarm, 2 Trains and a Bus Get Her to Work by 7 A.M. - New York Times""  ",0,0,0,0,0,1,0.04864889,0.03848811,0.91286296,Neu,0.010160781,activiststocks
1123,2017-08-17 21:50:01,Netflix Looks Like a Loser and Feels Like a Winner  ,0,0,0,0,0,0,0.06870191,0.19811985,0.73317826,Neu,-0.12941794,activiststocks
1124,2017-08-17 20:50:01,Are Index Funds Too Soft on CEOs?  ,0,0,0,0,0,0,0.023307405,0.62977064,0.34692198,Neg,-0.60646325,activiststocks
1125,2017-08-17 19:55:01,Investing in Yourself (Even When It Seems Irrational)  ,0,1,0,0,0,1,0.092789166,0.019455839,0.887755,Neu,0.07333332,activiststocks
1126,2017-08-17 18:25:04,Warren Buffett Hates Hedge Fund Activism More Than He Loves GE  ,0,1,0,0,0,1,0.030875234,0.39591584,0.5732089,Neu,-0.3650406,activiststocks
1127,2017-08-17 16:50:01,Honeywell: Is Third Point's Stake Cut A Sign?  ,0,1,0,0,0,0,0.13103935,0.51514566,0.353815,Neg,-0.3841063,activiststocks
1128,2017-08-17 15:35:01,How Coinbase Can Be a Real Unicorn  ,0,0,1,0,0,0,0.051295336,0.025027664,0.92367697,Neu,0.026267672,activiststocks
1129,2017-08-17 15:29:00,"""Elliott Moves to Block Berkshire’s Oncor Bid; Buffett Stands Pat - Wall Street Journal""  ",1,1,0,0,0,0,0.056552783,0.109965526,0.83348167,Neu,-0.053412743,activiststocks
1130,2017-08-17 15:28:03,"""Amazon can borrow money more cheaply than Russia, Mexico and China - Business Insider""  ",0,0,1,0,0,0,0.4622303,0.010678418,0.5270913,Neu,0.45155188,activiststocks
1131,2017-08-17 15:27:05,"""ADP-Pershing-Square-8.17.2017.pdf -    ",0,0,0,0,0,3,0.024589341,0.026597537,0.94881314,Neu,-0.002008196,activiststocks
1132,2017-08-17 15:27:02,"""The Growing List of Money Managers Cutting Their Exposure to Junk Bonds - Bloomberg""  ",0,1,0,0,0,0,0.06778541,0.22976013,0.7024544,Neu,-0.16197471,activiststocks
1133,2017-08-17 14:10:02,DIMON: I 'strongly disagree' with Trump's Charlottesville reaction and supported disbanding his business council  ,1,1,0,0,0,2,0.02573014,0.8182523,0.15601757,Neg,-0.7925222,activiststocks
1134,2017-08-16 21:00:04,Top-performing hedge funds are buying these stocks  ,0,1,0,0,0,0,0.16314091,0.013070604,0.82378846,Neu,0.15007031,activiststocks
1135,2017-08-16 20:05:01,This Activist Investor Just Put More Heat on BHP to Unlock $46 Billion  ,0,0,0,0,2,3,0.16329928,0.026281422,0.8104193,Neu,0.13701786,activiststocks
1136,2017-08-16 18:30:02,Procter & Gamble: Things Heat Up   $PG,0,0,0,0,0,0,0.071428515,0.038648207,0.8899233,Neu,0.03278031,activiststocks
1137,2017-08-16 16:55:02,A Tale of Two Retailers   $WMT v. $AMZN,0,0,0,0,0,1,0.05246632,0.025051242,0.92248243,Neu,0.02741508,activiststocks
1138,2017-08-16 16:30:04,Amazon Peddles Bonds With an Equity Story  ,0,0,0,0,0,0,0.061210647,0.011297779,0.92749155,Neu,0.04991287,activiststocks
1139,2017-08-16 15:40:01,7 Takeaways from Vanity Fair’s 1990 Profile of Donald Trump  ,0,0,0,0,0,0,0.044439446,0.030946879,0.92461365,Neu,0.013492567,activiststocks
1141,2017-08-16 01:00:05,"""‘Deep’ Subprime Car Loans Hit Crisis-Era Milestone - Bloomberg""  ",0,0,0,0,2,1,0.2600172,0.21287826,0.5271045,Neu,0.04713893,activiststocks
1142,2017-08-16 00:59:04,"""Uber’s head of its developer platform, Chris Saad, is leaving the company - Recode""  ",0,1,0,0,0,0,0.019915164,0.32493034,0.65515447,Neu,-0.30501518,activiststocks
1143,2017-08-15 21:50:00,Teva: On The Activist Radar   $TEVA $AGN $NVO,0,0,0,0,0,0,0.076596566,0.018545162,0.9048583,Neu,0.058051404,activiststocks
1144,2017-08-15 20:40:03,JOHN McAFEE: Here's why you can't call bitcoin a 'bubble'  ,0,1,1,0,0,0,0.049308132,0.105988376,0.84470344,Neu,-0.056680243,activiststocks
1145,2017-08-15 20:39:01,"""Are Index Funds Too Soft on CEOs? - Morningstar""  ",0,1,0,0,0,0,0.037683785,0.19521669,0.76709956,Neu,-0.1575329,activiststocks
1146,2017-08-15 20:35:03,"""Uber agrees to 20 years of privacy audits after FTC says it ’failed consumers’ - CNBC""  ",1,1,0,0,0,1,0.089861654,0.4623787,0.4477596,Neg,-0.37251705,activiststocks
1147,2017-08-15 20:15:01,"Bitcoin Surges Past $4,000 on Speed Breakthrough  ",0,0,0,1,0,0,0.8616829,0.03322153,0.10509562,Pos,0.82846135,activiststocks
1148,2017-08-15 18:30:02,The Amazon effect echoes across the industry - Digiday  ,0,1,0,0,0,0,0.104272015,0.04108867,0.85463935,Neu,0.063183345,activiststocks
1149,2017-08-15 17:15:02,Activist hedge funds target bigger and bigger US companies in year of the 'super campaign'  ,0,0,0,0,1,1,0.113474116,0.016748834,0.869777,Neu,0.096725285,activiststocks
1151,2017-08-15 14:09:04,"""The Uber Dilemma - stratechery""  ",0,0,0,0,0,0,0.067355774,0.020458493,0.9121857,Neu,0.04689728,activiststocks
1152,2017-08-15 14:08:04,"""Under Armour and Intel C.E.O.s Follow Merck Chief, Quitting Panel in Rebuke to Trump - New York Times""  ",0,0,0,0,0,2,0.035029523,0.27274483,0.6922257,Neu,-0.2377153,activiststocks
1153,2017-08-15 14:07:02,Summers: Why don’t all CEOs quit Trump’s advisory councils? - Financial Times  ,1,1,0,0,0,1,0.02114815,0.47889096,0.4999609,Neu,-0.4577428,activiststocks
1155,2017-08-15 14:00:05,What Makes a Firm a Target for Activists?  ,0,1,0,0,0,1,0.033257186,0.08675374,0.879989,Neu,-0.053496554,activiststocks
1156,2017-08-15 02:00:02,"""Benchmark is blocking attempts to sell Uber shares to other investors, say sources - CNBC""  ",0,1,0,0,1,1,0.02611889,0.23101537,0.74286574,Neu,-0.20489648,activiststocks
1157,2017-08-15 02:00:00,"""U.S. Stock Buybacks Are Plunging - Bloomberg""  ",0,0,0,0,0,1,0.016235916,0.95577973,0.027984329,Neg,-0.93954384,activiststocks
1158,2017-08-14 21:55:00,Costco: In Need Of An Activist Investor?   $COST $AMZN $WMT,0,0,0,0,0,0,0.05425889,0.024263622,0.9214775,Neu,0.029995268,activiststocks
1159,2017-08-14 20:55:00,Latest Hot Digital Coin Offering: $187 Million in One Hour for Filecoin  ,0,0,0,0,0,0,0.1603162,0.009196227,0.83048755,Neu,0.15111998,activiststocks
1160,2017-08-14 19:55:01,How Energy Hedge Funds Are Making Money as Oil Prices Stagnate  ,0,1,0,0,0,0,0.035636112,0.046279307,0.9180846,Neu,-0.010643195,activiststocks
1161,2017-08-14 18:20:01,Stay Away From The Real Estate Play In Retail (NYSE: XRT)  ,0,0,0,0,0,0,0.03247816,0.0418973,0.9256245,Neu,-0.0094191395,activiststocks
1162,2017-08-14 17:10:01,Macy's: Worst Yet To Come   $M $DDS $KSS $SHLD $ULTA,0,0,0,0,0,0,0.03363651,0.52832085,0.4380426,Neg,-0.49468434,activiststocks
1163,2017-08-14 16:35:01,Bitcoin: This Is Not 2013   bitcoin cryptocurrency $BTC.X,0,1,0,0,0,0,0.019604068,0.064297214,0.9160987,Neu,-0.044693146,activiststocks
1164,2017-08-14 16:31:01,Blue Apron to Amazon!  ,0,0,0,0,1,3,0.089389525,0.023082456,0.88752806,Neu,0.06630707,activiststocks
1165,2017-08-14 16:15:02,How the Commodities Bounce Could Finish Noble  ,0,0,0,0,0,0,0.042626966,0.06546013,0.8919128,Neu,-0.022833165,activiststocks
1166,2017-08-14 16:10:01,Lessons From A Trading Great: Stanley Druckenmiller  ,0,0,0,0,1,0,0.05431131,0.035224635,0.91046405,Neu,0.019086674,activiststocks
1167,2017-08-14 16:05:01,Wells Fargo: The Honey Badger?   $WFC,0,0,0,0,0,0,0.042373586,0.034979645,0.9226467,Neu,0.0073939413,activiststocks
1169,2017-08-14 15:24:02,"So far so good, I have not yet seen any Bitcoin ads on tv during questionable financial advice programs aired on Sunday morning",1,1,0,0,1,1,0.06498736,0.02191398,0.91309863,Neu,0.043073382,activiststocks
1170,2017-08-14 14:33:03,"""An epic winning streak on Wall Street — then one ugly loss - Washington Post""  ",0,1,0,0,0,0,0.08949837,0.14266922,0.76783246,Neu,-0.053170845,activiststocks
1171,2017-08-14 14:32:05,"""Hacker Leaks ‘Curb Your Enthusiasm’ Episodes, Other HBO Series - Variety""  ",0,0,0,0,0,0,0.02926565,0.04195123,0.9287832,Neu,-0.012685582,activiststocks
1172,2017-08-13 21:50:00,Bitcoin Gets Its Shot On The Big Stage   bitcoin cryptocurrency cryptocurrencies,0,1,0,0,0,0,0.5966491,0.012121292,0.39122957,Pos,0.5845278,activiststocks
1173,2017-08-13 21:05:00,Dan Loeb's Third Point hedge fund dumps Snap shares after just one quarter  ,0,1,0,0,1,3,0.009489845,0.89704126,0.093468785,Neg,-0.8875514,activiststocks
1174,2017-08-13 19:50:00,The Trouble With Netflix  ,0,0,0,0,3,6,0.036313217,0.16693494,0.79675186,Neu,-0.13062172,activiststocks
1175,2017-08-13 18:40:00,Three Uber Investors Ask Benchmark to Forfeit Board Seat  ,0,0,0,0,0,0,0.02082789,0.15320103,0.8259711,Neu,-0.13237314,activiststocks
1176,2017-08-13 17:10:01,Bitcoin Gets Its Shot On The Big Stage    bitcoin cryptocurrency,0,1,0,0,0,1,0.7327277,0.011656406,0.25561592,Pos,0.7210713,activiststocks
1177,2017-08-13 16:01:00,Read the Letter Uber Shareholders Sent Benchmark Asking the Firm to Step Down from the Company's Board  ,0,1,0,0,1,2,0.023481354,0.45972997,0.51678866,Neu,-0.4362486,activiststocks
1179,2017-08-13 14:15:01,The Secret to Startup Success? Fudge Your Age  ,0,0,0,0,0,0,0.06638461,0.031559497,0.90205586,Neu,0.034825116,activiststocks
1180,2017-08-13 04:34:00,+1; can confirm  ,0,0,1,0,0,1,0.14740263,0.010537479,0.84205985,Neu,0.13686515,activiststocks
1181,2017-08-13 04:22:05,"""Latest Hot Digital Coin Offering: $187 Million in One Hour for Filecoin - Wall Street Journal""  ",0,0,0,0,0,4,0.20456345,0.0099687325,0.78546786,Neu,0.19459473,activiststocks
1182,2017-08-13 04:22:00,What a presidential president would have said about Charlottesville - Washington Post  ,1,0,1,0,0,2,0.029647026,0.045482945,0.92487,Neu,-0.015835918,activiststocks
1183,2017-08-13 04:14:04,"""Bitcoin soars to over $4,000 on escalating worries in Charlottesville.""",0,1,0,0,0,2,0.87372416,0.09840087,0.027874993,Pos,0.7753233,activiststocks
1186,2017-08-13 04:08:05,"Bitcoin for $4,000, Alex. bitcoin",0,0,0,0,0,2,0.025130462,0.021755336,0.9531142,Neu,0.003375126,activiststocks
1187,2017-08-13 03:52:03,Haters gonna...wait a minute...what the...  ,0,1,0,1,7,9,0.020864649,0.64916193,0.32997346,Neg,-0.62829727,activiststocks
1188,2017-08-13 03:51:01,"In other news, move West; or at least Midwest.  ",0,1,0,0,0,0,0.059463836,0.017114209,0.923422,Neu,0.04234963,activiststocks
1189,2017-08-13 03:49:01,"Bitcoin is fun, bitcoin is amazing, it's a cool technology, and it's potential is unquantifiable but it makes no promises on future gains",0,1,0,0,0,1,0.2961368,0.010837734,0.6930255,Neu,0.28529906,activiststocks
1190,2017-08-13 00:19:05,About sums it up  ,0,0,0,0,0,0,0.0872107,0.024791626,0.8879976,Neu,0.06241907,activiststocks
1191,2017-08-12 21:55:00,What Makes a Firm a Target for Activists?  ,0,1,0,0,0,1,0.033257186,0.08675374,0.879989,Neu,-0.053496554,activiststocks
1192,2017-08-12 20:55:00,Dan Loeb apologizes for racially charged Facebook post  ,1,1,0,0,0,1,0.038222205,0.6470208,0.314757,Neg,-0.6087986,activiststocks
1193,2017-08-12 20:18:00, I'm not sure what we expected. It is mr. pink after all.,1,1,0,0,0,0,0.039812054,0.06883508,0.89135283,Neu,-0.029023025,activiststocks
1194,2017-08-12 20:01:00,"Daniel Loeb, a Cuomo Donor, Makes Racial Remark About Black Leader  ",0,0,0,0,0,0,0.03396062,0.5573208,0.40871862,Neg,-0.52336013,activiststocks
1195,2017-08-12 18:45:01,Lessons From A Trading Great: Stanley Druckenmiller  ,0,0,0,0,2,10,0.05431131,0.035224635,0.91046405,Neu,0.019086674,activiststocks
1196,2017-08-12 17:30:02,Benchmark's Uber Suit Signals End of Era for Imperious Founders  ,0,0,0,0,1,0,0.037812054,0.86063796,0.10154995,Neg,-0.8228259,activiststocks
1197,2017-08-12 17:23:02,If McAfee doesn't have to eat his own dick we're all going to be very rich ... so far so good  ,0,1,0,1,0,5,0.7732095,0.013626948,0.21316352,Pos,0.7595826,activiststocks
1198,2017-08-12 16:55:01,No-Name U.S. Oil Driller Gets Shot at World's Top Reserves  ,0,0,0,0,0,0,0.10635602,0.4122678,0.48137608,Neu,-0.30591178,activiststocks
1199,2017-08-12 16:20:01,Some of the world’s largest hedge funds are getting crushed - Business Insider  ,1,1,0,0,2,1,0.059062105,0.39837742,0.54256046,Neu,-0.33931533,activiststocks
