,date,tweet,past_tense,present_tense,future_tense,replies_count,retweets_count,likes_count,pos_score,neg_score,neutral_score,sentiment,Sentiment_Score,user
2873,2017-04-06 21:05:01,"Valeant Tumbles Below $10 on Struggle to Sell Assets, Raise Cash - Bloomberg  ",0,0,0,0,1,1,0.017514035,0.9583085,0.024177527,Neg,-0.94079447,activiststocks
2874,2017-04-06 19:50:01,Ex-York Capital Partner Weinberger to Launch Hedge Fund This Summer | Institutional Investor  ,0,0,0,0,0,1,0.058483914,0.018829431,0.9226867,Neu,0.039654482,activiststocks
2875,2017-04-06 19:20:00,General Motors: Best Laid Plans $GM $F  ,0,1,0,0,0,0,0.148877,0.012211975,0.83891106,Neu,0.13666502,activiststocks
2877,2017-04-06 16:45:01,"Why Bill Ackman Really Left Valeant - Valeant Pharmaceuticals International, Inc. (NYSE:VRX) | Seeking Alpha  ",0,1,0,0,0,1,0.036571212,0.059441607,0.9039872,Neu,-0.022870395,activiststocks
2878,2017-04-06 15:30:03,Activist Investors Find More Fertile Ground in Europe - WSJ  ,0,0,0,0,1,0,0.44688815,0.014984724,0.5381271,Neu,0.43190342,activiststocks
2879,2017-04-06 14:10:01,The Market Just Doesn’t Believe in the Rite Aid Merger with Walgreens - 24/7 Wall St.  ,0,0,0,0,0,0,0.037710205,0.12778354,0.8345063,Neu,-0.09007333,activiststocks
2880,2017-04-06 03:45:01,"""Valeant Tumbles Below $10 on Struggle to Sell Assets, Raise Cash - Bloomberg""  ",0,0,0,0,1,1,0.02082563,0.9580511,0.02112333,Neg,-0.93722546,activiststocks
2881,2017-04-06 03:44:03,"""‘Wells Fargo Loves To F*ck Their Clients’: Small Business And The Little Red Stagecoach - Dealbreaker""  ",0,1,0,0,1,1,0.12203403,0.033213787,0.8447522,Neu,0.08882024,activiststocks
2882,2017-04-06 03:44:03,"""General Electric Wants Out of the Light- Bulb Business - Wall Street Journal""  ",0,1,0,0,0,0,0.03314377,0.0914065,0.8754497,Neu,-0.058262732,activiststocks
2883,2017-04-05 22:00:01,Why Uber Won’t Fire Its CEO – Backchannel  ,0,0,0,0,1,0,0.034067202,0.5414927,0.42444006,Neg,-0.5074255,activiststocks
2884,2017-04-05 21:35:00,The State of Wealth Management in 2017  ,0,0,0,0,0,1,0.10638348,0.054244123,0.8393724,Neu,0.052139357,activiststocks
2885,2017-04-05 21:15:01,General Electric: Just Give Us Another Chance $GE  ,0,0,0,0,0,0,0.2693795,0.011480288,0.71914023,Neu,0.2578992,activiststocks
2886,2017-04-05 21:10:01,JAB to acquire Panera Bread for $315 a share  ,0,0,0,0,1,1,0.05520385,0.013021585,0.93177456,Neu,0.042182267,activiststocks
2887,2017-04-05 19:55:01,Activist hedge fund battles 144-year-old firm to ditch low-return ventures | The Japan Times  ,0,1,0,0,0,1,0.24023354,0.21258499,0.5471814,Neu,0.027648553,activiststocks
2888,2017-04-05 18:35:01,AIG: New CEO Woes Already $AIG  ,0,0,0,1,1,0,0.019449005,0.85306495,0.12748599,Neg,-0.83361596,activiststocks
2889,2017-04-05 18:17:03,"""Luck and my practice of venture capital""  ",0,0,0,0,0,3,0.13398752,0.015980752,0.85003173,Neu,0.118006766,activiststocks
2890,2017-04-05 17:05:01,Another big payday for Biglari - San Antonio Express-News  ,0,0,0,0,0,0,0.38767815,0.015304628,0.5970172,Neu,0.37237352,activiststocks
2891,2017-04-05 15:35:00,Twitter: Finally Out Of The Spotlight? $TWTR $FB $SNAP  ,0,0,0,0,0,0,0.08719589,0.15601674,0.75678736,Neu,-0.06882085,activiststocks
2892,2017-04-05 14:00:05,Liberty Interactive to drop 'tracking stock' structure in complex deal | Reuters  ,0,1,0,0,0,0,0.02227239,0.58782345,0.38990417,Neg,-0.56555104,activiststocks
2893,2017-04-04 21:55:00,How Wall Street and tech bros are staying forever young | New York Post  ,0,1,0,0,0,0,0.057324402,0.030591372,0.9120842,Neu,0.02673303,activiststocks
2894,2017-04-04 19:55:00,Wells Fargo Whistle-Blower Wins $5.4 Million and His Job Back - The New York Times  ,0,0,0,0,0,2,0.2237858,0.02715878,0.7490553,Neu,0.19662702,activiststocks
2895,2017-04-04 18:40:00,FleetCor - Or is it FeeCor or FleeceCor? - Citron Research  ,0,1,0,0,0,1,0.025605932,0.02467441,0.94971967,Neu,0.0009315219,activiststocks
2896,2017-04-04 16:55:01,The Myth of Shrinking Asset Managers - Bloomberg Gadfly  ,0,0,0,0,0,0,0.051459912,0.09110503,0.85743505,Neu,-0.039645117,activiststocks
2897,2017-04-04 14:10:01,Twitter: Finally Out Of The Spotlight? $TWTR $FB $SNAP  ,0,0,0,0,0,0,0.08719589,0.15601674,0.75678736,Neu,-0.06882085,activiststocks
2898,2017-04-04 00:32:05,Reigning true  ,0,1,0,0,0,1,0.06108012,0.054293554,0.8846263,Neu,0.006786566,activiststocks
2899,2017-04-03 21:45:00,Oil Companies’ Modest Prize: Breaking Even - WSJ  ,0,1,0,0,0,0,0.6376576,0.03085118,0.33149123,Pos,0.6068064,activiststocks
2900,2017-04-03 21:20:00,Confessions of a fintech VC: No one is using fintech outside Venmo  ,0,1,0,0,4,11,0.047524866,0.0148980385,0.93757707,Neu,0.032626826,activiststocks
2901,2017-04-03 21:00:02,Airlines Make More Money Selling Miles Than Seats - Bloomberg  ,0,1,0,0,0,0,0.04421859,0.07265485,0.88312656,Neu,-0.028436262,activiststocks
2902,2017-04-03 20:40:00,Jefferies - Back to being a love machine  ,0,1,0,0,0,0,0.13115819,0.035897356,0.83294445,Neu,0.09526083,activiststocks
2903,2017-04-03 19:50:00,The Economist explains: Why investors are so keen on Amazon | The Economist  ,0,1,0,0,0,0,0.042867072,0.030754719,0.92637813,Neu,0.012112353,activiststocks
2904,2017-04-03 19:25:00,Biglari Holdings - Buffett Imposter Or Investing Genius?   ,0,1,0,0,1,2,0.028038146,0.09035214,0.8816097,Neu,-0.062313996,activiststocks
2905,2017-04-03 18:55:00,Your way of life would not be remotely possible without Wall Street - LA Times  ,0,0,1,0,0,0,0.06988044,0.018639782,0.9114798,Neu,0.05124066,activiststocks
2906,2017-04-03 18:15:00,People are fleeing New York at an alarming rate | New York Post  ,0,1,0,0,0,2,0.017175099,0.92217904,0.060645875,Neg,-0.90500396,activiststocks
2907,2017-04-03 17:05:01,Under Armour Stock Is Ready to Rebound - Barron's  ,0,0,0,0,0,0,0.5213356,0.023430968,0.45523345,Pos,0.49790463,activiststocks
2908,2017-04-03 14:05:01,Don't Buy the Kate Spade Deal Hype - Bloomberg Gadfly  ,0,1,0,0,0,1,0.041054666,0.05285681,0.9060885,Neu,-0.011802144,activiststocks
2909,2017-04-03 00:40:05,"Pandora CEO, Pressured to Sell, Gets Last Chance to Beat Spotify - Bloomberg  ",0,0,0,0,2,0,0.11655839,0.17699222,0.70644945,Neu,-0.060433835,activiststocks
2910,2017-04-02 21:45:00,"A Real Estate Boom, Powered by Pot - The New York Times  ",0,0,0,0,0,1,0.16382238,0.015561989,0.82061565,Neu,0.1482604,activiststocks
2911,2017-04-02 21:15:00,Amazon Web Services: Launchpad for a New Generation of Start-Ups. Is That Good or Bad? - Barron's  ,0,1,0,0,1,2,0.21102037,0.0183168,0.77066284,Neu,0.19270356,activiststocks
2912,2017-04-02 19:45:01,AIG: New CEO Woes Already $AIG  ,0,0,0,0,0,0,0.019449005,0.85306495,0.12748599,Neg,-0.83361596,activiststocks
2913,2017-04-02 18:35:00,Subprime auto delinquency rate at highest level since financial crisis | Credit Writedowns Pro  ,0,0,0,0,0,1,0.2547206,0.7062784,0.03900099,Neg,-0.4515578,activiststocks
2914,2017-04-02 17:05:01,General Electric: Just Give Us Another Chance $GE  ,0,0,0,0,0,0,0.2693795,0.011480288,0.71914023,Neu,0.2578992,activiststocks
2916,2017-04-02 14:10:00,Valeant: Be Greedy When Others Are Fearful  ,0,1,0,0,2,0,0.032774284,0.091466725,0.875759,Neu,-0.05869244,activiststocks
2917,2017-04-02 07:41:00,"""Jerks and the Start-Ups They Ruin - New York Times""  ",0,0,0,0,0,3,0.025018075,0.16652353,0.8084584,Neu,-0.14150545,activiststocks
2918,2017-04-01 21:50:00,Wells Fargo Reaches $110 Million Fake Accounts Settlement - Bloomberg  ,0,0,0,0,0,0,0.068518,0.26391476,0.6675672,Neu,-0.19539677,activiststocks
2919,2017-04-01 20:50:00,A Hedge Fund's GM Plan Gives Hedge Funds a Bad Name - Bloomberg View  ,0,1,0,0,1,1,0.01664825,0.8101056,0.17324615,Neg,-0.7934574,activiststocks
2920,2017-04-01 19:45:01,Bearish Hedge Funds Stand to Gain as Trump Rally Fizzles - WSJ  ,0,0,0,1,0,0,0.4581073,0.17195576,0.36993688,Pos,0.28615153,activiststocks
2921,2017-04-01 18:40:02,Subprime auto delinquency rate at highest level since financial crisis | Credit Writedowns Pro  ,0,0,0,0,1,1,0.2547206,0.7062784,0.03900099,Neg,-0.4515578,activiststocks
2922,2017-04-01 18:00:03,Marcato Comments On Buffalo Wild Wings’ Retention Of The Cypress Group  ,0,0,0,0,0,0,0.034319114,0.058993258,0.9066877,Neu,-0.024674144,activiststocks
2923,2017-04-01 16:50:00,Fracking 2.0: Shale Drillers Pioneer New Ways to Profit in Era of Cheap Oil - WSJ  ,0,1,0,0,0,0,0.4689664,0.011107221,0.51992637,Neu,0.45785916,activiststocks
2924,2017-04-01 16:15:00,U.S. Says Gambler Made Clorox Trades After Calls With Icahn  ,0,1,0,0,0,0,0.06605752,0.50105846,0.4328841,Neg,-0.43500096,activiststocks
2925,2017-04-01 15:45:00,Three Reasons Small Caps Should be Part of Your Equity Allocation  ,0,0,0,0,1,0,0.044941258,0.025244687,0.9298141,Neu,0.019696571,activiststocks
2926,2017-04-01 15:00:03,"Sears and Its Hedge Fund Owner, in Slow Decline Together - The New York Times  ",0,0,0,0,0,1,0.00853228,0.9648407,0.026627012,Neg,-0.9563084,activiststocks
2928,2017-03-31 23:03:05,Eco Oro Issues Letter to Shareholders and Files Management Information Circular - MarketWatch  ,0,0,0,0,0,0,0.01941158,0.03564085,0.9449476,Neu,-0.01622927,activiststocks
2929,2017-03-31 21:55:00,"ICYMI ""Unlocking Value at GM: Two Classes of Common Shares."" $GM  ",0,0,0,0,0,0,0.20872016,0.008156639,0.7831232,Neu,0.20056352,activiststocks
2930,2017-03-31 20:45:01,"Red Mountain Capital’s full letter to Deckers’, pushing for a sale of the company $DECK  ",0,1,0,0,0,0,0.18078709,0.009931796,0.8092811,Neu,0.17085528,activiststocks
2931,2017-03-31 19:55:01,Arconic: Piling It On $ARNC $AA  ,0,1,0,0,0,0,0.112090334,0.010063727,0.87784594,Neu,0.102026604,activiststocks
2932,2017-03-31 18:35:01,Snapchat: The Next Twitter $SNAP $TWTR $FB  ,0,0,0,0,0,0,0.06844659,0.01856418,0.9129892,Neu,0.049882412,activiststocks
2933,2017-03-31 16:55:01,Bristol-Myers: A Massive Would-Be Takeover $BMY  ,0,0,0,0,0,0,0.08366749,0.028277632,0.88805485,Neu,0.055389855,activiststocks
2934,2017-03-31 16:10:01,GM's Own Tuneup Is Working - Bloomberg Gadfly  ,0,1,0,0,0,0,0.08542621,0.013784307,0.90078956,Neu,0.07164191,activiststocks
2935,2017-03-31 15:35:01,AIG: Icahn Finally Making Headway $AIG  ,0,0,0,0,0,0,0.90287226,0.015625814,0.08150185,Pos,0.88724643,activiststocks
2936,2017-03-31 14:50:01,Bill Ackman apology for Valeant in annual letter - Business Insider  ,0,0,0,0,1,0,0.08002406,0.19394892,0.726027,Neu,-0.11392486,activiststocks
2937,2017-03-31 14:05:01,General Electric: Looking For A New CEO? $GE  ,0,1,0,0,0,0,0.048034813,0.036069818,0.9158954,Neu,0.011964995,activiststocks
2938,2017-03-30 21:45:00,Cheddar: The CNBC of the Internet | WIRED  ,0,0,0,0,1,1,0.078774184,0.021659926,0.89956594,Neu,0.05711426,activiststocks
2939,2017-03-30 21:30:01,BofA Shakes Up Merrill Lynch Leadership Under New Chief Sieg - Bloomberg  ,0,0,0,0,1,1,0.014914287,0.87746173,0.107623905,Neg,-0.86254746,activiststocks
2940,2017-03-30 21:05:00,Mexican Attorney General Charged With Drug Trafficking at San Diego Border | NBC 7 San Diego  ,0,0,0,0,0,0,0.04161214,0.5683652,0.39002267,Neg,-0.52675307,activiststocks
2941,2017-03-30 21:05:00,Bonus/Layoffs/Liquidation Watch ’17: Paulson & Co. | Dealbreaker  ,1,1,0,0,0,1,0.016167333,0.85352373,0.1303089,Neg,-0.8373564,activiststocks
2942,2017-03-30 18:00:05,"""Ex-Jefferies Banker Fined For Using WhatsApp To Share Confidential Data - ZeroHedge""  ",0,1,0,0,0,0,0.030225964,0.65553904,0.31423497,Neg,-0.62531304,activiststocks
2943,2017-03-30 17:59:05,"""Ackman Is ‘Profoundly’ Sorry for $4 Billion Valeant ‘Mistake’ - Bloomberg""  ",0,1,0,0,1,0,0.2031194,0.19305111,0.6038295,Neu,0.0100682825,activiststocks
2944,2017-03-30 14:10:01,Fidelity's RIA business: a strong No. 2 that's working harder  ,0,1,0,0,0,0,0.89278245,0.008279198,0.098938346,Pos,0.88450325,activiststocks
2945,2017-03-30 01:38:00,"""The startup that teaches you how to cook, Blue Apron, has hired bankers for an IPO in 2017 - Business Insider""  ",1,1,0,0,1,1,0.13753614,0.01337163,0.8490922,Neu,0.12416451,activiststocks
2946,2017-03-30 01:36:04,"""Valeant Bet Was a ‘Huge Mistake,’ Hedge Fund Chief Ackman Says - New York Times""  ",0,0,0,0,1,0,0.043936566,0.32585266,0.63021076,Neu,-0.28191608,activiststocks
2947,2017-03-29 21:55:00,How Has Crowding Changed Over Time? · Novus  ,0,0,0,0,0,0,0.068062,0.023002323,0.90893567,Neu,0.045059677,activiststocks
2948,2017-03-29 21:45:00,Scoop: BuzzFeed going public in 2018 - Axios  ,0,1,0,0,0,1,0.06455198,0.013576069,0.92187196,Neu,0.05097591,activiststocks
2949,2017-03-29 20:55:00,Wall Street Bull Market Forecast Is Total Bull |    ,0,0,0,0,0,0,0.038345516,0.060281586,0.9013729,Neu,-0.02193607,activiststocks
2950,2017-03-29 20:40:00,The Mullet Discount | Absolute Return Investing with Eric Cinnamond  ,0,1,0,0,0,0,0.08953099,0.017266838,0.8932021,Neu,0.07226415,activiststocks
2951,2017-03-29 20:25:00,San Francisco meal-kit startup Blue Apron hires bankers for 2017 IPO - Business Insider  ,0,1,0,0,1,1,0.0588498,0.024572726,0.9165775,Neu,0.034277074,activiststocks
2952,2017-03-29 20:10:02,Investors Underperforming Their Own Investments  ,0,1,0,0,0,0,0.038948253,0.92707056,0.033981144,Neg,-0.8881223,activiststocks
2953,2017-03-29 20:04:03,David Einhorn distraction for GM management as sales peak - Business Insider  ,0,1,0,0,1,2,0.12658666,0.026568875,0.8468445,Neu,0.100017786,activiststocks
2954,2017-03-29 19:54:01,"As Trump Flaunts Ford's $1.2B Investment, Ford Says It Was Planned in 2015 - NBC News  ",1,1,0,0,0,0,0.051184,0.0133969905,0.9354191,Neu,0.03778701,activiststocks
2955,2017-03-29 18:25:01,‘Deep Subprime’ Auto Loans Are Surging - Bloomberg  ,0,1,0,0,1,2,0.11175994,0.72491854,0.16332157,Neg,-0.6131586,activiststocks
2956,2017-03-29 17:15:02,Facebook launches stories to complete its all-out assault on Snapchat - The Verge  ,0,1,0,0,1,1,0.06799465,0.026644047,0.9053613,Neu,0.0413506,activiststocks
2957,2017-03-29 15:30:02,Bloomberg sees rare drop in terminal users - Financial News  ,0,1,0,0,0,1,0.010833123,0.9541935,0.03497343,Neg,-0.9433603,activiststocks
2958,2017-03-29 14:00:05,Marcato Comments On Buffalo Wild Wings’ Board Changes  ,0,0,0,0,0,0,0.026657782,0.07303383,0.9003084,Neu,-0.04637605,activiststocks
2959,2017-03-29 00:52:01,"ICYMI $GM here's Einhorn’s presentation the GM split, ""Unlocking Value at GM: Two Classes of Common Shares.""  ",0,1,0,0,0,1,0.088895336,0.013464132,0.8976405,Neu,0.075431205,activiststocks
2962,2017-03-29 00:34:00,From the Seattle  rants and raves section  ,0,0,0,0,0,0,0.03128548,0.07700739,0.8917071,Neu,-0.04572191,activiststocks
2963,2017-03-29 00:33:03,Dirty girl ...  ,0,0,0,0,0,0,0.082619645,0.15693353,0.7604468,Neu,-0.07431389,activiststocks
2965,2017-03-28 21:44:02,"""The N.F.L. and the Business of Ripping Out the Heart of Oakland - New York Times""  ",0,1,0,0,0,0,0.044896938,0.0451542,0.90994895,Neu,-0.0002572611,activiststocks
2966,2017-03-28 21:44:00,"""How Lyft Is Capitalizing on Uber’s Scandals - Time""  ",0,1,0,0,0,1,0.11004033,0.011026166,0.8789335,Neu,0.09901416,activiststocks
2967,2017-03-28 19:45:01,CSX Has A Long-Term Commitment $CSX $NSC $UNP $CNI  ,0,1,0,0,0,0,0.27982047,0.011796121,0.70838344,Neu,0.26802436,activiststocks
2968,2017-03-28 17:05:01,AIG: New CEO Woes Already $AIG $PRU  ,0,0,0,0,0,0,0.026952432,0.8477624,0.12528518,Neg,-0.82080996,activiststocks
2969,2017-03-28 15:45:01,Macy's: Activist Investor Relieves Some Pressure $M $TJX $ROST  ,0,0,0,0,0,0,0.7168634,0.03637828,0.24675828,Pos,0.6804851,activiststocks
2970,2017-03-28 14:10:01,Snapchat: The Next Twitter $SNAP $FB $TWTR  ,0,0,0,0,0,0,0.06669957,0.019593457,0.9137069,Neu,0.047106117,activiststocks
2971,2017-03-28 13:04:00,Activist Stocks Newsletter -   ,0,0,0,0,0,0,0.02880856,0.047502667,0.92368877,Neu,-0.018694106,activiststocks
2974,2017-03-27 20:35:00,The High-Speed Trading Behind Your Amazon Purchase - WSJ  ,0,0,0,0,0,1,0.031823725,0.020373994,0.94780236,Neu,0.01144973,activiststocks
2975,2017-03-27 19:50:01,Warren Buffett's Next Target  ,0,0,0,0,0,0,0.025996692,0.05144699,0.9225563,Neu,-0.025450297,activiststocks
2976,2017-03-27 18:35:01,General Electric: Just Give Us Another Chance $GE  ,0,0,0,0,0,0,0.2693795,0.011480288,0.71914023,Neu,0.2578992,activiststocks
2977,2017-03-27 17:10:02,Bill Ackman’s new romance complicates ‘big-money’ divorce | Page Six  ,1,1,0,0,2,0,0.03488174,0.19291419,0.77220404,Neu,-0.15803245,activiststocks
2978,2017-03-27 15:30:03,Warren Wants SEC to Review Icahn’s Role Advising Trump on Rules - Bloomberg  ,1,1,0,0,2,0,0.03444237,0.10145173,0.86410594,Neu,-0.06700936,activiststocks
2979,2017-03-27 14:15:01,Could Technical Analysis Have Saved Bill Ackman? - ValueWalk  ,0,0,0,0,1,0,0.08543062,0.048922077,0.8656473,Neu,0.036508545,activiststocks
2980,2017-03-27 01:18:04,Time Inc. Moves Closer to Sale for More Than $20 a Share - Bloomberg  ,0,0,0,0,0,0,0.21824633,0.013948808,0.76780486,Neu,0.20429751,activiststocks
2982,2017-03-26 20:05:00,"Wall Street’s brutal arithmetic: Hedge fund CEO profits, while investors bear loss | Albuquerque Journal  ",1,1,0,0,0,0,0.03213152,0.7318294,0.23603907,Neg,-0.6996979,activiststocks
2983,2017-03-26 17:10:01,More hedge funds are failing. Here's why | Crain's New York Business  ,0,1,0,0,0,1,0.027811348,0.3992599,0.5729287,Neu,-0.37144855,activiststocks
2984,2017-03-26 14:15:00,12 Things Restaurants Should Know About Activist Investors - QSR magazine,0,0,1,0,0,0,0.039904002,0.022188872,0.93790716,Neu,0.01771513,activiststocks
2985,2017-03-25 20:55:00,Short Selling Funds are frauds and an embarrassment to the industry – according to a “John Doe” | thelongshorttrader  ,0,1,0,0,0,1,0.01964525,0.80631053,0.17404419,Neg,-0.78666526,activiststocks
2986,2017-03-25 20:40:00,Short Selling Funds are frauds and an embarrassment to the industry – according to a “John Doe” | thelongshorttrader  ,0,1,0,0,2,0,0.01964525,0.80631053,0.17404419,Neg,-0.78666526,activiststocks
2987,2017-03-25 20:30:01,Women talk about working in white male hedge funds - Business Insider  ,0,1,0,0,1,2,0.03671636,0.036246907,0.92703676,Neu,0.00046945363,activiststocks
2989,2017-03-25 20:20:00,What Happens To A Stock When An Activist Liquidates A Position? | Benzinga  ,0,1,0,0,0,0,0.026725827,0.22516792,0.74810624,Neu,-0.19844209,activiststocks
2990,2017-03-25 20:20:00,What Happens To A Stock When An Activist Liquidates A Position? | Benzinga  ,0,1,0,0,0,0,0.026725827,0.22516792,0.74810624,Neu,-0.19844209,activiststocks
2991,2017-03-25 20:20:00,Hedge Fund Run by Former 'Big Wolf' Trader Delivers 46% Return - Bloomberg  ,0,0,0,0,0,2,0.17076986,0.013072323,0.8161578,Neu,0.15769753,activiststocks
2992,2017-03-25 20:20:00,Valeant: The End of the Michael Pearson Era | Southern Investigative Reporting Foundation  ,0,0,0,0,0,0,0.049135044,0.028984278,0.92188066,Neu,0.020150766,activiststocks
2993,2017-03-25 20:20:00,"Yes, Your Sleep Schedule Is Making You Sick - The New York Times  ",0,1,0,0,0,0,0.021496566,0.77951545,0.198988,Neg,-0.75801885,activiststocks
2994,2017-03-25 19:55:00,The Golden Age of Hedge Funds  ,0,0,0,0,1,1,0.054146007,0.03805046,0.9078036,Neu,0.016095545,activiststocks
2995,2017-03-24 17:56:03,"""Charter Would Seek To Add 20,000 U.S. Jobs After Time Warner Merger -    ",0,0,0,0,0,0,0.877059,0.019612307,0.10332876,Pos,0.8574467,activiststocks
2997,2017-03-23 20:55:00,Successful Active Stock Investing is Hard: Here... | What Works on Wall Street  ,0,1,0,0,1,0,0.028911259,0.036798578,0.9342901,Neu,-0.007887319,activiststocks
2998,2017-03-23 18:55:00,So Why Not Google It..? | Wexboy  ,0,0,0,0,0,1,0.034181822,0.025095727,0.9407224,Neu,0.009086095,activiststocks
2999,2017-03-23 17:09:00,"""Alaska Airlines is killing off the Virgin America brand - CNNMoney""  ",0,1,0,0,0,0,0.043976247,0.5108995,0.4451243,Neg,-0.46692324,activiststocks
3000,2017-03-23 16:00:05,How to short Uber (and other private companies) – Medium  ,0,1,0,0,0,1,0.051886316,0.01732367,0.93079,Neu,0.034562647,activiststocks
3001,2017-03-23 13:05:01,Rare Discovery: A Value in the Biotech World - WSJ  ,0,0,0,0,0,1,0.22799143,0.008759916,0.7632487,Neu,0.21923152,activiststocks
3002,2017-03-23 03:25:04,Atlantic Investment Management takes its stake in Diebold up from 5.1% to 6.7%. Activist since December. $DBD,0,1,0,0,0,0,0.5464741,0.02817839,0.4253475,Pos,0.5182957,activiststocks
3003,2017-03-22 22:27:02,"""IBM, remote-work pioneer, is calling thousands of employees back to the office - Quartz""  ",0,1,0,0,0,0,0.048268575,0.09514457,0.8565868,Neu,-0.046875995,activiststocks
3004,2017-03-22 22:26:04,"""How to short Uber (and other private companies) - Medium""  ",0,0,0,0,1,1,0.07089689,0.012984902,0.91611826,Neu,0.057911985,activiststocks
3005,2017-03-22 18:50:00,"Domino's (DPZ) stock has outperformed Google (GOOG), Facebook (FB), Apple (AAPL), and Amazon (AMZN) this decade  ",1,1,0,0,1,0,0.9377346,0.03922666,0.02303884,Pos,0.89850795,activiststocks
3006,2017-03-22 16:05:01,5 Questions Every Investor Should Ask According to Howard Marks | Exploring Markets  ,0,1,0,0,0,3,0.056458328,0.024508508,0.9190332,Neu,0.031949818,activiststocks
3007,2017-03-22 13:05:01,Sears Warns of ‘Substantial Doubt’ About Company's Future - Bloomberg  ,0,1,0,0,0,1,0.0396298,0.7683531,0.19201714,Neg,-0.7287233,activiststocks
3008,2017-03-22 00:16:01,$UBER  ,0,0,0,0,0,1,0.22544166,0.034559116,0.7399992,Neu,0.19088255,activiststocks
3009,2017-03-21 21:00:05,Gas Glut Reverses Lucrative 2016 Trade - WSJ  ,0,0,0,0,0,0,0.041466992,0.8597075,0.09882545,Neg,-0.81824046,activiststocks
3010,2017-03-21 20:10:01,Hedge Fund Titan’s Surefire Bet Turns Into a $4 Billion Loss  ,0,0,0,0,1,0,0.08029767,0.14591253,0.7737898,Neu,-0.06561486,activiststocks
3011,2017-03-21 18:50:01,Investment-Related Search Trends on Google  ,0,0,0,0,0,0,0.028113475,0.0397216,0.9321649,Neu,-0.011608126,activiststocks
3012,2017-03-21 17:40:01,Broyhill 2017 annual investor letter  ,0,0,0,0,0,2,0.049313948,0.027940286,0.92274576,Neu,0.021373661,activiststocks
3013,2017-03-21 15:45:02,Procter & Gamble: Activist Trian Partners At Work $PG $COTY $KHC  ,0,0,0,0,0,0,0.12435037,0.018709734,0.8569399,Neu,0.105640635,activiststocks
3014,2017-03-21 15:00:05,"Chipotle, Herbalife, Sears: Doug Kass' Views - TheStreet  ",0,0,0,0,1,1,0.033977892,0.028098986,0.93792313,Neu,0.0058789067,activiststocks
3015,2017-03-21 14:30:03,CSX Has A Long-Term Commitment $CSX $NSC $UNP $CNI $CP  ,0,1,0,0,0,0,0.37838906,0.013125661,0.6084853,Neu,0.3652634,activiststocks
3016,2017-03-21 14:00:05,Ackman's Pershing Square: The Death Spiral Is Accelerating   ,0,1,0,0,1,1,0.06311262,0.10848469,0.8284027,Neu,-0.045372076,activiststocks
3017,2017-03-21 13:01:03,General Electric: Looking For A New CEO? $GE $XLI $DOW  ,0,1,0,0,0,0,0.04999498,0.02436756,0.9256375,Neu,0.02562742,activiststocks
3018,2017-03-20 20:55:00,Snapchat: The Next Twitter $SNAP $FB $GPRO $TWTR  ,0,0,0,0,1,0,0.072370745,0.019118741,0.9085105,Neu,0.053252004,activiststocks
3019,2017-03-20 19:55:00,Chipotle: Another Ackman Failure? $CMG $PNRA $MCD $WEN  ,0,0,0,0,0,0,0.05717791,0.19040288,0.7524192,Neu,-0.13322496,activiststocks
3020,2017-03-20 19:10:01,More Hedge Funds Shut Last Year Than Any Time Since the 2008 Crisis - Bloomberg  ,0,0,0,0,2,3,0.01178051,0.8958529,0.09236651,Neg,-0.8840724,activiststocks
3021,2017-03-20 17:20:01,"CSX: Caves To Activist, Too Quickly? $CSX $NSC $UNP $CNI $CP  ",0,0,0,0,0,1,0.04831077,0.03729756,0.91439164,Neu,0.01101321,activiststocks
3022,2017-03-20 17:19:03,There are advantages to not sitting at the table.,0,1,0,0,0,0,0.07905283,0.027705407,0.8932417,Neu,0.05134742,activiststocks
3023,2017-03-20 16:35:01,AIG: Icahn Finally Making Headway $AIG $MMC $CNA $XL  ,0,0,0,0,0,0,0.87939733,0.016193358,0.10440938,Pos,0.863204,activiststocks
3024,2017-03-20 16:15:02,"Uber president Jeff Jones is quitting, citing differences over ‘beliefs and approach to leadership’ - Recode  ",0,1,0,0,0,0,0.012377934,0.8367413,0.15088072,Neg,-0.8243634,activiststocks
3025,2017-03-20 15:00:05,Macy's: Activist Investor Relieves Some Pressure $M $HBC  ,0,0,0,0,0,0,0.7880743,0.050684255,0.16124149,Pos,0.73739004,activiststocks
3026,2017-03-20 14:30:03,Arconic: Piling It On $AA $ARNC  ,0,1,0,0,0,0,0.10282028,0.009812541,0.88736725,Neu,0.093007736,activiststocks
3027,2017-03-20 13:50:01,Bristol-Myers: A Massive Would-Be Takeover $BMY $IBB $PFE $NVS $GILD  ,0,0,0,0,1,2,0.11176714,0.016674053,0.8715588,Neu,0.09509309,activiststocks
3028,2017-03-20 13:05:01,Hedge Fund Titan’s Surefire Bet Turns Into a $4 Billion Loss   ,0,0,0,0,1,0,0.08029767,0.14591253,0.7737898,Neu,-0.06561486,activiststocks
3029,2017-03-19 19:10:00,Ackman's Investors Won't Get Their Yachts - Bloomberg View  ,0,1,0,1,3,5,0.03225539,0.037097007,0.9306476,Neu,-0.0048416182,activiststocks
3030,2017-03-19 16:10:00,Does Past Success Change Future Returns? – Ivanhoff Capital  ,0,0,0,0,0,0,0.043769818,0.031028414,0.9252017,Neu,0.012741404,activiststocks
3031,2017-03-19 00:11:02,"""I did not like the Pershing sale at all but the ValueAct + CFO trumps it imo."" $VRX",1,1,0,1,0,0,0.033155367,0.046288587,0.9205561,Neu,-0.01313322,activiststocks
3032,2017-03-18 16:41:02,"$WING Bull thesis  Ain't nothing changed. A little stronger, a little wiser, maybe a little more violent.   Rick Ross, Chicken Boss.  ",1,1,0,0,0,0,0.12797652,0.024601713,0.84742177,Neu,0.10337481,activiststocks
3033,2017-03-17 18:55:01,When an Indian Billionaire Becomes an Activist Investor - Bloomberg Gadfly  ,0,0,0,0,1,0,0.040212374,0.03198278,0.9278048,Neu,0.008229595,activiststocks
3034,2017-03-17 16:05:01,Will Betting on Zero Turn Out To Be A Zero For Ackman?  ,0,1,1,0,1,1,0.063501656,0.053787716,0.8827107,Neu,0.00971394,activiststocks
3035,2017-03-17 13:15:01,Dan Loeb's Third Point is looking to win fresh money  ,0,1,0,0,1,0,0.35855004,0.012328328,0.62912166,Neu,0.34622172,activiststocks
3036,2017-03-16 20:45:00,Samsung Still Mulling Holding Company Even With Heir Arrested - Bloomberg  ,0,1,0,0,0,0,0.026803905,0.4997118,0.47348428,Neg,-0.4729079,activiststocks
