,date,tweet,past_tense,present_tense,future_tense,replies_count,retweets_count,likes_count,pos_score,neg_score,neutral_score,sentiment,Sentiment_Score,user
1597,2017-06-15 22:42:01,At  EXPLORE conference listening to  right now- this tweet of his is interesting- will ask him about it during Q&A  ,0,1,1,5,3,12,0.035983015,0.020580918,0.9434361,Neu,0.015402097,lizannsonders
1598,2017-06-15 20:38:04,I know and Schwab's security team is on it- I got hacked- ugh  ,1,1,0,1,0,8,0.047902837,0.1423116,0.8097856,Neu,-0.094408765,lizannsonders
1599,2017-06-15 19:28:02, ,0,0,0,0,0,2,0.35916328,0.21665184,0.4241849,Neu,0.14251144,lizannsonders
1600,2017-06-15 19:23:00,   Yup- because real estate and stocks are the two largest components,0,1,0,0,1,3,0.057943314,0.0161296,0.9259271,Neu,0.041813716,lizannsonders
1601,2017-06-15 17:18:04,      ,0,0,0,2,3,8,0.35916328,0.21665184,0.4241849,Neu,0.14251144,lizannsonders
1602,2017-06-15 16:46:02," Typically bearish when inverted, not necessarily during process of getting there",1,1,0,0,0,1,0.03801878,0.063764945,0.8982163,Neu,-0.025746163,lizannsonders
1603,2017-06-15 15:05:05,Cool graphic     ,0,0,0,4,19,19,0.11856102,0.031477224,0.8499617,Neu,0.0870838,lizannsonders
1604,2017-06-15 14:39:01,Economic surprises could hit inflection point fairly soon (expectations bar had been set too high)     ,1,0,1,1,11,21,0.059861604,0.8134258,0.12671258,Neg,-0.7535642,lizannsonders
1605,2017-06-15 14:04:05,"Prior times when yield curve moved to flattest level in a year, avg & median S&P returns 1m, 3m, 6m later were positive   ",1,1,0,4,18,39,0.8321319,0.07319736,0.09467066,Pos,0.75893456,lizannsonders
1606,2017-06-14 22:00:03,"   Less leverage, fewer derivatives, healthier backdrop",0,0,0,1,0,2,0.32322782,0.022126133,0.65464604,Neu,0.30110168,lizannsonders
1607,2017-06-14 21:09:01,US real estate now worth $51.39 trillion; way above pre-bubble peak    ,0,0,0,27,166,179,0.905915,0.01584952,0.07823549,Pos,0.8900655,lizannsonders
1608,2017-06-14 20:46:02,👍🏻  ,0,0,0,0,1,3,0.03719407,0.0575872,0.9052188,Neu,-0.02039313,lizannsonders
1609,2017-06-14 19:41:00,"Post FOMC-meeting, September hike likelihood has dropped to 16% from 25% prior to the meeting.",1,1,0,0,9,12,0.009382586,0.973932,0.016685419,Neg,-0.9645494,lizannsonders
1610,2017-06-14 16:38:01,Slower loan growth can be explained (in part) by companies tapping the bond market instead. Source: Capital Economics    ,1,1,1,2,4,13,0.035924576,0.053199977,0.91087544,Neu,-0.0172754,lizannsonders
1611,2017-06-13 23:44:03,Avg 3m correlation of 10 sectors to S&P itself hit lowest level since 2001 as sector rotations characterize recent action ,1,1,0,1,1,5,0.015572017,0.9579001,0.026527883,Neg,-0.9423281,lizannsonders
1612,2017-06-13 20:12:02,"Which does a better job forecasting next year's real GDP growth, stocks or the yield curve?  See for yourself:  ",0,1,0,1,10,16,0.038719192,0.03770199,0.92357886,Neu,0.0010172017,lizannsonders
1613,2017-06-13 17:37:04,  You have been a big help!,1,1,0,0,0,2,0.77498126,0.01654152,0.20847726,Pos,0.7584397,lizannsonders
1614,2017-06-13 17:34:04,13  followers away from hitting 40k ... thank you everyone!,0,1,0,5,1,31,0.41098538,0.025619142,0.56339544,Neu,0.38536623,lizannsonders
1615,2017-06-13 16:45:03,      Sad but true,0,0,0,0,0,0,0.20163095,0.056224115,0.74214494,Neu,0.14540684,lizannsonders
1616,2017-06-13 15:52:04,"Financials, not tech, lead the sector fund net flows race post-election    ",0,1,0,1,2,9,0.23195985,0.023674618,0.7443655,Neu,0.20828523,lizannsonders
1617,2017-06-13 12:45:03,India for the win on the left; Russia for the loss on the right       ,0,0,0,1,8,6,0.44642055,0.0821838,0.47139564,Neu,0.36423674,lizannsonders
1618,2017-06-13 12:39:04,Tax reform = good; tax cuts = less good; temporary tax cuts = not good       ,0,0,0,5,26,32,0.8731391,0.08735734,0.039503522,Pos,0.78578174,lizannsonders
1619,2017-06-13 12:33:01,  I agree tech has a crowded trade problem,1,1,0,0,0,1,0.050353043,0.20718956,0.74245745,Neu,-0.15683651,lizannsonders
1620,2017-06-13 12:20:04,"Selling of tech may have more to go, but there's no comparison between today and 2000   ",0,1,1,5,31,50,0.07436473,0.041679937,0.88395536,Neu,0.03268479,lizannsonders
1621,2017-06-12 13:13:00,Decline in  GDPNow forecast is now inline with economists' consensus of 3%    ,0,1,0,2,6,10,0.045431796,0.9391823,0.015385887,Neg,-0.8937505,lizannsonders
1622,2017-06-10 20:02:00, Waiting for Plant to relent to a tour,0,1,0,0,0,1,0.10369449,0.19745955,0.698846,Neu,-0.09376506,lizannsonders
1624,2017-06-10 00:41:01," FANMAG is better- kinda like Tiger Beat magazine from the 1970s (yes, I am dating myself)",0,1,0,0,0,3,0.07859996,0.022162706,0.8992373,Neu,0.056437254,lizannsonders
1625,2017-06-09 22:18:01, Not after one day,0,0,0,0,0,0,0.13819003,0.04491504,0.8168949,Neu,0.093274996,lizannsonders
1626,2017-06-09 16:55:03,I couldn't agree more:  ‘reversal rate’ suggests rate cuts beyond a certain level can become contractionary   ,0,1,1,0,3,4,0.021627894,0.91242945,0.06594267,Neg,-0.89080155,lizannsonders
1627,2017-06-09 15:29:04,About to tape  with  ... tune in tonight at 8pm ET on ,0,0,0,1,0,12,0.061699077,0.014340168,0.92396075,Neu,0.047358908,lizannsonders
1628,2017-06-09 15:02:02,     Strength in their own markets,0,0,0,0,0,0,0.36872196,0.03558841,0.5956896,Neu,0.33313355,lizannsonders
1629,2017-06-09 12:14:03,In spite of 3 rate hikes since 12/15 financial conditions have actually loosened (higher = looser in chart)     ,1,1,0,0,11,17,0.69889164,0.22304514,0.07806327,Pos,0.4758465,lizannsonders
1630,2017-06-09 12:08:05,US rig count much stronger than in past      ,0,0,0,1,7,12,0.92850715,0.026884532,0.044608332,Pos,0.9016226,lizannsonders
1631,2017-06-09 11:54:05,"If/when we get corporate tax cuts/reform, banks should be biggest beneficiary     ",0,1,1,5,4,11,0.26502678,0.013339216,0.72163403,Neu,0.25168756,lizannsonders
1632,2017-06-08 15:01:03,US dollar and 10y Treasury yields much more highly correlated this year than is typically the case    ,1,1,0,0,2,3,0.1688242,0.06376416,0.7674117,Neu,0.10506003,lizannsonders
1633,2017-06-08 14:46:04, It's over the hills and far away ... I can do this all day,0,1,1,0,0,2,0.07565035,0.023582216,0.9007675,Neu,0.052068133,lizannsonders
1634,2017-06-08 14:25:05,Or whether he'll get Trampled Under Foot  ,1,0,1,6,0,5,0.044554435,0.11339131,0.8420542,Neu,-0.068836875,lizannsonders
1635,2017-06-08 13:44:00,If it were actually Zeppelin you would see me first in line  ,1,0,1,7,5,62,0.074242555,0.023400426,0.90235704,Neu,0.05084213,lizannsonders
1636,2017-06-08 12:28:00,Non-US investors have been sellers of US equities      ,1,1,0,0,4,6,0.053194337,0.05233093,0.89447474,Neu,0.0008634068,lizannsonders
1637,2017-06-08 12:26:04,US fund outflows continue (even inclusive of ETFs)        ,0,1,0,0,10,11,0.79821694,0.12371391,0.07806915,Pos,0.674503,lizannsonders
1638,2017-06-08 12:24:05,US now importing more oil from Iraq than Saudi Arabia      ,0,1,0,1,8,10,0.2687796,0.015699102,0.71552134,Neu,0.25308052,lizannsonders
1639,2017-06-08 12:23:01,Higher oil inventories = lower oil prices     ,0,1,0,0,1,6,0.61357373,0.31864086,0.06778542,Pos,0.29493287,lizannsonders
1640,2017-06-08 12:22:01,Market expects higher rates 1y out for most economies except Australia & Switzerland        ,0,1,0,0,2,6,0.9167948,0.025777077,0.057428207,Pos,0.8910177,lizannsonders
1641,2017-06-08 12:18:03,Alternative working arrangements = one of reasons for subdued wage pressures    ,1,1,0,3,12,11,0.20926996,0.30515704,0.48557296,Neu,-0.09588708,lizannsonders
1642,2017-06-08 01:06:04,   ,0,0,0,2,0,1,0.35916328,0.21665184,0.4241849,Neu,0.14251144,lizannsonders
1643,2017-06-07 22:56:05,Off to Asia tonight... Asia that is...7:10pm ET...tune in!,0,1,0,3,2,10,0.05974105,0.020325033,0.9199339,Neu,0.039416015,lizannsonders
1646,2017-06-06 17:13:02,Good one   ,0,0,0,1,10,29,0.47504064,0.058870185,0.4660891,Pos,0.41617045,lizannsonders
1647,2017-06-06 17:07:03,Slow  ,0,0,0,1,7,6,0.113869675,0.06079636,0.825334,Neu,0.053073313,lizannsonders
1648,2017-06-06 16:06:05,Another high for job openings JOLTS - skills gap is intensifying  ,0,1,0,0,16,13,0.028312948,0.9438095,0.027877644,Neg,-0.9154966,lizannsonders
1649,2017-06-06 14:52:03,I’m joining  of  at 11am ET to talk stocks/sectors and what’s next for Fed...link to follow when posted,1,1,0,0,4,3,0.03123738,0.021995656,0.946767,Neu,0.009241724,lizannsonders
1650,2017-06-06 13:58:03,"FYI, for all the obsession over the FANG stocks none of them are in top 10 for S&P either since-election or YTD",0,1,0,1,5,13,0.12720586,0.03092817,0.841866,Neu,0.09627769,lizannsonders
1651,2017-06-06 13:43:03,Traffic is AWFUL this morning weather ... might join conversation a bit later than expected  ,1,1,1,1,2,3,0.03322671,0.6740252,0.29274812,Neg,-0.64079845,lizannsonders
1652,2017-06-06 13:42:03,It's all about liquidity/money growth&gt;GDP/excess must go somewhere/why most asset classes have rallied (except commodities)   ,1,1,1,0,9,11,0.1900913,0.044723064,0.76518565,Neu,0.14536823,lizannsonders
1653,2017-06-06 13:06:01,"S&P has become better ""forecaster"" of economy than yield curve    ",1,1,0,1,9,8,0.35756388,0.035795268,0.6066409,Neu,0.3217686,lizannsonders
1654,2017-06-06 13:03:05,Correlation between S&P and Treasury yields is elevated again     ,1,1,0,0,4,9,0.9323176,0.016163047,0.051519357,Pos,0.91615456,lizannsonders
1655,2017-06-06 13:01:03,"Given signs of slowing inflation, markets have become more skeptical about Fed’s dots plot      ",1,1,0,0,2,3,0.20986831,0.5430847,0.24704693,Neg,-0.33321637,lizannsonders
1656,2017-06-06 12:50:03, CESI's plunge more about expectations bar having been set too high vs. data weakening significantly in an absolute sense    ,1,1,0,0,0,0,0.09766478,0.35867214,0.5436631,Neu,-0.26100737,lizannsonders
1657,2017-06-06 12:34:00, Always a mistake to try to bully ,0,1,0,1,0,1,0.059427295,0.6122788,0.3282939,Neg,-0.5528515,lizannsonders
1658,2017-06-06 12:32:01,Joining  Daybreak this morning around 9am ET for wide-ranging conversation ... tune in!,0,1,0,0,0,6,0.08446461,0.016144969,0.8993904,Neu,0.06831964,lizannsonders
1659,2017-06-06 04:02:00, .Eugene Levy and Catherine O'Hara ... doesn't get better than those two,0,1,0,1,0,3,0.14428219,0.100111395,0.7556064,Neu,0.044170797,lizannsonders
1660,2017-06-06 03:56:02, .Schitt's Creek ... side-splittingly funny,0,0,0,1,0,1,0.026302073,0.7528631,0.22083479,Neg,-0.726561,lizannsonders
1661,2017-06-06 01:02:04,"My musings on the latest jobs report, wage growth and implications for Fed policy  ",0,0,0,1,2,31,0.03530184,0.10141375,0.8632844,Neu,-0.06611191,lizannsonders
1662,2017-06-05 20:16:01,Joining  today around 4pm ET- tune in,0,1,0,0,1,8,0.024425687,0.0322613,0.943313,Neu,-0.007835614,lizannsonders
1663,2017-06-05 12:41:00,Cmon ladies ... there's some slack to pick up      ,0,1,0,0,3,7,0.32535505,0.13702773,0.53761727,Neu,0.18832733,lizannsonders
1664,2017-06-05 12:39:03,Income swings are largest at the tails (looks like a map of Nantucket)      ,0,1,0,0,0,3,0.035060145,0.07375345,0.8911865,Neu,-0.0386933,lizannsonders
1665,2017-06-05 12:37:01,Growth in US working-age population is now entirely dependent on immigration      ,0,1,0,2,21,19,0.04835858,0.04458005,0.9070614,Neu,0.0037785284,lizannsonders
1666,2017-06-05 12:31:05,Tech and health care have best Q2 earnings guidance ratio     ,0,1,0,0,8,7,0.84188,0.10541334,0.05270662,Pos,0.7364667,lizannsonders
1667,2017-06-05 12:28:05,"For first time in decade, it's more of a seller's market for housing    ",0,1,0,1,23,28,0.09371331,0.012919123,0.8933676,Neu,0.08079419,lizannsonders
1668,2017-06-04 13:37:04,Hysterical  ,0,0,0,3,15,49,0.0873574,0.04299154,0.8696511,Neu,0.04436586,lizannsonders
1669,2017-06-04 13:34:00, 0.7% was the actual initial print for first quarter real GDP ... the 3.5% is Atlanta Fed's GDPNow forecast for the second quarter,1,1,0,0,0,2,0.03603843,0.10201797,0.86194354,Neu,-0.06597954,lizannsonders
1670,2017-06-03 19:13:00, Happy Birthday  - you are a distinguished member of our club,0,1,0,0,0,4,0.721492,0.01119587,0.26731208,Pos,0.7102961,lizannsonders
1671,2017-06-02 18:24:04,Great job by my dear friend and next-door neighbor  at CodeConference  ,0,0,0,2,0,4,0.5704707,0.013915977,0.41561344,Pos,0.55655473,lizannsonders
1672,2017-06-02 15:23:01,Newspaper circulation way down    ,0,0,0,5,6,15,0.03522922,0.06146427,0.9033065,Neu,-0.026235048,lizannsonders
1674,2017-06-02 12:12:04,Household formation data now favoring owning over renting (no surprise given high rents)  ,1,1,0,0,7,16,0.4439594,0.1777069,0.37833372,Pos,0.2662525,lizannsonders
1675,2017-06-02 12:11:01,"Stronger market, but weaker breadth     ",0,0,0,1,9,18,0.5630526,0.35582137,0.08112607,Pos,0.20723122,lizannsonders
1676,2017-06-01 16:57:01, .We sure have,0,1,0,0,0,0,0.67368805,0.022303078,0.30400884,Pos,0.65138495,lizannsonders
1677,2017-06-01 16:54:00,Wage growth best for younger workers (bucks conventional wisdom/sure to elicit Twitter rants) factsmatter      ,0,0,0,5,9,13,0.11558869,0.19861066,0.6858007,Neu,-0.083021976,lizannsonders
1678,2017-06-01 16:45:04,"2/2 from Marc Andreessen: The real problem in the labor market is that we don't have enough workers.""",0,1,0,4,7,20,0.0164149,0.9334928,0.05009231,Neg,-0.9170779,lizannsonders
1679,2017-06-01 16:42:01,"Said MarcAndreessen:  ""We're wrong about robots stealing jobs. This is the panic every 25-50 years. It never comes true. 1/2",0,1,0,4,12,19,0.0215025,0.7237915,0.25470603,Neg,-0.702289,lizannsonders
1680,2017-06-01 12:10:03,"Denver, Dallas and Houston top the real estate appreciation list Source:  John Burns Real Estate Consulting  ",0,1,0,3,18,22,0.052085627,0.018321581,0.9295928,Neu,0.033764046,lizannsonders
1681,2017-06-01 12:07:00,"There's still work to do in terms of number of women CEOs, but this is good:  ",0,1,0,1,16,12,0.6935912,0.023012752,0.28339604,Pos,0.6705784,lizannsonders
1682,2017-06-01 12:05:05,Where countries are in monetary/economic cycle (no major country in recession)     ,0,1,0,0,6,9,0.033021756,0.21007967,0.7568986,Neu,-0.17705792,lizannsonders
1683,2017-05-31 19:45:05,June rate hike likelihood dips as per    ,0,0,0,1,7,3,0.017173419,0.944949,0.037877608,Neg,-0.92777556,lizannsonders
1685,2017-05-31 12:26:02,"Unlike Q1, Atlanta Fed's GDPNow forecast for Q2 (currently at 3.8%) running hot relative to consensus     ",0,1,0,0,4,10,0.030002499,0.9388655,0.031132087,Neg,-0.908863,lizannsonders
1686,2017-05-31 12:19:05,"Got asked about difference between these two...B'berg uses 6m MA & Citi uses 3m MA (either way, not great)     ",1,1,0,0,8,10,0.09924832,0.016997723,0.883754,Neu,0.082250595,lizannsonders
1688,2017-05-30 23:59:01,   ,0,0,0,1,0,1,0.35916328,0.21665184,0.4241849,Neu,0.14251144,lizannsonders
1689,2017-05-30 23:16:00, Somewhat typical pattern of weak Q1 followed by rebound in Q2 ... BEA having  trouble rectifying seasonal adjustment issues,1,1,0,1,0,1,0.030986749,0.93220574,0.036807615,Neg,-0.901219,lizannsonders
1690,2017-05-30 12:32:04,"Random swings, such as w/ inventories, auto prod/buying, defense, etc. - bake in higher 2Q GDP rate simply by not being repeated LSR",1,1,0,1,1,5,0.3507355,0.42895988,0.22030461,Neg,-0.07822439,lizannsonders
1691,2017-05-30 09:15:04,Business investment and consumer spending account for largest components of upgrade from 0.7% to 1.2% for Q1 GDP    ,0,0,0,2,11,21,0.8833407,0.049596924,0.067062415,Pos,0.8337438,lizannsonders
1692,2017-05-30 02:14:02,  It's for the top RIAs (advisors) on our platform- sorry!,0,1,0,1,0,0,0.065744,0.11877206,0.815484,Neu,-0.053028062,lizannsonders
1693,2017-05-30 01:41:03,Looking forward to interviewing MichaelLewis at  EXPLORE conference next month  ,0,1,0,1,3,22,0.06352635,0.014343949,0.9221297,Neu,0.0491824,lizannsonders
1694,2017-05-28 12:16:05,Trouble No More ... RIP GreggAllman,0,0,0,1,2,20,0.055357434,0.066492215,0.8781503,Neu,-0.011134781,lizannsonders
1695,2017-05-26 18:09:00,   consumer discretionary,0,0,0,0,0,0,0.036395654,0.039210778,0.92439353,Neu,-0.0028151236,lizannsonders
1696,2017-05-26 15:26:00,Sector fund flows since election    ,0,1,0,6,14,9,0.1456413,0.054640256,0.79971844,Neu,0.09100104,lizannsonders
1697,2017-05-26 13:54:02,1Q real GDP revised up from 0.7% to 1.2%...2Q should be at least 3% (Atlanta Fed's GDPNow has 4%),1,1,1,4,20,26,0.9466601,0.01763403,0.0357058,Pos,0.92902607,lizannsonders
1698,2017-05-25 23:17:02,Curb your enthusiasm ... one of worst breadth days in quite some time for a day with stocks hitting new highs,0,1,0,5,12,40,0.023046115,0.9296549,0.04729906,Neg,-0.90660876,lizannsonders
1699,2017-05-25 21:13:00,Now do that with a drink in your hand   ,0,1,0,0,0,4,0.03892805,0.03496742,0.9261045,Neu,0.003960632,lizannsonders
1700,2017-05-25 17:40:00,CNBC live via app working in-flight ... first thing on when I tuned in was  commercial ... serendipity,1,1,0,0,2,11,0.044523645,0.015681194,0.9397952,Neu,0.028842451,lizannsonders
1701,2017-05-25 17:35:03,class  ,0,0,0,0,2,8,0.057186022,0.049129527,0.8936844,Neu,0.008056495,lizannsonders
1703,2017-05-25 16:48:00,"So far, no access to news on my 5.5h flight to LA bliss  ",0,0,0,6,0,10,0.028180031,0.20509262,0.7667273,Neu,-0.17691259,lizannsonders
1704,2017-05-25 16:15:02,Retail disruption    ,0,0,0,2,5,15,0.028893398,0.040839277,0.9302674,Neu,-0.011945879,lizannsonders
1705,2017-05-25 15:25:01,"As per prior tweet, see relationship between financial news networks' political coverage and VIX    ",0,1,0,1,5,10,0.023564897,0.045147505,0.9312875,Neu,-0.021582607,lizannsonders
1706,2017-05-25 15:19:04,Business news networks not covering political risk to same degree as other networks     ,0,1,0,3,9,9,0.02896191,0.035106674,0.9359314,Neu,-0.006144764,lizannsonders
1707,2017-05-25 11:26:00,   Too many Millennials to generalize (they outnumber Boomers); but they do prefer experiences over stuff (a different kind of consumerism),0,1,0,1,0,1,0.051417153,0.0794872,0.86909556,Neu,-0.028070044,lizannsonders
1708,2017-05-24 15:50:00,"    Wage growth has accelerated for Millennials (finally) & job gains strong (again, finally) for the 25-34 year old bracket according to BLS",1,1,0,2,0,3,0.9481845,0.019135887,0.03267956,Pos,0.9290486,lizannsonders
1709,2017-05-24 15:21:01,"    Millennials = largest group of homebuyers @ 45%, according to Ellie Mae, a software company that analyzes mortgage data",0,1,0,2,0,2,0.06284508,0.07145122,0.8657037,Neu,-0.008606136,lizannsonders
1710,2017-05-24 14:34:00,   Fannie Mae and NerdWallet have both done them,1,1,0,1,0,0,0.10244332,0.015240333,0.8823163,Neu,0.08720299,lizannsonders
1711,2017-05-24 14:29:05,"   Millennials = largest group of homebuyers @ 45%, according to Ellie Mae, a software company that analyzes mortgage data",0,1,0,1,0,0,0.06284508,0.07145122,0.8657037,Neu,-0.008606136,lizannsonders
1712,2017-05-24 14:27:04,   Corroborating data including surveys and stronger job growth for that cohort,0,1,0,0,0,1,0.93052113,0.021716712,0.047762163,Pos,0.9088044,lizannsonders
1713,2017-05-24 13:57:02,"For all you online posters, think Tuesdays between 2-4pm    Jeff Weisbein, Kya (    ",0,1,0,0,1,1,0.021781366,0.051509056,0.92670953,Neu,-0.02972769,lizannsonders
1714,2017-05-24 13:53:05, Or Fairfield County CT,0,0,0,0,0,0,0.027629785,0.05535042,0.9170198,Neu,-0.027720634,lizannsonders
1715,2017-05-24 13:47:05,"As equity volatility dropped, risk parity funds bought more stocks...if/when it spikes, they'll sell, likely exacerbating next correction  ",1,1,1,8,43,70,0.060080465,0.907252,0.03266761,Neg,-0.84717155,lizannsonders
1716,2017-05-24 11:49:03,"Manchester, United  ",0,0,0,1,0,5,0.03902771,0.06891954,0.89205277,Neu,-0.02989183,lizannsonders
1717,2017-05-24 11:47:04,"Starter home sales surging, adding to evidence Millennials are stepping up    ",0,1,0,5,20,18,0.8960183,0.047889307,0.05609236,Pos,0.84812903,lizannsonders
1719,2017-05-23 17:58:04,Taping podcast today w/  and agree with productivity-is-understated thesis  ,0,1,0,0,3,5,0.26706538,0.013153108,0.7197816,Neu,0.25391227,lizannsonders
1720,2017-05-23 17:43:00,   Raise again,0,0,0,0,0,0,0.066763796,0.037638284,0.89559793,Neu,0.029125512,lizannsonders
1721,2017-05-23 10:28:02,OPEC's dwindling power (revenues)       ,0,1,0,0,5,23,0.012632522,0.9158923,0.07147519,Neg,-0.90325975,lizannsonders
1722,2017-05-22 22:52:03,With hats off to  my take on the Fed's balance sheet shrink and effect on stocks  ,0,0,0,3,6,17,0.045226626,0.051604677,0.9031687,Neu,-0.006378051,lizannsonders
1723,2017-05-22 20:57:02, Mix away,0,0,0,0,0,1,0.038839184,0.027607432,0.93355334,Neu,0.011231752,lizannsonders
1724,2017-05-22 16:50:02,"...but, as per my prior tweet, while algos garnering much attention lately, they're not making money as a group     ",0,1,0,0,6,12,0.058807716,0.0748314,0.8663609,Neu,-0.01602368,lizannsonders
1725,2017-05-22 16:35:04,"Quants ""taking over"" Wall Street      ",0,1,0,0,1,7,0.03873488,0.03873666,0.9225284,Neu,-1.7806888e-06,lizannsonders
1726,2017-05-22 16:31:05,Cel services = 1.85% of CPI...it's collapsed 12.91% in past 12m...that alone shaved ~24 basis points off CPI     ,1,1,0,4,12,12,0.13637164,0.8402957,0.023332598,Neg,-0.70392406,lizannsonders
1727,2017-05-22 15:56:05,"In Q1, % of S&P beating top-line expectations broke 10-quarter relative losing streak     ",1,1,0,1,7,10,0.14266013,0.84000236,0.017337536,Neg,-0.6973422,lizannsonders
1728,2017-05-22 12:40:02,"I'm in the 24%, but not the 79%      ",0,1,0,5,4,23,0.048758235,0.03407399,0.9171678,Neu,0.014684245,lizannsonders
1729,2017-05-22 12:38:05,"Apple has been ""catching down"" to other brands in terms of value       ",1,1,0,2,1,8,0.1655426,0.7002688,0.13418859,Neg,-0.5347262,lizannsonders
1730,2017-05-19 10:16:03,Sad that US is 1 on this list       ,0,1,0,10,47,42,0.033931315,0.76144224,0.20462647,Neg,-0.7275109,lizannsonders
1732,2017-05-19 10:09:05,This gives Fed ammunition to hike in June     ,0,1,0,0,4,8,0.65016156,0.11175632,0.23808213,Pos,0.53840524,lizannsonders
1733,2017-05-19 10:07:02,Confidence coming off the boil     ,0,1,0,1,10,7,0.5552097,0.07522423,0.36956614,Pos,0.47998548,lizannsonders
1734,2017-05-18 20:48:01,Prom 2017 with my beautiful daughter  ,0,0,0,25,1,182,0.062242683,0.039159946,0.8985974,Neu,0.023082737,lizannsonders
1735,2017-05-18 12:08:02,Ramping robotics     ,0,1,0,2,5,11,0.031241605,0.03746205,0.93129635,Neu,-0.006220443,lizannsonders
1736,2017-05-18 12:03:02,Loan delinquencies down a lot ... except for student loans      ,0,0,0,6,19,27,0.04186305,0.87554973,0.08258724,Neg,-0.8336867,lizannsonders
1737,2017-05-18 11:59:02,Consumer confidence likely to get hit; but recent high hasn't led to higher consumption Capital Economics     ,1,1,0,1,5,8,0.9204685,0.058672994,0.02085851,Pos,0.86179554,lizannsonders
1738,2017-05-18 11:55:01,"Impeachment odds in  (the ""stock market for betting"") have unsurprisingly spiked    ",1,1,0,4,10,10,0.033547167,0.8675066,0.09894615,Neg,-0.83395946,lizannsonders
1739,2017-05-17 23:46:01,"History of days like today: more selling over next 1-2w; but by 2m later, S&P generally pos with pos risk/reward skew  ",0,1,0,10,22,42,0.30845436,0.16175349,0.52979213,Neu,0.14670087,lizannsonders
1740,2017-05-17 16:41:05,    We're getting a sense of that today,0,1,0,1,0,1,0.23005159,0.018131534,0.75181687,Neu,0.21192005,lizannsonders
1741,2017-05-17 16:41:01,Americans' retirement assets well above pre-crisis levels    ,0,0,0,2,5,12,0.8266943,0.018936869,0.15436877,Pos,0.80775744,lizannsonders
1742,2017-05-17 15:51:05,"Joining  today around 4pm ET to talk, what else, markets",0,1,0,3,1,9,0.02770763,0.02472257,0.9475698,Neu,0.0029850602,lizannsonders
1743,2017-05-17 14:07:03,Stocks clearly haven't cared (yet) about economic data underperforming consensus expectations     ,1,1,0,1,8,10,0.016688291,0.9560395,0.027272124,Neg,-0.9393512,lizannsonders
1744,2017-05-16 20:36:00, I do no work whatsoever on individual names ... sorry,0,1,0,1,0,1,0.028161185,0.088335164,0.88350374,Neu,-0.06017398,lizannsonders
1745,2017-05-16 14:38:02,"Very strong industrial production, including for manufacturing with capacity utilization up nicely, too",0,1,0,0,2,9,0.9560555,0.016852167,0.027092267,Pos,0.9392034,lizannsonders
1746,2017-05-16 11:23:05,This is interesting:     ,0,1,0,2,4,8,0.05822985,0.02736171,0.9144085,Neu,0.03086814,lizannsonders
1748,2017-05-15 11:31:01,Joining  on  this morning around 8:20am ET,0,1,0,2,2,24,0.03274859,0.025855485,0.94139594,Neu,0.006893106,lizannsonders
1749,2017-05-14 12:08:04, 6/29 MetLife Stadium,0,0,0,0,0,0,0.02605218,0.05440443,0.9195434,Neu,-0.02835225,lizannsonders
1750,2017-05-14 12:08:01,To all the moms out there- Happy Mother's Day!💐,0,0,0,2,3,22,0.11671619,0.02163564,0.86164814,Neu,0.095080554,lizannsonders
1751,2017-05-14 04:48:00, Stevie,0,0,0,0,0,2,0.10910513,0.053541806,0.83735305,Neu,0.055563327,lizannsonders
1752,2017-05-14 04:45:04,6/29 MetLife Stadium  ,0,0,0,0,0,4,0.02605218,0.05440443,0.9195434,Neu,-0.02835225,lizannsonders
1753,2017-05-12 16:51:04,  Love it,0,0,0,0,0,0,0.09689945,0.02203826,0.88106227,Neu,0.07486119,lizannsonders
1754,2017-05-12 13:33:03, Or perhaps businesses should get some credit,0,0,1,0,0,1,0.4872185,0.015674174,0.4971073,Neu,0.47154433,lizannsonders
1755,2017-05-12 12:04:03,Population-adjusted unemployment claims at 48-year low    ,0,0,0,1,24,25,0.015589866,0.8806335,0.10377664,Neg,-0.8650436,lizannsonders
1758,2017-05-12 01:23:00, Better with DLR,0,0,0,0,0,0,0.8742757,0.039934635,0.08578969,Pos,0.83434105,lizannsonders
1759,2017-05-11 16:17:02,"Based on level of unemployment claims and historical relationships, unemployment rate could fall to sub-4%",1,0,1,2,3,15,0.010897907,0.9689445,0.020157656,Neg,-0.95804656,lizannsonders
1761,2017-05-10 16:05:04,Federal Open Mouth Committee     ,0,0,0,1,5,16,0.032450605,0.043845594,0.92370385,Neu,-0.011394989,lizannsonders
