,date,tweet,past_tense,present_tense,future_tense,replies_count,retweets_count,likes_count,pos_score,neg_score,neutral_score,sentiment,Sentiment_Score,user
927,2017-11-06 17:33:00,Healthy beat rates for both S&P earnings (can be manipulated) and revenues (can't be manipulated)    ,1,0,1,3,13,12,0.8420681,0.012902367,0.14502962,Pos,0.8291657,lizannsonders
928,2017-11-06 16:01:03,"SALT losers ... that's us in CT, as well as those in NY and NJ     ",0,1,0,2,5,5,0.096959434,0.024884239,0.87815636,Neu,0.072075196,lizannsonders
929,2017-11-06 14:13:03,Likelihood of a December Fed rate hike now &gt;92%    ,0,0,0,0,12,10,0.7104545,0.064828016,0.22471748,Pos,0.6456265,lizannsonders
930,2017-11-06 14:11:01,"Unemployment rate now firmly below “natural rate” level at which inflation is, in theory, supposed to begin rising    ",1,1,0,9,21,34,0.05485505,0.81866324,0.12648174,Neg,-0.7638082,lizannsonders
931,2017-11-03 22:14:04,   ,0,0,0,1,0,0,0.35916328,0.21665184,0.4241849,Neu,0.14251144,lizannsonders
932,2017-11-03 18:53:03,Hippo on a walkabout- love it  ,0,0,0,0,10,25,0.07542305,0.038541634,0.8860354,Neu,0.036881413,lizannsonders
933,2017-11-03 17:49:01,Productivity looks to be bright spot for 2018 (I'll be writing about it on Monday)    ,0,1,1,0,3,4,0.2676454,0.014581983,0.7177726,Neu,0.2530634,lizannsonders
934,2017-11-03 17:46:03,Households loving stocks  BalyasnyAssetManagement   ,0,1,0,6,3,6,0.063023284,0.031899575,0.90507716,Neu,0.031123709,lizannsonders
935,2017-11-03 16:29:03,For all you Police fans out there...  ,0,0,0,1,2,30,0.09214834,0.041914977,0.86593676,Neu,0.050233364,lizannsonders
936,2017-11-03 16:25:02,This is quite funny (see yellow pad) Bitcoin    ,0,1,0,6,37,110,0.050307084,0.036291126,0.9134018,Neu,0.014015958,lizannsonders
937,2017-11-03 15:31:04,   ,0,0,0,0,0,0,0.35916328,0.21665184,0.4241849,Neu,0.14251144,lizannsonders
938,2017-11-03 14:02:03,I agree.  It's gotten more exuberant but it's likely not yet irrational.  ,1,1,0,1,1,7,0.23617856,0.028801847,0.73501956,Neu,0.20737672,lizannsonders
940,2017-11-03 13:08:03, Unfortunately not quite: no 2m period is ever a definitive indication of a trend,0,1,0,1,0,0,0.05137761,0.032453675,0.91616875,Neu,0.018923935,lizannsonders
941,2017-11-03 13:01:04,"Household survey's ""not at work due to weather"" was +1.4m in Sept & -1.4m in Oct; showing hurricane impact was significant",1,1,0,2,6,7,0.030256579,0.94022506,0.029518347,Neg,-0.9099685,lizannsonders
942,2017-11-03 12:59:02,Welcome back  ... you are an inspiration!,0,1,0,0,2,10,0.520797,0.018092837,0.46111012,Pos,0.5027042,lizannsonders
943,2017-11-03 12:31:02,"261k payrolls...making up for last month's hurricane-related weakness, but light relative to consensus...upward revisions to past 2m",0,1,0,2,1,6,0.55516064,0.41979513,0.02504425,Pos,0.13536552,lizannsonders
944,2017-11-02 18:52:02,    ,0,0,0,1,0,4,0.35916328,0.21665184,0.4241849,Neu,0.14251144,lizannsonders
945,2017-11-02 17:52:01,"  Many do, many don’t...just like men",0,1,0,0,0,2,0.035861384,0.2626429,0.7014957,Neu,-0.2267815,lizannsonders
946,2017-11-02 16:57:02,Well ain't that a shame...  ,0,1,0,1,0,6,0.17010707,0.14025357,0.68963933,Neu,0.029853493,lizannsonders
947,2017-11-02 16:50:03,Not quite what I said- said better or worse matters more than good or bad when I comes to how economy affects stock market  ,1,1,0,4,3,22,0.05842749,0.058010492,0.8835621,Neu,0.00041699782,lizannsonders
948,2017-11-02 14:37:01,No way  ,0,0,0,11,1,17,0.08057309,0.11329407,0.80613285,Neu,-0.032720983,lizannsonders
949,2017-11-02 14:28:00,"Live at 11 A.M. ET: Jim Cramer, Schwab's Liz Ann Sonders and Others Talk Markets   via ",0,1,0,4,5,9,0.036638714,0.0239845,0.9393767,Neu,0.012654215,lizannsonders
950,2017-11-02 12:47:02,Productivity picks up the pace- 3.0% annual rate,0,1,0,3,6,17,0.9272155,0.025675569,0.047108926,Pos,0.9015399,lizannsonders
952,2017-11-02 11:39:04,The redtape map      ,0,0,0,3,7,5,0.032580733,0.035421222,0.9319981,Neu,-0.0028404891,lizannsonders
953,2017-11-02 11:38:00,This won't last forever CharlosGary   ,0,0,1,3,1,8,0.07666036,0.045772623,0.87756705,Neu,0.030887734,lizannsonders
954,2017-11-02 11:37:00,InvestorsIntelligence (newsletter writers' sentiment) ... total capitulation of the bears    ,0,0,0,4,20,35,0.046384253,0.22390147,0.7297142,Neu,-0.1775172,lizannsonders
955,2017-11-02 11:26:03,2/2:  ...along w/ 3y old   ... hmmm,0,0,0,0,1,4,0.114387654,0.043748498,0.8418638,Neu,0.070639156,lizannsonders
956,2017-11-02 11:26:00,1/2:  Amazon's 3 new domain names:     &  ,0,0,0,0,3,5,0.037924893,0.015608408,0.9464667,Neu,0.022316486,lizannsonders
958,2017-11-01 20:32:00,Jerome Powell it is for FedChair,0,1,0,2,7,14,0.026856044,0.030327179,0.9428168,Neu,-0.0034711342,lizannsonders
959,2017-11-01 20:10:05,My quick update on today's Fed meeting   ,0,0,0,2,6,6,0.03973755,0.028558627,0.9317038,Neu,0.011178922,lizannsonders
960,2017-11-01 15:03:04,Dow's relative strength over S&P due to greater concentration of large multinationals in Dow    ,0,0,0,2,7,6,0.94629616,0.012275237,0.041428618,Pos,0.93402094,lizannsonders
961,2017-11-01 15:00:01,   Good point,0,0,0,0,0,1,0.58546287,0.03582351,0.3787136,Pos,0.54963934,lizannsonders
962,2017-11-01 14:59:05,Dow's record-breaking stretch without a 1% intraday move     ,0,0,0,0,2,4,0.5995548,0.06945144,0.33099383,Pos,0.5301033,lizannsonders
963,2017-11-01 14:58:00,S&P has had positive total return for all 10m in 2017-  1st time in history,1,1,0,1,9,30,0.9526449,0.01950516,0.027849855,Pos,0.93313974,lizannsonders
964,2017-11-01 14:34:02,"   Fortunately no- just really tight spaces like MRI machines, tunnels, etc.",0,0,0,1,0,0,0.036897898,0.08993995,0.8731621,Neu,-0.053042054,lizannsonders
965,2017-11-01 14:33:04,Don't worry about drop in ISM mfg to 58.7 as prior surge & latest dip were both hurricane-related...still suggests mfg output is rebounding,1,1,0,0,2,3,0.80221176,0.1765524,0.021235798,Pos,0.62565935,lizannsonders
967,2017-11-01 12:25:01,ADP beat the consensus switch +235k jobs; but the whisper  for Friday's BLS report is below consensus,1,1,0,1,0,2,0.085252136,0.8843229,0.030424979,Neg,-0.7990707,lizannsonders
968,2017-11-01 00:40:00,Absolutely  ,0,0,0,0,0,6,0.06909419,0.031110115,0.8997957,Neu,0.037984073,lizannsonders
969,2017-10-31 17:14:01,Plunging consumer confidence by younger folks relative to older folks looks to be political in nature   ,0,1,0,7,21,14,0.011353931,0.9470859,0.0415601,Neg,-0.935732,lizannsonders
970,2017-10-31 14:46:02,For all you home sellers out there:      ,0,1,0,3,19,20,0.056422774,0.029748531,0.9138287,Neu,0.026674243,lizannsonders
972,2017-10-31 14:38:04,Savings rate at decade low 'cause net wealth at record high...sustainable IF housing/equity vals don’t fall CapitalEconomics   ,0,1,0,4,7,13,0.06892636,0.7894277,0.14164601,Neg,-0.72050136,lizannsonders
973,2017-10-31 14:35:04,Younger folks spending more than older folks even though confidence is higher among older folks     ,0,1,0,0,5,3,0.8528337,0.02930124,0.11786503,Pos,0.82353246,lizannsonders
974,2017-10-31 14:23:02,"Oct consumer confidence 125.9, up from Sep's 120.6 & &gt;121.5 consensus- highest in ~17 yrs w/ big jump in net % saying jobs plentiful",1,1,0,0,9,11,0.94170624,0.03197926,0.026314555,Pos,0.909727,lizannsonders
976,2017-10-31 13:45:02,"Historically, years when max Aug-Oct correction &lt; 5%, median Nov-Dec rally 4.3% (82% up) vs 3.1% (70% up) for all years ",0,0,0,3,8,15,0.6731847,0.28349864,0.04331668,Pos,0.38968605,lizannsonders
977,2017-10-31 13:24:05,...residential investment could add to non-residential investment (capex) as important kicker to growth in 2018...2/2,0,0,1,0,0,2,0.8514665,0.00791453,0.14061892,Pos,0.84355193,lizannsonders
978,2017-10-31 13:24:03,"Case-Shiller home price index +0.5%, above consensus (12m change +5.9%)...1/2",0,0,0,0,0,0,0.90781844,0.05623996,0.03594159,Pos,0.8515785,lizannsonders
979,2017-10-31 12:50:05,"Another modest acceleration in wages seen within ECI report:  ECI +0.7% m/m for Q3, up from 0.5% in Q2 w/ wages +0.7% as well",1,1,0,0,6,5,0.9532275,0.02709434,0.01967811,Pos,0.92613316,lizannsonders
980,2017-10-30 12:57:02,1.0% m/m jump in nominal consumption for Sept explains strong 2.4% Q3 consumption growth & suggests healthy start to Q4,0,1,0,0,2,11,0.94836605,0.025109135,0.026524743,Pos,0.92325693,lizannsonders
981,2017-10-30 11:59:02,Global debt percentages in a cool single graphic     ,0,0,0,4,30,47,0.35030544,0.051560234,0.5981343,Neu,0.29874521,lizannsonders
982,2017-10-30 11:46:05,Glad to CT near the top of college graduation rates   h/t Paul Menestrier   ,0,1,0,4,2,5,0.24314834,0.020472,0.73637974,Neu,0.22267634,lizannsonders
983,2017-10-29 14:08:00, “Thank You For Being Late” by Tom Friedman,0,1,0,0,0,0,0.200227,0.08078262,0.71899045,Neu,0.119444385,lizannsonders
984,2017-10-28 18:45:02,"  I do think there are elevated risks and sentiment is complacent at best, overly optimistic at worst...but bull market likely not over...yet",0,1,0,0,0,4,0.1107765,0.52682954,0.36239395,Neg,-0.41605306,lizannsonders
985,2017-10-28 16:29:01,Can't wait for the  game tonight...go  Tigers!,1,1,0,0,0,5,0.07325138,0.078206524,0.8485421,Neu,-0.0049551427,lizannsonders
986,2017-10-28 13:59:04,"Oops ... meant ""Market readings...""  ",0,1,0,1,2,8,0.046911314,0.058272645,0.89481604,Neu,-0.011361331,lizannsonders
989,2017-10-27 16:51:02,"Stocks on top relative to bonds, GDP and money supply     ",0,0,0,5,13,20,0.4863952,0.042992722,0.47061214,Pos,0.4434025,lizannsonders
990,2017-10-27 16:32:05,High correlation between tech sector flows and 10yT yields    ,0,1,0,1,7,18,0.37733248,0.012987795,0.60967976,Neu,0.3643447,lizannsonders
991,2017-10-27 16:26:05," Could be part of it, but some key LC company earnings have been stellar, which has fueled momentum",1,1,1,1,0,0,0.92357427,0.046033107,0.0303926,Pos,0.8775412,lizannsonders
992,2017-10-27 15:59:03,And the stock market bandwagon-jumping continues   ,0,1,0,2,5,7,0.060325727,0.15804069,0.78163356,Neu,-0.09771496,lizannsonders
993,2017-10-27 15:21:02,A shocking and sad relationship between opioid addictions and declining labor force participation     ,0,1,0,11,46,39,0.00999221,0.96281326,0.027194513,Neg,-0.9528211,lizannsonders
994,2017-10-27 15:15:03,Earnings have been doing most of the market's heavy lifting during this bull market     ,1,1,0,0,7,9,0.11826875,0.4037936,0.47793773,Neu,-0.28552485,lizannsonders
995,2017-10-27 15:11:01,"Since early-Oct peak, small caps (red) have again been underperforming large caps (white), even with $ strength  ",1,1,0,2,3,8,0.65948707,0.31346005,0.027052915,Pos,0.34602702,lizannsonders
997,2017-10-26 19:33:02,Update to my report on capex:  Takin Care of Business: Several Important Kickers for a Strong Capex Cycle  ,0,0,0,0,3,2,0.6138141,0.011047542,0.37513834,Pos,0.6027666,lizannsonders
998,2017-10-26 13:01:01,Projections for biggest job gains by profession     ,0,0,0,4,8,15,0.22035582,0.13092464,0.64871955,Neu,0.08943118,lizannsonders
999,2017-10-26 12:58:05,Investors Intelligence Bulls-Bears Spread (widely-followed sentiment indicator) hits highest level since 1987    ,0,1,0,2,21,17,0.92835104,0.027102515,0.044546433,Pos,0.9012485,lizannsonders
1000,2017-10-25 19:54:01,What a voice- the next Robert Plant  ,0,0,0,5,0,12,0.06364544,0.038787827,0.8975668,Neu,0.02485761,lizannsonders
1001,2017-10-25 19:31:04,"Well, this is just about the most wonderful, sweetest things I've seen in a very long time ❤️  ",1,1,0,1,12,56,0.2147581,0.021111755,0.7641302,Neu,0.19364634,lizannsonders
1002,2017-10-25 18:17:05,Short volatility bets have been unwound    ,1,1,0,1,9,7,0.034386206,0.64433575,0.321278,Neg,-0.6099495,lizannsonders
1003,2017-10-25 18:08:00,UMich consumers' optimism about stock market hits all-time high  ,0,1,0,0,6,9,0.8508654,0.054876793,0.09425776,Pos,0.7959886,lizannsonders
1004,2017-10-25 17:51:02,Ditto  ,0,0,0,1,1,3,0.044360034,0.063269354,0.89237064,Neu,-0.01890932,lizannsonders
1005,2017-10-25 16:32:01,Polarization among jobs-by-income level    ,0,0,0,0,4,10,0.024878906,0.83308494,0.14203615,Neg,-0.808206,lizannsonders
1006,2017-10-25 15:53:01,Significant outperformance by Dow vs. S&P over past year  ,0,0,0,0,0,4,0.6485792,0.32615367,0.025267085,Pos,0.3224255,lizannsonders
1007,2017-10-25 15:30:01,"For the most part analysts haven't incorporated TaxReform into forward estimates, but companies are mentioning it more    ",1,1,0,1,2,5,0.03732543,0.027616639,0.935058,Neu,0.009708792,lizannsonders
1008,2017-10-25 15:25:05,The rise of the buyback    ,0,0,0,0,3,4,0.6114564,0.04951604,0.33902752,Pos,0.5619404,lizannsonders
1009,2017-10-25 15:16:04,Sept new home sales very strong at nearly 19% m/m,0,0,0,1,1,10,0.9484602,0.024348509,0.027191339,Pos,0.9241117,lizannsonders
1010,2017-10-25 13:56:04,"Sept durable goods +2.2%, well above consensus &  with strong details...bodes well for this Friday's 3Q GDP report",0,1,0,0,4,6,0.9421113,0.025881298,0.03200749,Pos,0.91623,lizannsonders
1011,2017-10-24 14:13:05,If only my middle was shrinking like this    ,1,1,0,9,9,44,0.14682786,0.661698,0.19147417,Neg,-0.5148701,lizannsonders
1012,2017-10-24 14:10:03,US has much higher share of prime-age men not in labor force than other global regions     ,0,1,0,1,11,5,0.41981348,0.22814438,0.3520421,Pos,0.1916691,lizannsonders
1013,2017-10-23 16:45:05,Easy  financial conditions give Fed a lot of room to run with tighter policy  ,0,1,0,2,1,3,0.69400346,0.018073695,0.2879228,Pos,0.6759298,lizannsonders
1014,2017-10-23 16:44:02,Powell in the lead FedChair     ,0,0,0,1,5,8,0.13250577,0.06541043,0.8020838,Neu,0.06709535,lizannsonders
1015,2017-10-23 13:18:02,"  Two favorite classics:  Winning on Wall Street (Zweig),  Reminiscences of a Stock Operator (LeFevre); and for fun, The Alienist (Carr)",0,1,0,1,1,1,0.06863901,0.029044043,0.902317,Neu,0.039594967,lizannsonders
1016,2017-10-23 13:15:02,"...18 consec records for daily, weekly, and monthly time frames, which has never been seen before in market history (2/2) ",1,1,0,1,1,14,0.04604556,0.055479094,0.89847535,Neu,-0.009433534,lizannsonders
1017,2017-10-23 13:15:01,"S&P: record high every day last wk, record closes for 6 straight wks, record closes for 7 straight mos ... (1/2)",0,0,0,6,7,35,0.21644911,0.043694604,0.73985624,Neu,0.17275451,lizannsonders
1018,2017-10-20 22:25:00,"Retailers: who's closing stores, who's opening stores     ",0,1,0,1,17,25,0.027793538,0.2117213,0.7604852,Neu,-0.18392776,lizannsonders
1019,2017-10-20 22:22:01,Money velocity picking up should mean higher inflation is coming    ,0,1,1,14,40,71,0.5886801,0.28516608,0.12615389,Pos,0.303514,lizannsonders
1020,2017-10-20 22:07:05,"Big difference between ""will"" and ""should"" when it comes to view about Fed chair   ",0,1,1,1,2,9,0.05344875,0.08934841,0.85720277,Neu,-0.03589966,lizannsonders
1021,2017-10-20 22:04:04,"Fed remains focused on ""short-term"" although less so since 2014    ",1,1,0,1,1,2,0.06615805,0.029147398,0.9046945,Neu,0.03701065,lizannsonders
1022,2017-10-20 20:53:01,An interesting graphic depicting Fed chair candidates from dovish-to-hawkish     ,0,1,0,4,15,14,0.049789857,0.046063002,0.9041472,Neu,0.003726855,lizannsonders
1023,2017-10-20 12:50:04,Leading indicators' weakness yesterday nearly all due to Hurricanes ... rebound expected   ,1,1,0,1,4,15,0.012549585,0.9699959,0.017454524,Neg,-0.95744634,lizannsonders
1024,2017-10-19 15:26:05,Deregulation remains a force; certain industries are beneficiaries; and performance has been telling   ,1,1,0,0,7,6,0.8826243,0.058952536,0.058423072,Pos,0.8236718,lizannsonders
1025,2017-10-19 15:16:01,We gotta do better than this; especially at the c-suite level    ,1,1,0,2,6,7,0.8187702,0.008024339,0.17320554,Pos,0.81074584,lizannsonders
1026,2017-10-19 15:13:05,An extraordinarily tight range for the S&P 500   ,0,0,0,3,1,5,0.03734235,0.86728984,0.09536777,Neg,-0.8299475,lizannsonders
1027,2017-10-19 14:52:00,Houses getting larger (and more expensive); but lots getting smaller JohnBurns    ,0,1,0,2,3,8,0.22452879,0.08167962,0.6937916,Neu,0.14284918,lizannsonders
1029,2017-10-19 14:47:03,Quite the 'stache   I was working for MartyZweig 30y ago today  ,1,1,0,0,1,15,0.0601927,0.04649892,0.8933084,Neu,0.01369378,lizannsonders
1030,2017-10-19 14:31:02,All 45 OECD countries growing (33 w/ accelerating growth); corporate earnings strong ... those inflection points pre-dated 2016 election  ,0,1,0,3,3,10,0.94771975,0.016472442,0.03580769,Pos,0.9312473,lizannsonders
1032,2017-10-19 14:26:00,This- and the prior week's episode when MartyZweig called the crash- are such memorable episodes of W$W ... I still miss Lou every day  ,1,1,0,9,5,41,0.044235386,0.15378685,0.80197775,Neu,-0.10955147,lizannsonders
1033,2017-10-19 14:24:00,Capex likely to be a bright spot for US economy in 2018  ,0,0,0,0,4,7,0.8873206,0.012229716,0.100449696,Pos,0.87509084,lizannsonders
1034,2017-10-19 14:22:05,Capex likely to be a bright spot for US economy in 2018  ,0,0,0,0,5,4,0.8873206,0.012229716,0.100449696,Pos,0.87509084,lizannsonders
1035,2017-10-19 13:55:04,Unemployment claims down to an extremely low 222k; erasing all of Hurricanes' effects (likely to move back up due to Maria/Puerto Rico),0,1,0,1,3,3,0.14749557,0.80756414,0.044940285,Neg,-0.6600686,lizannsonders
1037,2017-10-18 10:34:01,"More and more people choosing not to heed oft-heard warning: ""resist the temptation to buy a boat""    ",0,1,0,14,32,77,0.040726867,0.62364495,0.33562824,Neg,-0.5829181,lizannsonders
1038,2017-10-18 10:05:02,What industrial production would look like absent effects of Hurricanes   CapitalEconomics   ,0,0,1,1,1,3,0.021427292,0.12650098,0.85207176,Neu,-0.10507369,lizannsonders
1039,2017-10-17 15:15:04,"Strong 68 for Oct's NAHB housing market index (HMI) w/  all 3 components improving: current sales, expected sales & buyer traffic",1,1,0,0,4,4,0.9173008,0.022139324,0.06055977,Pos,0.8951615,lizannsonders
1040,2017-10-17 14:39:05,Solid 0.3% gain in IndustrialProduction - would have been higher were not for effects of Hurricanes,1,0,1,1,2,9,0.95410025,0.024224246,0.02167538,Pos,0.929876,lizannsonders
1041,2017-10-17 14:35:04,A key reason for low volatility this year       ,0,0,0,3,4,18,0.5559433,0.024461534,0.41959518,Pos,0.5314818,lizannsonders
1042,2017-10-17 14:32:04,Top 10 fears of Americans in 2017       ,0,0,0,0,14,13,0.03481925,0.5094836,0.45569727,Neg,-0.47466433,lizannsonders
1043,2017-10-17 14:09:03,"For me, memory of '87 Crash is 1st boss MartyZweig nailing it on W$W the week prior- little did I know then how hard market timing can be",1,1,1,11,4,54,0.030593758,0.4872578,0.48214844,Neg,-0.45666406,lizannsonders
1044,2017-10-17 14:06:01,"This metric has &lt;20y of history, but its all-time high is a little troubling and yet another indicator of complacency     ",0,1,0,8,61,117,0.04295548,0.9078927,0.049151856,Neg,-0.86493725,lizannsonders
1045,2017-10-17 14:00:05,This year's extraordinarily low volatility       ,0,0,0,2,2,9,0.232039,0.7391243,0.028836725,Neg,-0.5070853,lizannsonders
1046,2017-10-17 13:55:02,Easy financial conditions = December Fed rate hike      ,0,1,0,1,1,1,0.16364416,0.031084325,0.8052715,Neu,0.13255984,lizannsonders
1047,2017-10-17 13:52:00,Citi's US Economic Surprise Index further into positive territory     ,0,0,0,3,8,8,0.8330662,0.11979478,0.047139037,Pos,0.71327144,lizannsonders
1048,2017-10-17 00:52:04,"Me, too  ",0,0,0,17,6,106,0.13841654,0.029382806,0.8322007,Neu,0.10903373,lizannsonders
1049,2017-10-16 19:46:02,Recession in near-term highly unlikely  ,0,0,0,2,5,7,0.028166696,0.9082363,0.06359692,Neg,-0.8800696,lizannsonders
1050,2017-10-16 19:21:04,New vs old media news consumption     ,0,0,0,0,1,1,0.08102921,0.02357563,0.89539516,Neu,0.057453576,lizannsonders
1051,2017-10-16 19:12:03,Medical care inflation is at a multi-decade low     ,0,1,0,6,11,21,0.104916014,0.60666525,0.28841877,Neg,-0.5017492,lizannsonders
1052,2017-10-16 16:46:02,Inflation picking up everywhere    ,0,1,0,9,35,41,0.3082033,0.3525721,0.33922464,Neg,-0.044368804,lizannsonders
1054,2017-10-16 16:33:01,"""Buy the dip"" popularity: More evidence of heightened investor optimism (contrarian indicator?)    ",0,0,0,6,3,10,0.31876555,0.039481953,0.6417524,Neu,0.27928358,lizannsonders
1055,2017-10-16 16:31:00,Empire mfg index up and suggests economic momentum with jump in shipments,0,1,0,0,3,7,0.91195035,0.03272437,0.05532535,Pos,0.87922597,lizannsonders
1056,2017-10-13 15:39:03,     ,0,0,0,1,2,0,0.35916328,0.21665184,0.4241849,Neu,0.14251144,lizannsonders
1058,2017-10-13 14:15:00,Technology = factor that's improved our lives most in past 50 years    ,0,1,0,0,2,8,0.8258288,0.010679351,0.16349183,Pos,0.8151494,lizannsonders
1059,2017-10-13 14:11:01,"Even the most ""bearish"" managers are fully long stocks       ",0,1,0,3,7,21,0.090410136,0.33588418,0.57370573,Neu,-0.24547404,lizannsonders
1060,2017-10-13 14:08:03,"Correlations continue to drop, allowing active management to gain ground on passive StockPicking matters    ",0,1,0,3,11,22,0.14887102,0.8032757,0.04785334,Neg,-0.6544047,lizannsonders
1061,2017-10-13 13:56:01,"Short-lived lift for ""tax reform basket"" suggests ongoing skepticism it gets done       ",1,1,0,1,14,15,0.07866266,0.60962933,0.31170803,Neg,-0.53096664,lizannsonders
1062,2017-10-13 13:51:00,Long/short HFs have built up highest equity beta position since pre-financial crisis       ,1,1,0,0,7,11,0.94302994,0.016066948,0.04090299,Pos,0.926963,lizannsonders
1063,2017-10-13 13:45:02,Rapid oil production recovery post-Harvey   ,0,0,0,0,7,11,0.93853456,0.018881466,0.042583935,Pos,0.9196531,lizannsonders
1064,2017-10-12 13:51:01,Consumers' belief in inflation is strengthening again    ,0,1,0,1,2,8,0.9403136,0.019336736,0.04034971,Pos,0.9209768,lizannsonders
1065,2017-10-12 13:37:04,"Is this year's rally ""unprecedented"" as has been suggested?     ",1,1,0,2,12,18,0.06608249,0.08281708,0.8511005,Neu,-0.016734585,lizannsonders
1067,2017-10-12 13:33:00,Asia region generates more GDP from online than United States      ,0,1,0,1,15,4,0.2135807,0.01748917,0.76893014,Neu,0.19609153,lizannsonders
1069,2017-10-12 12:56:00,Joining  Daybreak Americas in the 9am ET hour today ... tune in,0,1,0,1,0,10,0.042600084,0.016517302,0.94088256,Neu,0.026082782,lizannsonders
1070,2017-10-11 16:39:01, Of course,0,0,0,0,0,0,0.12848929,0.054357454,0.8171533,Neu,0.07413183,lizannsonders
1071,2017-10-11 14:22:02,Joining  Squawk on the Street this morning at 10am,0,1,0,0,1,13,0.062038682,0.61033803,0.32762328,Neg,-0.5482994,lizannsonders
1072,2017-10-11 12:42:02,Got ? other day about cash-out refi up &gt;2x from post-crisis low & whether another bubble's brewing...a longer-term look's in order   ,0,0,0,1,11,8,0.6522572,0.03514825,0.31259453,Pos,0.61710894,lizannsonders
1073,2017-10-11 12:34:03,Small business' hiring plans high & still rising; as is skills gap ... labor shortages big problem for builders     ,0,1,0,0,7,4,0.021754159,0.94691944,0.03132631,Neg,-0.9251653,lizannsonders
1074,2017-10-10 23:26:00, Awesome,0,0,0,0,0,1,0.100091495,0.029654374,0.87025416,Neu,0.07043712,lizannsonders
1075,2017-10-10 17:23:00,A good primer on income tax stats in light of tax reform debate     ,0,0,0,3,26,20,0.5938146,0.017360816,0.38882452,Pos,0.5764538,lizannsonders
1076,2017-10-10 17:21:00,Small/medium-size businesses increasingly important re: global jobs       ,0,0,0,1,2,6,0.061279476,0.03959903,0.89912146,Neu,0.021680444,lizannsonders
1077,2017-10-10 17:14:00,"Market has not been ""trendy"" since '09 ... has aided stocks ... something we should keep an eye on if ""trendiness"" picks up   ",1,1,1,1,3,6,0.80763614,0.07470341,0.11766046,Pos,0.73293275,lizannsonders
1078,2017-10-10 16:47:01,Labor shortages increasing mentioned in Fed's BeigeBook       ,1,1,0,0,4,3,0.032208662,0.8836815,0.08410985,Neg,-0.8514728,lizannsonders
1079,2017-10-10 16:32:02,"A different kind of dots plot...this one looking at Harvey/Irma vs. Andrew, Katrina & Sandy in terms of jobs     ",0,1,0,0,5,3,0.03657084,0.043740585,0.9196885,Neu,-0.007169746,lizannsonders
1080,2017-10-10 16:29:05,"Lots of volatility in betting markets, but Powell currently has most bets to be next FOMC chair    ",0,1,0,2,7,7,0.06788572,0.050626934,0.8814873,Neu,0.017258786,lizannsonders
1081,2017-10-09 17:51:01,"With a nod to the late great Tom Petty, my thoughts on jobs, wages and inflation     ",0,0,0,6,12,26,0.05456447,0.041382737,0.9040528,Neu,0.013181731,lizannsonders
1082,2017-10-09 12:16:05,Fewer people (from both parties) believe reducing the budget deficit is important      ,0,1,0,7,10,11,0.6651434,0.21634117,0.11851548,Pos,0.4488022,lizannsonders
1083,2017-10-09 12:09:02,"Amid some signs of investor euphoria, be mindful of the latest (down)trend in earnings revisions   ",0,0,0,2,15,11,0.017299116,0.9514147,0.031286176,Neg,-0.9341156,lizannsonders
1084,2017-10-06 20:27:00,    Fuschia,0,0,0,1,0,0,0.08262426,0.039366182,0.87800956,Neu,0.043258075,lizannsonders
1086,2017-10-06 17:10:02,"Largest spike in ""persons not at work due to bad weather"" since 1996 (explains negative payrolls)  ",0,1,0,4,7,18,0.014776695,0.9434942,0.04172908,Neg,-0.9287175,lizannsonders
1087,2017-10-06 16:07:03,"Lots of chatter about contrarian nature of this cover, but perhaps a caveat is the subhead (""Are asset prices too high?"")  ",0,1,0,12,7,26,0.04507283,0.118826926,0.8361002,Neu,-0.073754095,lizannsonders
1089,2017-10-06 03:52:01, 53 and counting,0,1,0,1,0,0,0.03787832,0.050258435,0.9118632,Neu,-0.012380116,lizannsonders
1090,2017-10-06 01:44:00,"Oh, and an electric typewriter with White Out  ",0,0,0,5,0,12,0.06351325,0.018919421,0.9175673,Neu,0.044593826,lizannsonders
1091,2017-10-06 01:43:01,"Or laptops, or cellphones...just books, notebooks and the Dewey decimal system at the library.  ",0,0,0,5,5,27,0.024406718,0.049938425,0.9256548,Neu,-0.025531707,lizannsonders
1092,2017-10-05 23:29:04,   Is that Simon?,0,1,0,1,0,2,0.048185267,0.064580105,0.8872346,Neu,-0.016394839,lizannsonders
