,date,tweet,past_tense,present_tense,future_tense,replies_count,retweets_count,likes_count,pos_score,neg_score,neutral_score,sentiment,Sentiment_Score,user
1139,2017-10-12 13:39:01,"Weekly Initial Unemployment Claims decrease to 243,000    ",0,0,0,0,8,4,0.016659755,0.9608666,0.022473648,Neg,-0.94420683,calculatedrisk
1140,2017-10-11 23:50:00,"Port of Long Beach: Record Month, ""Looks like retailers are optimistic about the holiday season""  ",0,1,0,0,4,6,0.9074028,0.048996713,0.043600466,Pos,0.8584061,calculatedrisk
1141,2017-10-11 20:09:03,"FOMC Minutes: ""Many participants thought"" December Rate Hike ""likely to be warranted""  ",1,1,0,0,1,2,0.7653319,0.120633736,0.11403433,Pos,0.6446982,calculatedrisk
1143,2017-10-11 12:11:00,MBA: Mortgage Applications Decrease in Latest Weekly Survey    ,0,0,0,0,0,0,0.012122477,0.97120786,0.016669696,Neg,-0.9590854,calculatedrisk
1144,2017-10-11 00:46:00,"Wednesday: Job Openings, FOMC Minutes  ",0,0,0,0,1,1,0.026950426,0.51126003,0.46178958,Neg,-0.4843096,calculatedrisk
1145,2017-10-10 20:09:00,Q3 Review: Ten Economic Questions for 2017  ,0,0,0,1,2,5,0.030369068,0.054035697,0.9155953,Neu,-0.02366663,calculatedrisk
1146,2017-10-10 17:29:04,Off-topic: The Art of Negotiation  ,0,0,0,2,8,19,0.040627528,0.032519873,0.9268526,Neu,0.008107655,calculatedrisk
1147,2017-10-10 15:08:00,CoreLogic: House Prices up 6.9% Year-over-year in August  ,0,1,0,0,2,2,0.954785,0.021671867,0.02354319,Pos,0.9331131,calculatedrisk
1149,2017-10-09 22:40:00,"Duy: ""On Track For a December Rate Hike""  ",0,0,0,0,3,1,0.8767004,0.052746143,0.07055354,Pos,0.8239543,calculatedrisk
1150,2017-10-09 17:17:02,Update: Framing Lumber Prices Up 20% Year-over-year    ,0,1,0,2,4,4,0.9474261,0.023706261,0.028867636,Pos,0.9237198,calculatedrisk
1151,2017-10-09 15:13:00,"Oil Rigs ""Steady as she goes""    ",0,1,0,0,1,3,0.12262295,0.024162408,0.8532146,Neu,0.09846054,calculatedrisk
1152,2017-10-09 13:22:00,Leading Index for Commercial Real Estate Declines in September    ,0,1,0,0,6,5,0.008528238,0.96931905,0.022152746,Neg,-0.9607908,calculatedrisk
1153,2017-10-09 01:35:00,Sunday Night Futures  ,0,0,0,0,1,2,0.032138318,0.08461431,0.8832473,Neu,-0.05247599,calculatedrisk
1154,2017-10-08 13:19:00,The Record Job Streak: A couple of Comments    ,0,0,0,0,0,3,0.047346972,0.1490116,0.8036414,Neu,-0.101664625,calculatedrisk
1155,2017-10-07 23:08:05," It would great if the JOLTS data was available for the '80s and '90s, but unfortunately, the series started in December 2000.",1,0,1,1,1,1,0.02460921,0.50209945,0.4732913,Neg,-0.47749025,calculatedrisk
1156,2017-10-07 13:17:00,"Schedule for Week of Oct 8, 2017    ",0,0,0,0,3,2,0.02084607,0.11599822,0.8631557,Neu,-0.095152155,calculatedrisk
1158,2017-10-06 20:20:01,"Public and Private Sector Payroll Jobs: Carter, Reagan, Bush, Clinton, Bush, Obama, Trump    ",0,0,0,1,1,3,0.028209923,0.21239145,0.75939864,Neu,-0.18418153,calculatedrisk
1159,2017-10-06 18:01:00,"Las Vegas Real Estate in September: Sales up Slightly YoY, Inventory down Sharply  ",0,0,0,0,2,1,0.029472446,0.9565438,0.013983718,Neg,-0.92707133,calculatedrisk
1160,2017-10-06 15:07:01,Comment: A Hurricane Impacted Employment Report    ,0,0,0,1,0,2,0.010916497,0.9512757,0.03780775,Neg,-0.94035923,calculatedrisk
1161,2017-10-06 13:49:00,"September Employment Report: 33,000 Jobs Lost, 4.2% Unemployment Rate    ",0,0,0,0,9,5,0.009207854,0.97089416,0.019897941,Neg,-0.9616863,calculatedrisk
1162,2017-10-05 22:55:04,The only way to make progress is for citizens to only vote people that pledge to vote to ban assault weapons. BanAssaultWeapons,0,1,0,4,9,27,0.03771262,0.03193487,0.9303525,Neu,0.00577775,calculatedrisk
1163,2017-10-05 22:55:02,We need a program (like Australia) to buy and destroy all existing assault weapons.  A six-month buyback period would be sufficient 3/4,0,1,1,2,6,23,0.382125,0.012340804,0.6055342,Neu,0.36978418,calculatedrisk
1164,2017-10-05 22:54:05,Banning “bump stocks” (that convert semi-automatic to full automatic) is obvious … and obviously insufficient.  2/4,0,1,0,1,3,18,0.029103626,0.4115606,0.5593358,Neu,-0.38245696,calculatedrisk
1165,2017-10-05 22:54:03,It is time to talk about guns.  We need to ban military style assault weapons.  There is NO reason for civilians to own these weapons 1/4,0,1,0,7,8,59,0.035179414,0.105639614,0.8591809,Neu,-0.0704602,calculatedrisk
1166,2017-10-05 22:49:00,Hotel Occupancy Rate just Behind Record Year    ,0,0,0,1,2,4,0.5976699,0.25929976,0.14303036,Pos,0.33837014,calculatedrisk
1167,2017-10-05 19:09:00,Goldman: September Payrolls Preview  ,0,0,0,0,1,1,0.019495856,0.6771054,0.30339873,Neg,-0.6576096,calculatedrisk
1168,2017-10-05 14:50:00,Trade Deficit at $42.4 Billion in August    ,0,0,0,0,2,1,0.01210826,0.94181675,0.0460751,Neg,-0.9297085,calculatedrisk
1169,2017-10-05 13:38:01,"Weekly Initial Unemployment Claims decrease to 260,000    ",0,0,0,0,2,3,0.018946376,0.95854634,0.022507299,Neg,-0.9396,calculatedrisk
1170,2017-10-04 23:38:00,"Thursday: Trade Deficit, Unemployment Claims  ",0,0,0,0,0,0,0.009450018,0.9667585,0.02379155,Neg,-0.9573085,calculatedrisk
1171,2017-10-04 19:04:00,September Employment Preview  ,0,0,0,0,2,0,0.030239318,0.66941017,0.30035055,Neg,-0.6391708,calculatedrisk
1172,2017-10-04 15:59:05,"Merrill on Sept NFP: ""We look for NFP to increase by a subdued 80k in September ... unemployment rate should be unchanged at 4.4%""",0,1,1,0,1,1,0.93748695,0.031234605,0.03127846,Pos,0.9062523,calculatedrisk
1173,2017-10-04 15:30:03," Thanks.  Typo 95,000 is the consensus",0,1,0,1,0,0,0.0658749,0.015282767,0.9188424,Neu,0.050592132,calculatedrisk
1175,2017-10-04 12:09:00,MBA: Mortgage Applications Decrease Slightly in Latest Weekly Survey    ,0,0,0,0,3,2,0.01412862,0.97070235,0.015168909,Neg,-0.9565737,calculatedrisk
1176,2017-10-04 02:00:00,"Wednesday: ADP Employment, ISM Non-Mfg Index  ",0,0,0,0,0,0,0.03635309,0.41065007,0.5529968,Neu,-0.374297,calculatedrisk
1177,2017-10-03 20:19:01,U.S. Light Vehicle Sales at 18.4 million annual rate in September    ,0,0,0,0,7,13,0.11504248,0.14328653,0.74167097,Neu,-0.028244048,calculatedrisk
1178,2017-10-03 18:49:05,Mostly from WardsAuto - still waiting for final details.,0,1,0,0,0,0,0.03286234,0.030819565,0.9363181,Neu,0.002042774,calculatedrisk
1179,2017-10-03 18:47:00,Vehicle sales: Early estimate 18.3 million SAAR (way above consensus view),0,0,0,1,4,9,0.8244509,0.03516961,0.14037958,Pos,0.7892813,calculatedrisk
1180,2017-10-03 17:00:00,"Merrill: ""The hurricanes and housing""  ",0,0,0,0,0,0,0.041266795,0.044070974,0.91466224,Neu,-0.0028041787,calculatedrisk
1181,2017-10-03 14:55:00,CoreLogic: House Prices up 6.9% Year-over-year in August    ,0,1,0,0,11,1,0.954785,0.021671867,0.02354319,Pos,0.9331131,calculatedrisk
1182,2017-10-03 00:10:00,Tuesday: Vehicle Sales  ,0,0,0,0,0,0,0.034055922,0.053538095,0.912406,Neu,-0.019482173,calculatedrisk
1184,2017-10-02 20:11:02,"Wells Fargo September NFP Forecast: 55,000.  ""September bears the potential to interrupt the 83 consecutive months of employment growth.""",0,1,0,1,3,2,0.5311589,0.24764062,0.22120047,Pos,0.2835183,calculatedrisk
1187,2017-10-02 13:12:05,"Black Knight Mortgage Monitor: ""350,000 in Hurricane Irma Disaster Areas Have Negative or Limited Equity""    ",1,1,0,0,8,3,0.013140012,0.9021693,0.084690765,Neg,-0.88902926,calculatedrisk
1188,2017-10-02 00:23:00,"Monday: ISM Mfg Index, Construction Spending  ",0,0,0,0,1,3,0.04154436,0.0669081,0.8915475,Neu,-0.02536374,calculatedrisk
1189,2017-10-01 13:17:00,"September 2017: Unofficial Problem Bank list declines to 119 Institutions, Q3 2017 Transition Matrix  ",0,0,0,0,1,0,0.013683134,0.93599194,0.050324924,Neg,-0.9223088,calculatedrisk
1190,2017-09-30 13:18:00,"Schedule for Week of Oct 1, 2017    ",0,0,0,0,2,0,0.020608399,0.108812615,0.87057894,Neu,-0.08820422,calculatedrisk
1191,2017-09-29 22:50:05,"Sept NFP Consensus is 95,000 (due to impact of hurricanes).",0,1,0,0,1,1,0.015700573,0.8729406,0.11135885,Neg,-0.85724,calculatedrisk
1193,2017-09-29 19:44:01,"Oil Rigs ""Signs of life in the rig count""    ",0,0,0,0,7,2,0.07585715,0.028785408,0.8953575,Neu,0.04707174,calculatedrisk
1194,2017-09-29 16:49:00,Q3 GDP Forecasts: Close to 2%  ,0,0,0,0,0,1,0.69034123,0.16364892,0.14600994,Pos,0.52669233,calculatedrisk
1195,2017-09-29 15:33:01,"Reis: Office Vacancy Rate ""flat"" in Q3 at 16.1%    ",0,0,0,0,5,5,0.020448623,0.94108105,0.038470306,Neg,-0.9206324,calculatedrisk
1197,2017-09-28 23:55:00,"Friday: Personal Income and Outlays, Chicago PMI and More  ",0,0,0,0,0,1,0.027528755,0.052454278,0.92001694,Neu,-0.024925523,calculatedrisk
1198,2017-09-28 18:59:00,New Home Prices    ,0,0,0,0,1,4,0.05041781,0.04902925,0.9005529,Neu,0.001388561,calculatedrisk
1200,2017-09-28 13:39:00,"Weekly Initial Unemployment Claims increase to 272,000    ",0,0,0,0,4,3,0.75017816,0.20100372,0.04881813,Pos,0.5491744,calculatedrisk
1201,2017-09-28 01:34:01,"Thursday: Unemployment Claims, GDP  ",0,0,0,0,0,0,0.023358366,0.748071,0.22857061,Neg,-0.72471267,calculatedrisk
1202,2017-09-27 22:10:00,A few comments on the Seasonal Pattern for House Prices    ,0,0,0,0,1,7,0.028107576,0.08488584,0.8870065,Neu,-0.056778267,calculatedrisk
1203,2017-09-27 20:15:01,"Zillow Forecast: ""August Case-Shiller Forecast: Annual Home-Price Gains Aiming Higher""    ",0,0,0,1,1,3,0.9481264,0.025020834,0.026852807,Pos,0.92310554,calculatedrisk
1206,2017-09-27 12:05:01,MBA: Mortgage Applications Decrease Slightly in Latest Weekly Survey    ,0,0,0,0,3,2,0.01412862,0.97070235,0.015168909,Neg,-0.9565737,calculatedrisk
1207,2017-09-27 01:05:00,"Wednesday: Durable Goods, Pending Home Sales  ",0,0,0,0,2,0,0.060237613,0.07719092,0.86257154,Neu,-0.016953308,calculatedrisk
1208,2017-09-26 21:23:03,"""We're heading for a recession and that's exactly what you're looking at now. "" Sam Zell, October 2012 ",0,1,0,3,4,27,0.025771227,0.7519134,0.22231531,Neg,-0.7261422,calculatedrisk
1209,2017-09-26 21:21:01,"""The housing bubble has been created more by the business press than reality,"" said Sam Zell, April 2005    ",1,1,0,1,5,11,0.047377367,0.12791793,0.82470465,Neu,-0.08054057,calculatedrisk
1210,2017-09-26 20:57:00,Real House Prices and Price-to-Rent Ratio in July    ,0,0,0,0,4,4,0.036266558,0.08831669,0.8754168,Neu,-0.05205013,calculatedrisk
1211,2017-09-26 19:42:02,Employment report note: Puerto Rico employment is not included in the monthly BLS report.,1,1,0,1,4,4,0.019440603,0.50576675,0.4747927,Neg,-0.48632616,calculatedrisk
1212,2017-09-26 17:56:00,"Yellen: ""Inflation, Uncertainty, and Monetary Policy""  ",0,0,0,0,1,2,0.07908221,0.040442307,0.8804755,Neu,0.038639907,calculatedrisk
1213,2017-09-26 16:36:04,A few Comments on August New Home Sales    ,0,0,0,0,3,3,0.026383018,0.05528698,0.91832995,Neu,-0.028903963,calculatedrisk
1215,2017-09-26 15:24:00,"New Home Sales decrease to 560,000 Annual Rate in August    ",0,0,0,0,3,0,0.009014035,0.9732651,0.017720865,Neg,-0.9642511,calculatedrisk
1217,2017-09-25 23:21:00,"Tuesday: New Home Sales, Case-Shiller House Prices, Yellen Speech and More  ",0,0,0,0,1,1,0.025133332,0.044322375,0.93054426,Neu,-0.019189043,calculatedrisk
1218,2017-09-25 18:50:00,"Duy: ""Has The Fed Abandoned Its Reaction Function?""  ",1,1,0,0,0,0,0.016482322,0.84756666,0.13595109,Neg,-0.8310844,calculatedrisk
1219,2017-09-25 15:44:03,"Dallas Fed: ""Growth in Texas Manufacturing Activity Holds Steady"" in September  ",0,0,0,0,1,0,0.8435528,0.038744576,0.11770261,Pos,0.80480826,calculatedrisk
1220,2017-09-25 14:37:00,"Black Knight: House Price Index up 0.5% in July, Up 6.2% year-over-year  ",0,0,0,0,1,1,0.94584376,0.029581588,0.024574578,Pos,0.91626215,calculatedrisk
1221,2017-09-25 13:44:00,"Chicago Fed ""Index points to slower economic growth in August""    ",0,0,0,0,6,5,0.013631162,0.96273583,0.023633018,Neg,-0.94910467,calculatedrisk
1222,2017-09-25 01:58:00,Sunday Night Futures  ,0,0,0,0,0,0,0.032138318,0.08461431,0.8832473,Neu,-0.05247599,calculatedrisk
1223,2017-09-24 16:08:01,Hotel Occupancy Rate just Behind Record Year    ,0,0,0,0,1,2,0.5976699,0.25929976,0.14303036,Pos,0.33837014,calculatedrisk
1224,2017-09-23 13:11:04,"Schedule for Week of Sept 24, 2017    ",0,0,0,0,0,0,0.021125283,0.11703065,0.8618441,Neu,-0.09590536,calculatedrisk
1226,2017-09-22 15:28:01,Mortgage Equity Withdrawal slightly positive in Q2    ,0,0,0,0,1,2,0.92335,0.05675927,0.019890783,Pos,0.8665907,calculatedrisk
1227,2017-09-22 13:13:05,"Update: For Fun, Stock Market as Barometer of Policy Success    ",0,0,0,0,1,4,0.09002967,0.014520639,0.89544976,Neu,0.075509034,calculatedrisk
1230,2017-09-21 15:03:00,Black Knight: Mortgage Delinquencies increase in Hurricane Affected Areas  ,0,1,0,0,4,2,0.032060225,0.95196813,0.015971623,Neg,-0.9199079,calculatedrisk
1231,2017-09-21 13:50:05,"CoreLogic: ""2.8 million Homes still in negative equity"" at end of Q2 2017    ",0,0,0,0,6,4,0.014245112,0.8317421,0.1540128,Neg,-0.817497,calculatedrisk
1232,2017-09-21 13:39:00,"Weekly Initial Unemployment Claims decrease to 259,000    ",0,0,0,0,2,1,0.017798927,0.9607925,0.021408582,Neg,-0.9429936,calculatedrisk
1233,2017-09-21 01:40:00,"Thursday: Unemployment Claims, Flow of Funds  ",0,0,0,0,0,1,0.022184681,0.20812957,0.76968575,Neu,-0.18594489,calculatedrisk
1234,2017-09-20 19:16:00,FOMC Projections and Press Conference Link  ,0,0,0,0,0,1,0.024320614,0.0468719,0.92880744,Neu,-0.022551287,calculatedrisk
1235,2017-09-20 19:10:00,"FOMC Statement: ""In October, the Committee will initiate the balance sheet normalization program""  ",0,0,1,1,2,4,0.1408363,0.012863134,0.84630054,Neu,0.12797317,calculatedrisk
1236,2017-09-20 16:32:00,A Few Comments on August Existing Home Sales    ,0,0,0,0,1,4,0.024154974,0.057500303,0.91834474,Neu,-0.033345327,calculatedrisk
1237,2017-09-20 15:17:00,"NAR: ""Existing-Home Sales Subside 1.7 Percent in August ""    ",0,1,0,0,1,2,0.028520312,0.95807123,0.013408486,Neg,-0.92955095,calculatedrisk
1238,2017-09-20 14:28:05,"AIA: Architecture Billings Index ""growth streak"" continues in August    ",0,1,0,0,3,6,0.251266,0.013282258,0.7354517,Neu,0.23798375,calculatedrisk
1239,2017-09-20 12:08:00,MBA: Mortgage Applications Decrease in Latest Weekly Survey    ,0,0,0,0,0,3,0.012122477,0.97120786,0.016669696,Neg,-0.9590854,calculatedrisk
1240,2017-09-20 01:06:00,"Wednesday: FOMC Announcement, Existing Home Sales  ",0,0,0,0,0,0,0.038438946,0.049037587,0.91252345,Neu,-0.010598641,calculatedrisk
1241,2017-09-19 18:45:01,"Chemical Activity Barometer ""Holds Steady"" in September    ",0,0,0,0,0,1,0.7626814,0.12628175,0.11103688,Pos,0.6363997,calculatedrisk
1242,2017-09-19 16:03:00,Comments on August Housing Starts    ,0,0,0,0,0,2,0.03369157,0.08891997,0.87738854,Neu,-0.055228397,calculatedrisk
1243,2017-09-19 13:43:00,Housing Starts decreased to 1.180 Million Annual Rate in August    ,1,1,0,0,5,5,0.008082122,0.9693114,0.022606522,Neg,-0.9612293,calculatedrisk
1244,2017-09-18 23:33:00,Tuesday: Housing Starts  ,0,0,0,0,0,1,0.0326371,0.08300538,0.8843576,Neu,-0.050368283,calculatedrisk
1245,2017-09-18 19:45:00,Lawler: Early Read on Existing Home Sales in August  ,0,0,0,0,0,0,0.10816507,0.031423915,0.860411,Neu,0.07674116,calculatedrisk
1246,2017-09-18 18:10:01,Hotel Occupancy Rate increases following Hurricanes Harvey and Irma    ,0,1,0,1,3,2,0.89851856,0.07670122,0.02478015,Pos,0.82181734,calculatedrisk
1248,2017-09-18 14:25:00,Black Knight: Preliminary Assessment Shows Over 3.1 Million Mortgaged Properties in Hurricane Irma Disaster Areas    ,0,0,0,0,5,1,0.06175938,0.6158824,0.32235813,Neg,-0.55412304,calculatedrisk
1249,2017-09-18 00:57:00,Sunday Night Futures  ,0,0,0,0,0,1,0.032138318,0.08461431,0.8832473,Neu,-0.05247599,calculatedrisk
1250,2017-09-17 13:16:00,FOMC Preview  ,0,0,0,0,1,0,0.041992716,0.03789034,0.92011696,Neu,0.0041023754,calculatedrisk
1251,2017-09-16 22:35:00,Goldman: FOMC Preview  ,0,0,0,0,0,1,0.026033953,0.03416283,0.9398032,Neu,-0.008128878,calculatedrisk
1252,2017-09-16 13:17:00,"Schedule for Week of Sept 17, 2017    ",0,0,0,0,1,1,0.02055349,0.11485174,0.86459476,Neu,-0.09429825,calculatedrisk
1253,2017-09-15 19:33:00,"Lawler: ACS-Based Household Growth Slowed Last Year: Homeownership Rate Estimate Up, But Barely  ",0,0,0,0,0,0,0.3616919,0.59809846,0.040209707,Neg,-0.23640656,calculatedrisk
1254,2017-09-15 17:29:00,Q3 GDP Forecasts: Moving Down  ,0,1,0,0,2,1,0.081605874,0.7650865,0.15330762,Neg,-0.6834806,calculatedrisk
1256,2017-09-15 15:39:04, Recession peak is in blue.  Current is red.,0,1,0,0,0,0,0.027160397,0.08105088,0.8917887,Neu,-0.05389048,calculatedrisk
1260,2017-09-15 02:13:00,"Friday: Retail Sales, Industrial Production, NY Fed Mfg Survey  ",0,0,0,0,0,1,0.038980555,0.038405664,0.92261386,Neu,0.0005748905,calculatedrisk
1261,2017-09-14 22:55:05,Also on Houston home sales: September will be worse!,0,0,1,0,1,3,0.011639546,0.9338552,0.05450535,Neg,-0.92221564,calculatedrisk
1262,2017-09-14 22:54:04,"Via Tom Lawler on Harvey ""According to the Houston Realtors, SFR sales this August were down 25.4% from last August (to 5,917 from 7,927)""",1,1,0,0,4,4,0.008390538,0.9757112,0.015898189,Neg,-0.9673207,calculatedrisk
1263,2017-09-14 21:49:00,"Phoenix Real Estate in August: Sales up slightly, Inventory down 7% YoY  ",0,0,0,0,3,2,0.03240042,0.95645535,0.011144323,Neg,-0.9240549,calculatedrisk
1264,2017-09-14 18:27:00,Key Measures Show Inflation mostly below 2% in August    ,0,0,0,0,3,0,0.026150031,0.81872094,0.15512905,Neg,-0.7925709,calculatedrisk
1265,2017-09-14 16:04:05,Early Look at 2018 Cost-Of-Living Adjustments and Maximum Contribution Base    ,0,0,0,0,2,1,0.027398923,0.05614389,0.91645724,Neu,-0.028744968,calculatedrisk
1266,2017-09-14 13:41:00,"Weekly Initial Unemployment Claims decrease to 284,000    ",0,0,0,0,7,5,0.017164523,0.9611256,0.021709977,Neg,-0.9439611,calculatedrisk
1267,2017-09-13 23:30:01,"Thursday: Unemployment Claims, CPI  ",0,0,0,0,0,1,0.018808505,0.80601597,0.17517559,Neg,-0.7872075,calculatedrisk
1269,2017-09-13 17:24:00,"Lawler: CPS-Based Household Growth Slowed Significantly in 2017, though Not as Much as Raw Numbers Suggest  ",0,0,0,1,2,0,0.013098161,0.96748394,0.019417882,Neg,-0.95438576,calculatedrisk
1270,2017-09-13 14:59:00,Merrill: The Impact of Harvey on August Retail Sales  ,0,0,0,0,2,2,0.043482557,0.33094266,0.6255748,Neu,-0.2874601,calculatedrisk
1271,2017-09-13 12:09:00,MBA: Mortgage Applications Increase in Latest Weekly Survey    ,0,0,0,0,0,0,0.8728017,0.09189953,0.03529878,Pos,0.7809022,calculatedrisk
1272,2017-09-13 00:15:00,Wednesday: PPI  ,0,0,0,0,0,0,0.033808794,0.06563945,0.90055174,Neu,-0.031830657,calculatedrisk
1273,2017-09-12 18:39:01,House Prices to Median Household Income    ,0,1,0,2,6,10,0.039196894,0.09617102,0.8646321,Neu,-0.056974128,calculatedrisk
1276,2017-09-12 01:41:01,"Tuesday: Job Openings, Small Business Survey  ",0,0,0,0,0,0,0.030130466,0.471663,0.49820665,Neu,-0.44153252,calculatedrisk
1277,2017-09-11 20:05:01,"Leading Index for Commercial Real Estate ""Slips"" in August    ",0,1,0,1,4,3,0.010034938,0.96896356,0.021001607,Neg,-0.95892864,calculatedrisk
1278,2017-09-11 16:05:02,Las Vegas: On Pace for Record Convention Attendance in 2017    ,0,0,0,0,4,5,0.84425247,0.02720637,0.12854119,Pos,0.8170461,calculatedrisk
1279,2017-09-11 13:19:00,"Black Knight Mortgage Monitor: ""Purchase Lending Hits Highest Level Since 2007""    ",0,0,0,0,7,7,0.9401422,0.019932956,0.039924808,Pos,0.9202093,calculatedrisk
1280,2017-09-11 01:12:00,Sunday Night Futures  ,0,0,0,0,0,0,0.032138318,0.08461431,0.8832473,Neu,-0.05247599,calculatedrisk
1281,2017-09-10 14:38:04,Goldman: Hurricane and Economic Data  ,0,0,0,0,2,10,0.030818084,0.061799813,0.90738213,Neu,-0.030981729,calculatedrisk
1282,2017-09-10 01:46:00,"Goldman: ""we estimate that hurricane-related disruptions could reduce 3Q GDP growth by as much as 1 percentage point""",0,1,1,5,32,24,0.02936683,0.9588071,0.011826061,Neg,-0.92944026,calculatedrisk
1283,2017-09-09 13:23:00,"Schedule for Week of Sept 10, 2017    ",0,0,0,0,0,0,0.020198042,0.1100037,0.8697983,Neu,-0.08980566,calculatedrisk
1284,2017-09-09 13:12:02,Irma eye clearly on visible on Key West long range radar (just off Cuba).    ,0,0,0,0,1,1,0.46957806,0.06640086,0.46402118,Pos,0.4031772,calculatedrisk
1285,2017-09-09 05:12:01,Irma outer band at the Keys ... Sat Image and Long Range Miami radar  ,0,0,0,1,1,4,0.055859793,0.012503439,0.93163675,Neu,0.043356355,calculatedrisk
1286,2017-09-08 23:14:00,"Oil Rigs ""Rig counts continue to ease back""    ",0,1,0,0,0,0,0.6843192,0.28383774,0.031843044,Pos,0.40048146,calculatedrisk
1287,2017-09-08 19:31:00,Q3 GDP Forecasts  ,0,0,0,1,1,3,0.027098952,0.08185838,0.89104265,Neu,-0.054759428,calculatedrisk
1288,2017-09-08 16:38:00,Hotel Occupancy and Hurricanes Harvey and Irma    ,0,0,0,0,1,0,0.008864764,0.9451052,0.046030074,Neg,-0.93624043,calculatedrisk
1289,2017-09-08 14:34:02, Yes. It looks like Irma will also be a Q3 drag on GDP.,0,1,1,0,0,0,0.039093003,0.8929297,0.06797738,Neg,-0.85383666,calculatedrisk
1290,2017-09-08 14:33:00,"Black Knight: Hurricane Harvey Could Result in 300,000 New Mortgage Delinquencies  ",0,0,0,0,2,0,0.010326793,0.95071036,0.03896281,Neg,-0.94038355,calculatedrisk
1291,2017-09-08 14:31:03,"Merrill: ""We estimate that Hurricane Harvey will slice 0.4pp from GDP growth in 3Q, which takes our tracking estimate down to 2.5%.""",0,1,1,1,10,2,0.016215835,0.9618887,0.021895438,Neg,-0.9456728,calculatedrisk
1292,2017-09-08 00:23:00,Mortgage Rates at 2017 Lows  ,0,0,0,0,2,5,0.017714098,0.921564,0.060721926,Neg,-0.9038499,calculatedrisk
1294,2017-09-07 17:45:00,"  In 1944, it was Westward ho!  Then with widespread AC, it became Southward ho!  And with climate change, it will be Northward ho!",1,0,1,0,0,1,0.03695964,0.029118663,0.9339217,Neu,0.007840978,calculatedrisk
1295,2017-09-07 16:45:00,Update: Framing Lumber Prices Up Year-over-year    ,0,1,0,1,2,0,0.7352526,0.20089872,0.063848674,Pos,0.5343539,calculatedrisk
1296,2017-09-07 16:21:00,Goldman: Demographics and Inflation  ,0,0,0,0,0,1,0.028508801,0.039659,0.9318322,Neu,-0.0111502,calculatedrisk
1297,2017-09-07 13:47:00,"Weekly Initial Unemployment Claims increase to 298,000    ",0,0,0,0,6,1,0.6386166,0.29148978,0.069893606,Pos,0.34712684,calculatedrisk
1298,2017-09-07 00:50:00,Thursday: Unemployment Claims  ,0,0,0,0,0,0,0.010103762,0.9620325,0.027863786,Neg,-0.95192873,calculatedrisk
1299,2017-09-06 20:03:00,"Fed's Beige Book: ""Modest to moderate""expansion, Labor markets ""Tight""  ",0,0,0,0,2,1,0.10031489,0.5900385,0.30964664,Neg,-0.4897236,calculatedrisk
1300,2017-09-06 19:29:00,"Las Vegas Real Estate in August: Sales up 6% YoY, Inventory down Sharply  ",0,0,0,0,2,4,0.03000652,0.95756036,0.012433058,Neg,-0.92755383,calculatedrisk
1301,2017-09-06 17:23:01,Excellent piece.  This mistake is common.  Here is a post from 2010: Older Workers and the Lump of Labor Fallacy    ,0,1,0,2,6,23,0.016366279,0.83523923,0.14839451,Neg,-0.8188729,calculatedrisk
1302,2017-09-06 15:50:02,Irma now in range of Puerto Rico short range radar.  ,0,0,0,0,1,2,0.09570323,0.02606303,0.8782338,Neu,0.0696402,calculatedrisk
1303,2017-09-06 15:19:00,"Employment: Preliminary annual benchmark revision shows upward adjustment of 95,000 jobs  ",0,1,0,0,3,2,0.56942827,0.38007236,0.050499354,Pos,0.18935591,calculatedrisk
1304,2017-09-06 13:51:00,Trade Deficit at $43.7 Billion in July    ,0,0,0,0,1,1,0.0136529645,0.92278665,0.063560344,Neg,-0.9091337,calculatedrisk
1305,2017-09-06 13:47:00,Off-topic: Puerto Rico Long range radar showing Irma now.  ,0,1,0,1,0,1,0.041049205,0.033455905,0.9254949,Neu,0.0075933,calculatedrisk
1306,2017-09-06 12:05:00,MBA: Mortgage Applications Increase in Latest Weekly Survey    ,0,0,0,0,1,2,0.8728017,0.09189953,0.03529878,Pos,0.7809022,calculatedrisk
1307,2017-09-06 06:36:00,Barbuda in the eye if Irma.  Amazing that this weather station is still reporting.     ,0,1,0,3,10,18,0.66414577,0.015617491,0.3202368,Pos,0.6485283,calculatedrisk
1308,2017-09-05 23:47:03,"Wednesday: Trade Deficit, ISM non-Mfg Index, Employment Preliminary Benchmark Revision  ",0,0,0,0,0,0,0.02073068,0.9195474,0.05972194,Neg,-0.8988167,calculatedrisk
1309,2017-09-05 20:01:00,Prime Working-Age Population near 2007 Peak    ,0,0,0,0,4,3,0.62861603,0.044878267,0.3265057,Pos,0.5837378,calculatedrisk
1310,2017-09-05 17:03:00,"Public and Private Sector Payroll Jobs: Carter, Reagan, Bush, Clinton, Bush, Obama, Trump    ",0,0,0,2,2,2,0.028209923,0.21239145,0.75939864,Neu,-0.18418153,calculatedrisk
1311,2017-09-05 14:21:00,CoreLogic: House Prices up 6.7% Year-over-year in July    ,0,1,0,1,6,5,0.95506924,0.020825624,0.024105122,Pos,0.9342436,calculatedrisk
1312,2017-09-05 01:21:00,Tuesday: CoreLogic House Price Index  ,0,0,0,0,2,1,0.0354337,0.06750613,0.89706016,Neu,-0.03207243,calculatedrisk
1313,2017-09-04 16:34:05,"Off-topic: It appears likely that Irma will impact the U.S., possibly south Florida late next weekend.  ",0,1,1,0,5,4,0.0270528,0.5082935,0.46465367,Neg,-0.48124072,calculatedrisk
1314,2017-09-04 16:20:00,August Employment Revisions  ,0,0,0,0,1,0,0.035692345,0.6849791,0.27932855,Neg,-0.64928675,calculatedrisk
1315,2017-09-04 00:24:00,Sunday Night Futures  ,0,0,0,0,1,1,0.032138318,0.08461431,0.8832473,Neu,-0.05247599,calculatedrisk
1316,2017-09-03 15:23:00,Hotel Occupancy and Hurricane Harvey    ,0,0,0,0,3,3,0.011552905,0.90073496,0.0877121,Neg,-0.88918203,calculatedrisk
1317,2017-09-02 13:19:00,"Schedule for Week of Sept 3, 2017    ",0,0,0,0,2,1,0.020974498,0.10916249,0.8698631,Neu,-0.08818799,calculatedrisk
1318,2017-09-02 00:38:00,"Oil Rigs ""Horizontal rig counts continue to fall""    ",0,1,0,1,8,5,0.010654973,0.96888196,0.020463113,Neg,-0.958227,calculatedrisk
1319,2017-09-01 20:27:00,U.S. Light Vehicle Sales at 16 million annual rate in August    ,0,0,0,1,7,4,0.1433352,0.14045376,0.716211,Neu,0.0028814375,calculatedrisk
1321,2017-09-01 17:35:00,Comment: A Solid Employment Report    ,0,0,0,5,3,1,0.9108357,0.049582426,0.03958191,Pos,0.86125326,calculatedrisk
