,date,tweet,past_tense,present_tense,future_tense,replies_count,retweets_count,likes_count,pos_score,neg_score,neutral_score,sentiment,Sentiment_Score,user
1526,2017-07-12 02:50:00,"Wednesday: Yellen Testimony, Beige Book  ",0,0,0,0,0,0,0.02695917,0.1180493,0.8549915,Neu,-0.09109013,calculatedrisk
1527,2017-07-11 23:31:00,"Phoenix Real Estate in June: Sales up 6%, Inventory down 10% YoY  ",0,0,0,0,1,5,0.13904536,0.8406151,0.020339588,Neg,-0.70156974,calculatedrisk
1530,2017-07-11 02:23:00,Tuesday: Job Openings  ,0,0,0,0,0,1,0.018539265,0.90145224,0.080008514,Neg,-0.882913,calculatedrisk
1531,2017-07-10 21:08:00,House Prices to National Average Wage Index    ,0,1,0,1,4,6,0.09595846,0.17965189,0.7243896,Neu,-0.08369343,calculatedrisk
1532,2017-07-10 17:01:00,Q2 Review: Ten Economic Questions for 2017  ,0,0,0,0,1,5,0.031170953,0.05001916,0.91880995,Neu,-0.018848207,calculatedrisk
1533,2017-07-10 14:48:00,"Black Knight Mortgage Monitor: ""Underwater Borrower Population Below Two Million for First Time Since 2006""    ",0,0,0,2,11,10,0.027817814,0.90992206,0.062260095,Neg,-0.8821043,calculatedrisk
1534,2017-07-10 00:23:00,Sunday Night Futures  ,0,0,0,0,0,1,0.032138318,0.08461431,0.8832473,Neu,-0.05247599,calculatedrisk
1536,2017-07-08 13:17:00,"Schedule for Week of July 9, 2017    ",0,0,0,0,0,3,0.020226631,0.10642071,0.87335265,Neu,-0.08619408,calculatedrisk
1537,2017-07-07 22:24:01,"Oil Rigs: ""The party's not over yet""    ",0,0,0,0,4,8,0.046660744,0.19111888,0.7622204,Neu,-0.14445814,calculatedrisk
1538,2017-07-07 18:08:01,"Public and Private Sector Payroll Jobs: Carter, Reagan, Bush, Clinton, Bush, Obama, Trump    ",0,0,0,1,2,2,0.028209923,0.21239145,0.75939864,Neu,-0.18418153,calculatedrisk
1539,2017-07-07 15:07:00,Comment: A Solid Employment Report    ,0,0,0,0,3,2,0.9108357,0.049582426,0.03958191,Pos,0.86125326,calculatedrisk
1540,2017-07-07 13:46:05,"June Employment Report: 222,000 Jobs, 4.4% Unemployment Rate    ",0,0,0,2,6,10,0.013577567,0.9600221,0.02640031,Neg,-0.9464445,calculatedrisk
1541,2017-07-07 01:08:00,Friday: Employment Report  ,0,0,0,0,1,1,0.022389347,0.87268436,0.104926206,Neg,-0.850295,calculatedrisk
1542,2017-07-06 21:53:01,Goldman Employment Preview  ,0,0,0,0,2,3,0.03810381,0.052473903,0.9094222,Neu,-0.014370091,calculatedrisk
1543,2017-07-06 18:48:04,June Employment Preview  ,0,0,0,0,1,1,0.03718773,0.54597145,0.41684085,Neg,-0.5087837,calculatedrisk
1544,2017-07-06 17:10:01,"Las Vegas Real Estate in June: Sales up 10% YoY, Inventory down Sharply  ",0,0,0,0,4,0,0.039886273,0.94677466,0.013339081,Neg,-0.90688837,calculatedrisk
1545,2017-07-06 13:54:04,Trade Deficit at $46.5 Billion in May    ,0,0,0,0,1,4,0.01289265,0.93090516,0.0562021,Neg,-0.9180125,calculatedrisk
1546,2017-07-06 13:36:05,"Weekly Initial Unemployment Claims increase to 248,000    ",0,0,0,0,2,7,0.72832125,0.21325119,0.058427535,Pos,0.5150701,calculatedrisk
1548,2017-07-06 12:10:04,MBA: Mortgage Applications Increase in Latest Weekly Survey    ,0,0,0,0,1,3,0.8728017,0.09189953,0.03529878,Pos,0.7809022,calculatedrisk
1549,2017-07-06 00:28:00,"Thursday: Unemployment Claims, ADP Employment, Trade Deficit, ISM non-Mfg Survey  ",0,0,0,0,2,1,0.015033917,0.84483767,0.14012839,Neg,-0.82980376,calculatedrisk
1550,2017-07-05 19:12:00,FOMC Minutes: Inflation Discussions  ,0,0,0,0,1,2,0.028525278,0.25566012,0.7158146,Neu,-0.22713484,calculatedrisk
1551,2017-07-05 17:57:01,Office Vacancy Rate and Office Investment    ,0,0,0,0,2,6,0.020817963,0.3378409,0.64134115,Neu,-0.31702295,calculatedrisk
1552,2017-07-05 15:11:00,Update: Framing Lumber Prices Up Year-over-year    ,0,1,0,2,2,3,0.7352526,0.20089872,0.063848674,Pos,0.5343539,calculatedrisk
1553,2017-07-05 00:00:00,Wednesday: FOMC Minutes  ,0,0,0,0,1,0,0.021342363,0.084475145,0.8941825,Neu,-0.06313278,calculatedrisk
1554,2017-07-04 16:16:00,Hotels: Hotel Occupancy down Year-over-Year    ,0,1,0,3,5,3,0.007623934,0.9719372,0.02043884,Neg,-0.96431327,calculatedrisk
1555,2017-07-03 23:53:00,"Goldman: ""We revised down our Q2 GDP tracking estimate by two tenths to 2.1% (qoq ar) ... following construction spending""",1,1,0,1,4,5,0.008765945,0.96859044,0.022643613,Neg,-0.9598245,calculatedrisk
1556,2017-07-03 19:17:01,U.S. Light Vehicle Sales at 16.4 million annual rate in June    ,0,0,0,0,4,8,0.11272574,0.11486681,0.7724074,Neu,-0.002141066,calculatedrisk
1557,2017-07-03 17:06:00,Construction Spending unchanged in May    ,0,1,0,0,6,1,0.051787194,0.75001603,0.19819672,Neg,-0.69822884,calculatedrisk
1558,2017-07-03 01:16:00,"Monday: Auto Sales, ISM Mfg, Construction Spending  ",0,0,0,0,0,2,0.050782446,0.035599325,0.91361827,Neu,0.015183121,calculatedrisk
1559,2017-07-02 16:24:00,"June 2016: Unofficial Problem Bank list declines to 137 Institutions, Q2 2017 Transition Matrix    ",0,0,0,0,1,5,0.018250477,0.8900423,0.091707155,Neg,-0.87179184,calculatedrisk
1560,2017-07-01 13:17:00,"Schedule for Week of July 2, 2017    ",0,0,0,0,0,0,0.020515729,0.104874454,0.87460977,Neu,-0.08435872,calculatedrisk
1561,2017-06-30 22:08:00,"Vehicle Sales Forecast: ""Sixth Consecutive Decline in June""  ",0,0,0,0,1,3,0.011708414,0.97319025,0.015101387,Neg,-0.9614818,calculatedrisk
1562,2017-06-30 18:04:00,"U.S. Births decreased in 2016, Women 30-34 Now have Highest Birth Rate    ",1,1,0,0,6,5,0.022600533,0.9128559,0.06454355,Neg,-0.8902554,calculatedrisk
1563,2017-06-30 17:59:00,"Interesting, based on preliminary 2016 data, U.S. Births decreased in 2016, Women 30-34 Now have Highest Birth Rate   ",1,1,0,0,3,1,0.024134453,0.9193396,0.056525994,Neg,-0.89520514,calculatedrisk
1565,2017-06-30 15:09:00,"Chicago PMI Increases in June, Highest in Three Years  ",0,1,0,0,1,0,0.9272206,0.040668853,0.03211054,Pos,0.88655174,calculatedrisk
1567,2017-06-30 01:57:00,"Friday: Personal Income and Outlays, Chicago PMI  ",0,0,0,0,1,1,0.03194658,0.06652553,0.9015279,Neu,-0.034578945,calculatedrisk
1569,2017-06-29 17:21:01,"Reis: Office Vacancy Rate ""flat"" in Q2 at 16.0%    ",0,0,0,1,0,3,0.021563837,0.93985486,0.038581297,Neg,-0.91829103,calculatedrisk
1571,2017-06-29 13:41:00,"Weekly Initial Unemployment Claims increase to 244,000    ",0,0,0,2,3,2,0.6240359,0.31658366,0.059380528,Pos,0.30745223,calculatedrisk
1572,2017-06-29 01:58:00,"Thursday: Unemployment Claims, GDP  ",0,0,0,0,0,0,0.023358366,0.748071,0.22857061,Neg,-0.72471267,calculatedrisk
1573,2017-06-28 20:25:00,"Zillow Forecast: ""May Case-Shiller Forecast: Expect the Cooldown to Continue""    ",0,1,0,1,2,6,0.44026178,0.032043662,0.5276946,Neu,0.40821812,calculatedrisk
1576,2017-06-28 12:04:00,MBA: Mortgage Applications Decrease in Latest Weekly Survey    ,0,0,0,0,6,1,0.012122477,0.97120786,0.016669696,Neg,-0.9590854,calculatedrisk
1577,2017-06-28 01:29:00,Wednesday: Pending Home Sales  ,0,0,0,0,0,2,0.02464891,0.41191393,0.5634371,Neu,-0.38726503,calculatedrisk
1578,2017-06-27 22:07:01,"Richmond Fed: ""Manufacturers in the Fifth District Improved in June""    ",0,0,0,0,0,5,0.950704,0.02672486,0.022571083,Pos,0.9239791,calculatedrisk
1579,2017-06-27 19:10:02,Real House Prices and Price-to-Rent Ratio in April    ,0,0,0,0,3,5,0.035219897,0.10459896,0.86018115,Neu,-0.06937906,calculatedrisk
1582,2017-06-27 02:17:03,Tuesday: Case-Shiller House Prices  ,0,0,0,0,0,2,0.026549596,0.41350648,0.559944,Neu,-0.38695687,calculatedrisk
1583,2017-06-26 21:32:05,Hanging out at Monarch Beach.     ,0,1,0,1,0,5,0.071224324,0.0908712,0.8379045,Neu,-0.019646876,calculatedrisk
1584,2017-06-26 21:20:02,Hotels: Hotel Occupancy down slightly Year-over-Year    ,0,0,0,0,2,4,0.010058665,0.97323227,0.01670908,Neg,-0.9631736,calculatedrisk
1585,2017-06-26 19:20:04,For Fun: Stock Market as Barometer of Policy Success    ,0,0,0,0,1,3,0.11607501,0.01379677,0.87012815,Neu,0.10227824,calculatedrisk
1587,2017-06-26 15:47:00,"Dallas Fed: ""Texas Manufacturing Continues to Expand but at a Slower Pace"" in June  ",0,0,0,0,1,1,0.7858183,0.060861718,0.15331991,Pos,0.7249566,calculatedrisk
1588,2017-06-26 14:17:03,"Chicago Fed ""Index Points to Slower Economic Growth in May""    ",0,0,0,0,0,2,0.013266623,0.9628888,0.023844529,Neg,-0.94962215,calculatedrisk
1589,2017-06-26 14:14:01,"Merrill on Q2 GDP: ""[Durable Goods] data sliced 0.1pp from 2Q GDP tracking, leaving us at 2.1% qoq saar""",1,1,0,0,1,3,0.072699025,0.904879,0.022422094,Neg,-0.83217996,calculatedrisk
1590,2017-06-26 02:02:03, See you tomorrow!,0,0,0,1,0,1,0.050114997,0.056064665,0.8938204,Neu,-0.0059496686,calculatedrisk
1591,2017-06-26 01:01:00,Sunday Night Futures  ,0,0,0,0,1,2,0.032138318,0.08461431,0.8832473,Neu,-0.05247599,calculatedrisk
1592,2017-06-25 17:18:00,Goldman on the Next Recession  ,0,0,0,0,7,8,0.03203716,0.03181438,0.9361484,Neu,0.00022277981,calculatedrisk
1593,2017-06-24 13:17:00,"Schedule for Week of June 25, 2017    ",0,0,0,0,1,1,0.020038452,0.09621175,0.8837498,Neu,-0.07617329,calculatedrisk
1594,2017-06-23 20:58:00,"Oil Rigs: ""Not dead yet!""    ",0,0,0,0,4,3,0.053408455,0.08135545,0.86523616,Neu,-0.027946997,calculatedrisk
1595,2017-06-23 19:00:02,"Merrill on GDP: ""Hopes for a big fiscal stimulus have faded, prompting us to revise our 2018 GDP growth forecast to 2.1%, down from 2.5%.""",1,1,0,0,1,4,0.008232217,0.9747331,0.017034676,Neg,-0.9665009,calculatedrisk
1596,2017-06-23 17:03:05,A few Comments on May New Home Sales    ,0,0,0,0,0,2,0.026459169,0.056630578,0.91691023,Neu,-0.03017141,calculatedrisk
1597,2017-06-23 15:21:03,"New Home Sales increase to 610,000 Annual Rate in May    ",0,0,0,0,3,1,0.9256289,0.02774835,0.046622843,Pos,0.89788055,calculatedrisk
1598,2017-06-23 00:04:00,Friday: New Home Sales  ,0,0,0,0,2,0,0.043862335,0.06019843,0.89593923,Neu,-0.016336095,calculatedrisk
1599,2017-06-22 19:40:01,U.S. Demographics: The Millennials Take Over    ,0,1,0,0,8,12,0.04062606,0.03757686,0.9217971,Neu,0.0030491985,calculatedrisk
1602,2017-06-22 13:43:01,"Weekly Initial Unemployment Claims increase to 241,000    ",0,0,0,0,0,1,0.7116746,0.23691957,0.051405855,Pos,0.474755,calculatedrisk
1603,2017-06-22 02:02:01,Thursday: Unemployment Claims  ,0,0,0,0,0,4,0.010103762,0.9620325,0.027863786,Neg,-0.95192873,calculatedrisk
1605,2017-06-21 17:45:00,A Few Comments on May Existing Home Sales    ,0,0,0,0,1,2,0.02444399,0.053411897,0.9221442,Neu,-0.028967908,calculatedrisk
1606,2017-06-21 15:23:00,"NAR: ""Existing-Home Sales Rise 1.1 Percent in May""    ",0,0,0,0,4,5,0.9462443,0.025396766,0.028358957,Pos,0.92084754,calculatedrisk
1607,2017-06-21 14:17:03,AIA: Architecture Billings Index positive in May    ,0,0,0,0,3,4,0.90255356,0.023766207,0.07368024,Pos,0.87878734,calculatedrisk
1608,2017-06-21 12:02:00,MBA: Mortgage Applications Increase in Latest Weekly Survey    ,0,0,0,0,0,0,0.8728017,0.09189953,0.03529878,Pos,0.7809022,calculatedrisk
1609,2017-06-21 01:25:00,Wednesday: Existing Home Sales  ,0,0,0,1,2,0,0.03274494,0.06355331,0.9037018,Neu,-0.03080837,calculatedrisk
1610,2017-06-20 22:37:00,"Phoenix Real Estate in May: Sales up 9%, Inventory down 9% YoY  ",0,0,0,0,3,2,0.1769211,0.80119026,0.021888644,Neg,-0.6242691,calculatedrisk
1611,2017-06-20 16:55:00,"Chemical Activity Barometer ""flat"" in June    ",0,0,0,0,0,0,0.022254568,0.93722445,0.04052096,Neg,-0.91496986,calculatedrisk
1612,2017-06-20 15:05:03,"Oil Prices Lower, Down Year-over-year    ",0,0,0,1,1,1,0.036375966,0.95063096,0.012993032,Neg,-0.914255,calculatedrisk
1613,2017-06-20 01:09:00,"Lawler: Single-Family Housing Production ‘Shortfall” All In Modestly Sized, Modestly Price Segment    ",0,0,0,1,6,8,0.019610317,0.90482676,0.07556297,Neg,-0.8852164,calculatedrisk
1614,2017-06-19 19:03:00,Lawler: Early Read on Existing Home Sales in May  ,0,0,0,1,4,2,0.10854318,0.024569547,0.8668873,Neu,0.08397363,calculatedrisk
1615,2017-06-19 16:30:00,Hotels: Hotel Occupancy down Year-over-Year    ,0,1,0,0,2,3,0.007623934,0.9719372,0.02043884,Neg,-0.96431327,calculatedrisk
1616,2017-06-19 14:38:03,Q2 GDP Forecasts being Revised Down  ,1,1,0,0,1,1,0.025494844,0.5215939,0.4529113,Neg,-0.49609908,calculatedrisk
1617,2017-06-19 02:23:03,Sunday Night Futures  ,0,0,0,0,0,0,0.032138318,0.08461431,0.8832473,Neu,-0.05247599,calculatedrisk
1618,2017-06-17 13:19:00,"Schedule for Week of June 11, 2017    ",0,0,0,1,0,0,0.02041065,0.10787078,0.8717186,Neu,-0.08746013,calculatedrisk
1619,2017-06-17 01:29:00,"Oil Rigs: ""Smallest four week add since last year""    ",0,0,0,0,2,7,0.015059869,0.94175464,0.043185413,Neg,-0.92669475,calculatedrisk
1620,2017-06-16 20:51:04,Lawler: Reasonable Population Projections Are Important!    ,0,1,0,1,1,2,0.124106295,0.024714774,0.851179,Neu,0.09939152,calculatedrisk
1621,2017-06-16 18:02:00,Comments on May Housing Starts    ,0,0,0,0,5,4,0.033978146,0.071941376,0.89408046,Neu,-0.03796323,calculatedrisk
1622,2017-06-16 15:27:04,"BLS: Unemployment Rates Lower in 9 states in May, Four States at New Series Lows    ",0,0,0,1,5,3,0.030377086,0.95757127,0.0120516755,Neg,-0.9271942,calculatedrisk
1623,2017-06-16 14:36:00,"Merrill on Q2 GDP forecast: ""Housing starts tumbled 5.5% mom in May ... our 2Q GDP tracking estimate ... down to 2.2%.""",1,1,0,1,2,3,0.0095133865,0.9723715,0.018115083,Neg,-0.96285814,calculatedrisk
1624,2017-06-16 14:20:00,Housing Starts decreased to 1.092 Million Annual Rate in May    ,1,1,0,1,4,6,0.007563382,0.9698636,0.02257303,Neg,-0.96230024,calculatedrisk
1625,2017-06-16 00:48:00,Friday: Housing Starts  ,0,0,0,0,0,1,0.028421244,0.08542761,0.88615113,Neu,-0.057006367,calculatedrisk
1626,2017-06-15 23:25:03,"  when the Fed starts to reduce their balance sheet, shouldn't that raise long rates and steepen the yield curve?",0,1,1,2,0,2,0.051158328,0.5827889,0.36605284,Neg,-0.5316306,calculatedrisk
1627,2017-06-15 22:49:04, I've written extensively on the LFPR.  A couple of samples from 2012:      ,1,1,0,0,0,0,0.03549632,0.03317948,0.9313241,Neu,0.00231684,calculatedrisk
1628,2017-06-15 18:48:05,"Sacramento Housing in May: Sales up 7%, Active Inventory down 14% YoY    ",0,0,0,0,2,2,0.53111327,0.43983254,0.029054185,Pos,0.09128073,calculatedrisk
1629,2017-06-15 16:21:03,Earlier: NY and Philly Manufacturing Surveys Suggest Solid Growth in June    ,0,0,0,0,1,1,0.95060813,0.02777615,0.021615708,Pos,0.922832,calculatedrisk
1631,2017-06-15 14:28:00,Industrial Production Unchanged in May    ,0,0,0,0,2,2,0.04632004,0.73381215,0.21986781,Neg,-0.68749213,calculatedrisk
1632,2017-06-15 13:36:03,"Weekly Initial Unemployment Claims decrease to 237,000    ",0,0,0,1,4,3,0.016803596,0.96062666,0.022569755,Neg,-0.94382304,calculatedrisk
1633,2017-06-14 23:12:00,"Mortgage ""Rates Drop to 8-Month Lows""  ",0,1,0,1,4,5,0.010733892,0.9682312,0.021034824,Neg,-0.9574973,calculatedrisk
1634,2017-06-14 19:21:05,FOMC Projections and Press Conference Link  ,0,0,0,0,0,0,0.024320614,0.0468719,0.92880744,Neu,-0.022551287,calculatedrisk
1635,2017-06-14 19:08:00,FOMC Statement: 25bps Rate Hike  ,0,0,0,0,1,1,0.19558148,0.06843817,0.7359804,Neu,0.12714331,calculatedrisk
1636,2017-06-14 16:20:00,Key Measures Show Inflation mostly below 2% in May    ,0,0,0,0,3,5,0.025091436,0.83788615,0.1370224,Neg,-0.81279474,calculatedrisk
1637,2017-06-14 13:54:03,"With weak retail can CPI, the Fed meeting is more interesting ...",0,1,1,0,1,4,0.09866509,0.14017619,0.76115876,Neu,-0.041511104,calculatedrisk
1639,2017-06-14 12:09:00,MBA: Mortgage Applications Increase in Latest Weekly Survey    ,0,0,0,0,2,4,0.8728017,0.09189953,0.03529878,Pos,0.7809022,calculatedrisk
1640,2017-06-14 00:09:00,"Wednesday: FOMC, Retail Sales, CPI  ",0,0,0,0,0,1,0.026843531,0.05457218,0.9185843,Neu,-0.027728649,calculatedrisk
1642,2017-06-13 17:08:01,Update: Real Estate Agent Boom and Bust    ,0,0,0,1,4,6,0.034962222,0.21030313,0.7547347,Neu,-0.1753409,calculatedrisk
1643,2017-06-13 16:29:05,"Merrill on Q2 GDP: ""the PPI data sliced 0.2pp from 2Q GDP tracking, leaving us at 2.3% qoq saar"".",1,1,0,0,1,2,0.054123346,0.9297724,0.01610424,Neg,-0.87564903,calculatedrisk
1644,2017-06-13 14:30:00,NFIB: Small Business Optimism Index unchanged in May    ,0,0,0,1,1,1,0.021239044,0.9341429,0.044617973,Neg,-0.91290385,calculatedrisk
1645,2017-06-13 00:03:00,"Tuesday: Small Business Survey, PPI  ",0,0,0,0,0,0,0.028280467,0.10226314,0.86945635,Neu,-0.07398267,calculatedrisk
1646,2017-06-12 16:50:04,Q2 GDP Forecasts  ,0,0,0,0,0,2,0.027201511,0.08817304,0.8846255,Neu,-0.06097153,calculatedrisk
1648,2017-06-12 01:03:00,Sunday Night Futures  ,0,0,0,0,0,2,0.032138318,0.08461431,0.8832473,Neu,-0.05247599,calculatedrisk
1649,2017-06-11 18:07:05,FOMC Preview  ,0,0,0,0,1,4,0.041992716,0.03789034,0.92011696,Neu,0.0041023754,calculatedrisk
1650,2017-06-10 22:47:00,Goldman: FOMC Preview  ,0,0,0,0,0,4,0.026033953,0.03416283,0.9398032,Neu,-0.008128878,calculatedrisk
1651,2017-06-10 13:15:00,"Schedule for Week of June 11, 2017    ",0,0,0,0,2,0,0.02041065,0.10787078,0.8717186,Neu,-0.08746013,calculatedrisk
1652,2017-06-09 20:45:00,Merrill FOMC Preview  ,0,0,0,0,0,0,0.03556339,0.02492319,0.9395134,Neu,0.0106402,calculatedrisk
1653,2017-06-09 17:28:00,Mortgage Equity Withdrawal slightly negative in Q1    ,0,0,0,0,3,1,0.019767018,0.96846527,0.011767762,Neg,-0.9486982,calculatedrisk
1654,2017-06-09 15:25:00,"Goldman: ""Prices and Risks in Commercial Real Estate""    ",0,0,0,0,2,1,0.04249077,0.027874596,0.9296346,Neu,0.014616173,calculatedrisk
1656,2017-06-08 21:03:00,Leading Index for Commercial Real Estate Increases in May    ,0,1,0,0,2,6,0.8766717,0.021250801,0.102077454,Pos,0.8554209,calculatedrisk
1659,2017-06-08 13:46:04,"Weekly Initial Unemployment Claims decrease to 245,000    ",0,0,0,0,2,2,0.017203674,0.96021354,0.022582747,Neg,-0.94300985,calculatedrisk
1660,2017-06-08 01:00:00,"Thursday: Unemployment Claims, Q1 Flow of Funds Report  ",0,0,0,0,0,0,0.025864894,0.6457319,0.32840317,Neg,-0.619867,calculatedrisk
1661,2017-06-07 21:03:00,Prime Working-Age Population near 2007 Peak    ,0,0,0,1,2,10,0.62861603,0.044878267,0.3265057,Pos,0.5837378,calculatedrisk
1662,2017-06-07 15:46:00,"Zillow Forecast: ""Zillow’s April Case-Shiller forecast expects growth of 5.6 percent in the national index""    ",1,1,0,1,1,0,0.89264524,0.0106228655,0.096731886,Pos,0.8820224,calculatedrisk
1663,2017-06-07 12:06:00,MBA: Mortgage Applications Increase in Latest Weekly Survey    ,0,0,0,0,6,3,0.8728017,0.09189953,0.03529878,Pos,0.7809022,calculatedrisk
1664,2017-06-06 22:27:04,30 Year Fixed Mortgage Rates Fall Below 4%  ,0,1,0,0,3,4,0.009209482,0.9406599,0.050130643,Neg,-0.9314504,calculatedrisk
1665,2017-06-06 19:47:01,Update: Framing Lumber Prices Up Year-over-year    ,0,1,0,0,3,4,0.7352526,0.20089872,0.063848674,Pos,0.5343539,calculatedrisk
1667,2017-06-06 14:37:00,I'll be there on a panel with    and      ,0,0,1,1,6,11,0.046500683,0.02396732,0.929532,Neu,0.022533363,calculatedrisk
1668,2017-06-06 14:35:00,CoreLogic: House Prices up 6.9% Year-over-year in April    ,0,1,0,2,5,2,0.9546032,0.021533672,0.023863167,Pos,0.9330695,calculatedrisk
1669,2017-06-06 13:05:00,"Las Vegas Real Estate in May: Sales up 28% YoY, Inventory down Sharply  ",0,0,0,0,2,3,0.029745108,0.9584449,0.011810059,Neg,-0.9286998,calculatedrisk
1670,2017-06-05 23:25:00,Tuesday: Job Openings  ,0,0,0,0,0,0,0.018539265,0.90145224,0.080008514,Neg,-0.882913,calculatedrisk
1671,2017-06-05 20:19:00,Hotels: Hotel Occupancy up Year-over-Year    ,0,0,0,0,5,3,0.7615926,0.20776732,0.030640023,Pos,0.5538253,calculatedrisk
1672,2017-06-05 16:40:00,"Black Knight Mortgage Monitor: ""Q1 2017 Originations Fall 34 Percent, Led By 45 Percent Drop in Refinance Lending""    ",0,0,0,3,5,5,0.009415062,0.97534126,0.015243675,Neg,-0.9659262,calculatedrisk
1673,2017-06-05 00:08:00,Sunday Night Futures  ,0,0,0,0,0,1,0.032138318,0.08461431,0.8832473,Neu,-0.05247599,calculatedrisk
1674,2017-06-03 13:16:00,"Schedule for Week of June 4, 2017    ",0,0,0,0,2,1,0.020926336,0.10603922,0.8730344,Neu,-0.085112885,calculatedrisk
1675,2017-06-03 01:16:00,"Goldman Friday PM: ""Profit margins are at risk ... the trends are all wrong-way for corporate profits margins.""",0,1,0,2,9,21,0.01519735,0.94472975,0.040072888,Neg,-0.9295324,calculatedrisk
1676,2017-06-02 23:36:00,This is my Congessman.  I hope to fix this in the next election.  ,0,1,0,3,13,29,0.09723665,0.029864075,0.87289935,Neu,0.067372575,calculatedrisk
1677,2017-06-02 22:37:00,"Oil: ""A middling week for rig additions""    ",0,0,0,0,3,1,0.03897943,0.76014596,0.20087466,Neg,-0.72116655,calculatedrisk
1678,2017-06-02 19:15:04,"Public and Private Sector Payroll Jobs: Carter, Reagan, Bush, Clinton, Bush, Obama, Trump    ",0,0,0,1,6,9,0.028209923,0.21239145,0.75939864,Neu,-0.18418153,calculatedrisk
1679,2017-06-02 17:02:05,Trade Deficit increase to $47.6 Billion in April    ,0,0,0,1,1,2,0.8787344,0.09216235,0.029103158,Pos,0.78657204,calculatedrisk
1680,2017-06-02 15:09:05,Comment: A Disappointing Employment Report    ,0,0,0,0,4,3,0.01138744,0.9721314,0.016481249,Neg,-0.9607439,calculatedrisk
1681,2017-06-02 13:48:04,"May Employment Report: 138,000 Jobs, 4.3% Unemployment Rate    ",0,0,0,0,2,4,0.014175783,0.9572246,0.028599646,Neg,-0.94304883,calculatedrisk
1682,2017-06-02 01:45:03,"Friday: Employment Report, Trade Deficit  ",0,0,0,0,0,0,0.025630888,0.67095155,0.3034175,Neg,-0.64532065,calculatedrisk
1683,2017-06-01 23:03:05,Goldman: May Payrolls Preview  ,0,0,0,0,1,1,0.019785112,0.71461034,0.26560456,Neg,-0.69482523,calculatedrisk
1684,2017-06-01 21:08:00,U.S. Light Vehicle Sales at 16.6 million annual rate in May    ,0,0,0,1,9,5,0.10602464,0.1277082,0.7662672,Neu,-0.021683559,calculatedrisk
1685,2017-06-01 19:14:03,"Goldman: ""We estimate nonfarm payrolls increased by 170k in May ... the unemployment rate remained stable at 4.4%""",1,1,0,0,1,1,0.9315346,0.04823278,0.020232625,Pos,0.8833018,calculatedrisk
1686,2017-06-01 18:03:04,May Employment Preview  ,0,0,0,0,0,3,0.057462595,0.35129097,0.59124637,Neu,-0.29382837,calculatedrisk
1687,2017-06-01 17:07:04,Early May Auto Sales: 16.8 million SAAR,0,0,0,1,3,3,0.159229,0.08045336,0.7603176,Neu,0.07877564,calculatedrisk
1689,2017-06-01 13:39:00,"Weekly Initial Unemployment Claims increase to 248,000    ",0,0,0,1,3,2,0.72832125,0.21325119,0.058427535,Pos,0.5150701,calculatedrisk
1691,2017-06-01 00:32:03,"Thursday: Unemployment Claims, ADP Employment, ISM Mfg, Construction Spending, Auto Sales  ",0,0,0,0,0,0,0.023465153,0.24028188,0.73625296,Neu,-0.21681672,calculatedrisk
1693,2017-05-31 19:14:04,"Fed's Beige Book: Modest to Moderate expansion, Labor markets ""Tighten""  ",0,0,0,0,0,0,0.022978727,0.9236679,0.053353384,Neg,-0.9006892,calculatedrisk
1694,2017-05-31 16:18:03,Chicago PMI decreases in May  ,0,1,0,0,0,2,0.014148816,0.9604097,0.025441535,Neg,-0.94626087,calculatedrisk
1696,2017-05-31 12:06:03,MBA: Mortgage Applications Decrease in Latest Weekly Survey    ,0,0,0,0,0,1,0.012122477,0.97120786,0.016669696,Neg,-0.9590854,calculatedrisk
1697,2017-05-31 00:30:00,"Wednesday: Chicago PMI, Pending Home Sales, Beige Book  ",0,0,0,0,0,0,0.04542756,0.2994565,0.65511584,Neu,-0.25402895,calculatedrisk
1698,2017-05-30 20:27:00,A few comments on the Seasonal Pattern for House Prices    ,0,0,0,0,3,3,0.028107576,0.08488584,0.8870065,Neu,-0.056778267,calculatedrisk
1699,2017-05-30 17:35:00,"Dallas Fed: ""Texas Manufacturing Expansion Picks Up Pace"" in May    ",0,0,0,0,2,3,0.8374991,0.01903613,0.14346477,Pos,0.81846297,calculatedrisk
1700,2017-05-30 15:56:00,Real House Prices and Price-to-Rent Ratio in March    ,0,0,0,1,2,8,0.037828565,0.12146295,0.8407085,Neu,-0.083634384,calculatedrisk
1703,2017-05-30 12:05:03,"Black Knight: House Price Index up 1.3% in March, Up 5.8% year-over-year  ",0,0,0,1,0,3,0.9463681,0.028537594,0.025094341,Pos,0.9178305,calculatedrisk
1704,2017-05-30 01:07:00,"Tuesday: Personal Income and Outlays, Case-Shiller House Prices  ",0,0,0,0,0,0,0.021778105,0.10929893,0.86892295,Neu,-0.08752082,calculatedrisk
1707,2017-05-29 16:11:05,Hotels: Hotel Occupancy Rate Flat Year-over-Year    ,0,0,0,1,1,6,0.036154248,0.82186306,0.14198276,Neg,-0.7857088,calculatedrisk
1708,2017-05-28 17:20:00,May 2017: Unofficial Problem Bank list declines to 140 Institutions  ,0,0,0,0,2,2,0.012394106,0.9469888,0.04061705,Neg,-0.9345947,calculatedrisk
1709,2017-05-27 13:17:00,"Schedule for Week of May 28, 2017    ",0,0,0,0,1,1,0.020265069,0.10697791,0.872757,Neu,-0.08671284,calculatedrisk
1710,2017-05-27 00:08:00,Vehicle Sales Forecast: Sales below 17 Million SAAR in May  ,0,0,0,0,2,3,0.028901506,0.8543685,0.116729975,Neg,-0.825467,calculatedrisk
1711,2017-05-26 19:48:00,Freddie Mac: Mortgage Serious Delinquency rate unchanged in April    ,0,0,0,0,3,2,0.06233697,0.72280747,0.21485558,Neg,-0.6604705,calculatedrisk
1712,2017-05-26 17:02:00,Q2 GDP Forecasts  ,0,0,0,0,0,4,0.027201511,0.08817304,0.8846255,Neu,-0.06097153,calculatedrisk
1714,2017-05-26 15:00:04,"Nomura on May employment report: ""We expect NFP 195k in May and the unemployment rate to have inched down to 4.3%""",1,1,0,0,2,1,0.012660935,0.97096384,0.016375244,Neg,-0.9583029,calculatedrisk
1715,2017-05-26 03:05:00,Friday: GDP  ,0,0,0,0,0,1,0.05456347,0.06539723,0.88003933,Neu,-0.010833763,calculatedrisk
1718,2017-05-25 13:41:03,"Weekly Initial Unemployment Claims increase to 234,000    ",0,0,0,0,5,3,0.658731,0.27966684,0.061602168,Pos,0.37906414,calculatedrisk
1719,2017-05-25 01:35:02,  The Gallatin County Sheriffs Office is currently investigating allegations of an assault involving Greg Gianforte.  ,0,1,0,0,1,2,0.022862935,0.810369,0.16676803,Neg,-0.7875061,calculatedrisk
1720,2017-05-25 00:17:00,Thursday: Unemployment Claims  ,0,0,0,0,0,0,0.010103762,0.9620325,0.027863786,Neg,-0.95192873,calculatedrisk
1722,2017-05-24 19:13:00,FOMC Minutes: More details on Balance Sheet Reduction  ,0,1,0,1,0,2,0.023106828,0.038026944,0.9388662,Neu,-0.0149201155,calculatedrisk
1723,2017-05-24 17:02:00,A Few Comments on April Existing Home Sales    ,0,0,0,0,0,1,0.024323605,0.05771307,0.9179633,Neu,-0.033389464,calculatedrisk
1724,2017-05-24 16:21:00,AIA: Architecture Billings Index positive in April    ,0,0,0,0,1,3,0.91414315,0.023178186,0.06267866,Pos,0.890965,calculatedrisk
